created_at,id_str,full_text,quote_count,reply_count,retweet_count,favorite_count,lang,user_id_str,conversation_id_str,username,tweet_url,image_url,location,keyword
2023-12-29 15:32:43+07:00,1740652052836155887,🏅 BIGGER BLOKES OF THE YEAR 2023 🏅  4. Amin Mirzazadeh 🇮🇷 A golden year for the Iranian wrestler  taking first places in the Asian Games  Grand Prixs and at the World Championships  where he beat the reigning champion to win 🥇. We're sure to see him at the Olympics in 2024. https://t.co/lmDvsI7EN1,0,1,22,245,en,1074974921510522881,1740652052836155887,BiggerBlokes,https://twitter.com/BiggerBlokes/status/1740652052836155887,https://pbs.twimg.com/media/GCgIRB-XkAA1Vc1.jpg,,Akronim
2023-12-29 15:33:50+07:00,1740652333472886855,honestly  what Pak Anies has been done for his campaign so far has moved me to tears. in the way that even when he not gonna win this time.. turns out... no matter how little  there is still hope.,20,10,458,2875,en,1724065503721947136,1740652333472886855,bbwimybeloved,https://twitter.com/bbwimybeloved/status/1740652333472886855,,she/her,Pres
2023-12-29 15:35:09+07:00,1740652662042058963,Apa kita sedang tidak baik-baik saja? Entah lah.. hukum yg harus nya jadi pelindung :(  [[ Siang Ahok Miftah Mahasiswa Aceh Rohingya UNHCR Kavi Desak Anies Muhaimin Iskandar ASAL BUKAN 02 Skandal Selingkuh Pramugari Pilot ]] https://t.co/ekylD5Hrcw,0,0,2,9,in,950989247065948160,1740652662042058963,angelia1794,https://twitter.com/angelia1794/status/1740652662042058963,https://pbs.twimg.com/media/GCgKT4ZboAAvAKA.jpg,Rumah Sakit Bersalin,Wapres
2023-12-29 15:35:46+07:00,1740652819861139734,Amin 🍀 https://t.co/WsdD6Jjeya,1,8,5,177,en,121106168,1740652819861139734,ynihaly,https://twitter.com/ynihaly/status/1740652819861139734,https://pbs.twimg.com/media/GCgKguBWMAAOwi4.jpg,༺♡༻Hayatım 𓆩❤︎𓆪 GoyGoy༺♡༻,Akronim
2023-12-29 15:37:15+07:00,1740653192441115118,Purify your heart. Take the spite out of it. Your heart is a small organ. When you fill it with hatred  you’re preventing it from being filled with the love of the Almighty. May Allah protect and guide us all (Amin)🤲🤲,0,25,26,41,en,1337663713239773184,1740653192441115118,Gimbiyahmmm,https://twitter.com/Gimbiyahmmm/status/1740653192441115118,,"Abuja, Nigeria",Akronim
2023-12-29 15:37:38+07:00,1740653287836447018,Zulhas Dilaporkan Penistaan Agama oleh Ketua Tim Hukum Timnas AMIN..  Tdk boleh ada yg diatasi hukum  KAWAL!!  https://t.co/gCkEJrLEsE,6,25,588,1669,in,1006827831995711488,1740653287836447018,ekowboy2,https://twitter.com/ekowboy2/status/1740653287836447018,,,Pres
2023-12-29 15:42:10+07:00,1740654429215551714,Pak Anies Baswedan Dialog bersama Tokoh Tuban - Bojonegoro  #AMINAjaDulu  #AniesMuhaimin2024 https://t.co/ey6FVilcVi,8,21,526,1428,in,1334853481019056128,1740654429215551714,Mdy_Asmara1701,https://twitter.com/Mdy_Asmara1701/status/1740654429215551714,https://pbs.twimg.com/ext_tw_video_thumb/1740654282981158912/pu/img/G5Ml9A9a36WFzeYo.jpg,Jakarta Capital Region,Pres
2023-12-29 15:47:38+07:00,1740655804460437700,Cawapres 01 Muhaimin Iskandar (Cak Imin) ikut mengomentari pencopotan Ketua Pengurus Wilayah Nahdlatul Ulama (PWNU) Jawa Timur  Kiai Marzuqi Mustamar. Ia menilai pencopotan itu merugikan PBNU. #pemilupedia #newsupdate #update #news #videonews https://t.co/aIL3T9Yz43 https://t.co/AgaiviXcHe,4,8,147,487,in,759692754985242625,1740655804460437700,kumparan,https://twitter.com/kumparan/status/1740655804460437700,https://pbs.twimg.com/ext_tw_video_thumb/1740655649246081024/pu/img/s9762dv3tItk7-MY.jpg,,Wapres
2023-12-29 15:47:47+07:00,1740655843249730014,@vindddaaaa Come on Indonesia  give him a chance.  Sayang banget klo org kek pak Anies ngga jd presiden  dkalahin ma org spt gemoy singkong dan Samsul.,3,10,102,1161,in,1119881742121181184,1740617330462454101,FstrongW,https://twitter.com/FstrongW/status/1740655843249730014,,,Pres
2023-12-29 15:50:12+07:00,1740656452291944535,"@MardaniAliSera Pak  itu kalimatnya mgk kurang memuat banyak janji Anies-Muhaimin yang tidak akurat"". kurang kata ""TIDAK"" nya.""",0,4,0,49,in,2403574648,1740648056197099903,asfan_warah,https://twitter.com/asfan_warah/status/1740656452291944535,,,Wapres
2023-12-29 15:52:39+07:00,1740657069102137683,@tvOneNews Pertumbuhan Kota ini lebih dari kota-kota yang lainnya  Anies Baswedan &amp; Muhaimin Iskandar https://t.co/x4t40ZtTDo,0,0,0,0,in,1684726137652649984,1740297121902072095,babfgirl,https://twitter.com/babfgirl/status/1740657069102137683,https://pbs.twimg.com/ext_tw_video_thumb/1740656773743439872/pu/img/hzGTZayvrOJNWlGS.jpg,TVA ,Wapres
2023-12-29 15:53:05+07:00,1740657175608045662,Cawapres Muhaimin iskandar menjanjikan penyediaan pupuk  pakan  dan pasar untuk para petambak saat berkampanye di Gresik. https://t.co/xgFY4tAv9N,1,1,0,1,in,23343960,1740657175608045662,kompascom,https://twitter.com/kompascom/status/1740657175608045662,,Jakarta,Wapres
2023-12-29 15:53:33+07:00,1740657293925171277,Gak mungkin lah penculik jadi presiden.   Tanya @AgumGumelar18  https://t.co/XXSiVMNKZg,1,1,0,0,in,1081332408,1740657293925171277,Curang16,https://twitter.com/Curang16/status/1740657293925171277,,Indonesia,Wapres
2023-12-29 15:53:54+07:00,1740657383456772444,@Malika6027 THE NEXT PRESIDEN RI. Semoga Allah SWT Mengaminkan 2024-2029 Anies Rasyid Baswedan &amp; Muhaimin Iskandar Akan Memimpin Negara Republik Indonesia Yang Adil &amp; Sejahtera 👍👍👍 https://t.co/N1aT029Lod,0,0,2,2,in,2989377332,1740351488185278893,indratobing77,https://twitter.com/indratobing77/status/1740657383456772444,https://pbs.twimg.com/ext_tw_video_thumb/1740657371834396672/pu/img/WWENSUwwjViotgxF.jpg,"Kota Depok, Jawa Barat",Wapres
2023-12-29 15:54:28+07:00,1740657526704894092,@aniesbaswedan THE NEXT PRESIDEN RI. Semoga Allah SWT Mengaminkan 2024-2029 Anies Rasyid Baswedan &amp; Muhaimin Iskandar Akan Memimpin Negara Republik Indonesia Yang Adil &amp; Sejahtera 👍👍👍 https://t.co/wnqw4rU8GI,2,2,7,38,in,2989377332,1740647557259559381,indratobing77,https://twitter.com/indratobing77/status/1740657526704894092,https://pbs.twimg.com/ext_tw_video_thumb/1740657514155548672/pu/img/d0NWQKQIBIDUL-3P.jpg,"Kota Depok, Jawa Barat",Wapres
2023-12-29 15:54:42+07:00,1740657582325571785,Dulu ngomong nya begini  tapi akhir nya begitu.. makin kesini makin kesono  entah lah. Kursi nya terlalu nyaman kah ~   [[ Siang Ahok Miftah Mahasiswa Aceh Rohingya UNHCR Kavi Desak Anies Muhaimin Iskandar ASAL BUKAN 02 Skandal Selingkuh Pramugari Pilot ]] https://t.co/1HGySygNHA,0,0,2,13,in,950989247065948160,1740657582325571785,angelia1794,https://twitter.com/angelia1794/status/1740657582325571785,https://pbs.twimg.com/ext_tw_video_thumb/1740655535589072896/pu/img/APOFxT3HfycT5BxS.jpg,Rumah Sakit Bersalin,Pres
2023-12-29 15:56:21+07:00,1740657997934981214,@aniesbaswedan THE NEXT PRESIDEN RI. Semoga Allah SWT Mengaminkan 2024-2029 Anies Rasyid Baswedan &amp; Muhaimin Iskandar Akan Memimpin Negara Republik Indonesia Yang Adil &amp; Sejahtera 👍👍👍 https://t.co/KdORWtgsTV,0,1,2,6,in,2989377332,1740341985045856436,indratobing77,https://twitter.com/indratobing77/status/1740657997934981214,https://pbs.twimg.com/ext_tw_video_thumb/1740657984882253824/pu/img/uuvgtHEF4Ft1ZwPx.jpg,"Kota Depok, Jawa Barat",Wapres
2023-12-29 15:58:43+07:00,1740658593710719460,Nyoh...... Kaya Gini Dalam Rangka Kampanye Ga ?? Jangan Belagak Pilon ! ✅ RT Kerassss✊✊ @naaooollll @Mdy_Asmara1701 @BosPurwa @Lisaamartatara6 https://t.co/S0Ubdxmw8Q,132,140,862,1014,in,1335552103457034240,1740658593710719460,SOBAT_ANIES,https://twitter.com/SOBAT_ANIES/status/1740658593710719460,https://pbs.twimg.com/ext_tw_video_thumb/1740658552400908288/pu/img/nfMrk7npLUyjYPOu.jpg,"Surakarta, Jawa Tengah",Pres
2023-12-29 16:00:00+07:00,1740658916353343735,Anies Baswedan  menceritakan momen sebelum dirinya berpasangan dengan Muhaimin Iskandar (Cak Imin). Disebutkan oleh Anies  ia mendapat pesan dari kiai terkait pilihan tersebut. https://t.co/sedr3k5r8G,3,60,109,423,in,69183155,1740658916353343735,detikcom,https://twitter.com/detikcom/status/1740658916353343735,https://pbs.twimg.com/ext_tw_video_thumb/1740634462810152960/pu/img/djufrAM2Ggi3_yDe.jpg,"Jakarta, Indonesia",Wapres
2023-12-29 16:00:04+07:00,1740658934162354201,@MardaniAliSera Oh Gua pikir bener  kalau HOAX ya tambah malaslah pilih Anies - Muhaimin...🙏🙏,0,21,0,8,in,1435097138724102148,1740648056197099903,ekodj373,https://twitter.com/ekodj373/status/1740658934162354201,,,Pres
2023-12-29 16:03:45+07:00,1740659861778739221,Lambe Waras: Anies Mulai Mengudara Di Tiktok Untuk Mengubah Polapikir Anak Muda Yang Tadinya Teracuni Dengan Cungar Cengir dan Jogad Joged Sehingga Menjadi Terbuka Wawasannya Untuk Berpikir Tentang PERUBAHAN INDONESIA.  #AMINAjaDulu,9,26,481,1485,in,2905814730,1740659861778739221,abu_waras,https://twitter.com/abu_waras/status/1740659861778739221,,"Bima Sakti, Bumi, Indonesia",Pres
2023-12-29 16:04:59+07:00,1740660171964293194,Calon Presiden nomor urut 1 Anies Baswedan  @aniesbaswedan ungkapkan rasa prihatin atas situasi yang berkembang saat ini di Jayapura. Ia menyebut tanah papua yang sebenarnya kaya. kini sudah lelah dengan kekerasan.  Download #metrotvxtend di app store &amp; play store  #aniesbaswedan… https://t.co/fb4upH4TQ4,6,17,245,652,in,57261519,1740660171964293194,Metro_TV,https://twitter.com/Metro_TV/status/1740660171964293194,https://pbs.twimg.com/ext_tw_video_thumb/1740659757562855424/pu/img/CsGE5kg3tNM9IYxr.jpg,,Pres
2023-12-29 16:06:51+07:00,1740660643576123876,Amin 🤲 🤲 🤲,0,0,3,8,en,913721706644111371,1740660643576123876,HACI_2072,https://twitter.com/HACI_2072/status/1740660643576123876,,Republic of Türkiye 🇹🇷,Akronim
2023-12-29 16:07:09+07:00,1740660717899178486,Sdh diduga acara Desak Anies akan menemui hambatan termasuk teriakan2 nomor paslon lain di depan Anies. Desak Anies menanjak trendnya. Cuma itu cara mrk menghadang laju Desak Anies yg kian fenomenal  Desah Dengki. Ga ada lagi. 🤷🏻‍♂️ Mrk phobia Desak Anies krn potensi kalah menguat.,2,7,79,186,in,1301052979852619777,1740660717899178486,MartinusButarb1,https://twitter.com/MartinusButarb1/status/1740660717899178486,,"DKI Jakarta, Indonesia",Pres
2023-12-29 16:07:25+07:00,1740660782172356832,Luar Biasa  Dokter Zam Zanariah Mundur dari ASN Demi Anies Baswedan https://t.co/DlqqBUpAFC,4,11,338,1009,in,1443801854756880385,1740660782172356832,kba_news,https://twitter.com/kba_news/status/1740660782172356832,,,Pres
2023-12-29 16:07:53+07:00,1740660900883992970,@riilovie @mileorphile Menurut kabar Live TikTok nya Pak Anies masih On Hingga pelantikan beliau sebagai Presiden Indonesia tahun depan,0,1,3,121,in,1000799641074520064,1740429986132345224,basribinsidjo,https://twitter.com/basribinsidjo/status/1740660900883992970,,"Bekasi, Jawa Barat",Pres
2023-12-29 16:08:50+07:00,1740661142379282848,Amin https://t.co/GYojBso236,0,0,0,2,en,1445029507568652296,1740661142379282848,omerdzeko,https://twitter.com/omerdzeko/status/1740661142379282848,https://pbs.twimg.com/ext_tw_video_thumb/1740661125140652032/pu/img/dbzQaFWM6RmnCf9m.jpg,iühf,Akronim
2023-12-29 16:13:27+07:00,1740662302700163227,Ketua PWNU Jatim dicopot PBNU  hanya karena mendukung Nahdiyin Muhaimin Iskandar  sebagai cawapres Anies Baswedan.  Rupanya Amin Itu lbh najis dp Benyamin Netanyahu!?..,4,9,115,307,in,30201110,1740662302700163227,alisyarief,https://twitter.com/alisyarief/status/1740662302700163227,,"-6.252543,106.806343",Wapres
2023-12-29 16:14:17+07:00,1740662512692211963,Pak Anies bekerja sangat keras berdialog dengan masyarakat  hal yg gak terlihat dari capres lainnya. Sepertinya mereka sudah pede dengan hasil kali ya.. https://t.co/ZiLN4tJhlN,2,9,96,208,in,1722014606712094720,1740662512692211963,herculep638,https://twitter.com/herculep638/status/1740662512692211963,https://pbs.twimg.com/ext_tw_video_thumb/1740662436393521152/pu/img/UUT7SdN3ZT-GirCb.jpg,,Pres
2023-12-29 16:14:24+07:00,1740662540802338894,Blusukan di Pasar Flamboyan Kalbar  Anies Serap Aspirasi Perubahan Pedagang dan Konsumen https://t.co/ajtg7gN8o9,0,26,37,105,in,1226436091617505281,1740662540802338894,keuangannews_id,https://twitter.com/keuangannews_id/status/1740662540802338894,,,Pres
2023-12-29 16:16:12+07:00,1740662993212633238,@bengkeldodo @99propaganda @BANGSAygSUJUD @Bank_Joee_ @GembiraJabar @_NusantaraLand_ @Alexemeru @alextham878 @EffendiRistriy1 @Lembayung071 @patriktatang Gak kampanye ya Do? https://t.co/LGuVNxbump,5,24,50,116,in,463062044,1740622239006159257,RBugeh,https://twitter.com/RBugeh/status/1740662993212633238,,,Pres
2023-12-29 16:16:57+07:00,1740663183705292836,Reading this autobiography by retired Chief Government Chemist/Head  Gov’t Analytical Lab. On Kay Amin  President Idi’s wife whose death was linked to Amin  the writer says she wasn’t poisoned but died of an abortion gone wrong. More senior citizens should write books. https://t.co/i2g2gSxSdV,6,23,60,217,en,364779820,1740663183705292836,IvanOkuda,https://twitter.com/IvanOkuda/status/1740663183705292836,https://pbs.twimg.com/media/GCgT7VmWIAAa_wF.jpg,"Johannesburg, South Africa",Akronim
2023-12-29 16:17:36+07:00,1740663344917532761,gua merasa pak anies yg taun ini mainnya jauh lebih rapi lebih cantik ya dibanding pilkada 2017,19,43,680,2405,in,157388803,1740663344917532761,niko_junius,https://twitter.com/niko_junius/status/1740663344917532761,,Indonesia,Pres
2023-12-29 16:18:19+07:00,1740663526673518999,pak Anies di Pasar Tempat Pelelangan ikan di Lamongan Jawa timur...Nelayan  Buruh  Petani  Akedemisi Guru  ibu Rumah tangga   UMKM serta berbagai kalangan masyarakat penuh harap negeri ini dapat mewujudkan perubahan hadirnya keadilan dan kesetaraan https://t.co/fsLe2n1Xgr,7,24,626,1432,in,1456283686312103939,1740663526673518999,Yurissa_Samosir,https://twitter.com/Yurissa_Samosir/status/1740663526673518999,https://pbs.twimg.com/ext_tw_video_thumb/1740663496080281600/pu/img/fZp0kcJlF-gXpTcQ.jpg,,Pres
2023-12-29 16:18:39+07:00,1740663612660961578,Membungkam tanpa mempiting  cara cawapres 01  Anies Baswedan n Muhaimin   AMIN keun  ☝️,0,0,7,28,in,1340182378665267200,1740663612660961578,RieGucciano,https://twitter.com/RieGucciano/status/1740663612660961578,,,Wapres
2023-12-29 16:19:12+07:00,1740663748392804386,"Padahal bejibun Buzzer 02 yang jelekin 01  @kikysaputrii kalau lo lihat pake MATA NETRAL""   Ada yang edit Foto Cak imin Ada yang bawa bawa nabi Ada yang nistakan Atribut Agama Ada yang Nistakan Shalat Ada yang Rasis Ke Anies Baswedan  Masih banyak lagi lain nya....""",2,5,33,72,in,1133311906976952320,1740663748392804386,Catatan_ali7,https://twitter.com/Catatan_ali7/status/1740663748392804386,,"Klaten, Jawa Tengah",Pres
2023-12-29 16:20:34+07:00,1740664091856056400,"Awalnya Pendukung Prabowo mencoba memprovokasi kedatangan Pak Anies Di Tempat Pelelangan Ikan Lamongan Jatim. Tapi Akhirnya.. Suara Mereka di Tenggelamkan oleh Suara Pendukung AMIN  Seperti Riak di Terjang Gelombang  https://t.co/PeVgLkphyf""",29,61,594,1340,in,812336286107189249,1740664091856056400,ronaldy596,https://twitter.com/ronaldy596/status/1740664091856056400,https://pbs.twimg.com/ext_tw_video_thumb/1740663442707812352/pu/img/NpHAejk5hzktsp4h.jpg,,Pres
2023-12-29 16:22:47+07:00,1740664652470862105,AMIN https://t.co/PiUSVnuTKv,0,0,0,0,en,1720030900019412992,1740664652470862105,KingAr613406,https://twitter.com/KingAr613406/status/1740664652470862105,https://pbs.twimg.com/media/GCgVRr3boAAsvP0.jpg,,Akronim
2023-12-29 16:22:51+07:00,1740664670057541632,Gempar! Pemasangan Baliho AMIN Mulai dilakukan Secara Masive. Bukan Dilakukan Oleh Timsesnya  Tapi Oleh Jutaan Rakyat Yang Mendukungnya. Bukti Rakyat Sudah Kebelet Ingin Segera PERUBAHAN. https://t.co/2N412ygZB3,66,163,2910,8562,in,2905814730,1740664670057541632,abu_waras,https://twitter.com/abu_waras/status/1740664670057541632,https://pbs.twimg.com/ext_tw_video_thumb/1740356576131923968/pu/img/s4UGzZZ3rRB4ZbmY.jpg,"Bima Sakti, Bumi, Indonesia",Akronim
2023-12-29 16:23:48+07:00,1740664906154959009,Lov pak anies fullll,0,0,0,0,en,1674400986771914752,1740664906154959009,gyupuppiy,https://twitter.com/gyupuppiy/status/1740664906154959009,,,Pres
2023-12-29 16:25:10+07:00,1740665249060340051,@zarryhendrik Dan liat gimana respon pak Anies  tanpa emosi🤪😏 https://t.co/ee1UxKCy2w,0,0,0,1,in,1127561063019339777,1740642896561520735,ipul_ipulll,https://twitter.com/ipul_ipulll/status/1740665249060340051,,Indonesia ,Pres
2023-12-29 16:25:44+07:00,1740665395705749558,when you're in an idgaf competition and your opponent is anies baswedan,0,0,0,19,en,1277445856975675395,1740665395705749558,andfuckseungjin,https://twitter.com/andfuckseungjin/status/1740665395705749558,,follow = block ❤,Pres
2023-12-29 16:26:32+07:00,1740665593316118766,@CNNIndonesia Arahnya sudah pasti  apalagi efek dari kunjungan kemarin  bukan nama prabowo dan Gibran yang diteriakin presiden malah nama Pak Anies 😂😂😂 #AsalBukanPrabowo https://t.co/BbuJxeCD96,6,34,87,290,in,1500181700,1740587660195074329,abahiyanfikri,https://twitter.com/abahiyanfikri/status/1740665593316118766,https://pbs.twimg.com/ext_tw_video_thumb/1740665564778082304/pu/img/sCXE7KjLAY5NUmw0.jpg,"Medan, Indonesia",Pres
2023-12-29 16:28:07+07:00,1740665993406603330,WAIT CAN SOMEONE TELL ME IS ANIES ORANG JAWA OR SUNDA,0,4,0,0,en,2759011481,1740665993406603330,hightided,https://twitter.com/hightided/status/1740665993406603330,,he/him.,Pres
2023-12-29 16:30:34+07:00,1740666610740822360,I miss my mom🥹 May Allah grant her Jannatul firdaus amin,1,17,7,36,en,1723387828002791424,1740666610740822360,FateemahZaarah,https://twitter.com/FateemahZaarah/status/1740666610740822360,,World,Akronim
2023-12-29 16:31:00+07:00,1740666717813035327,Amin https://t.co/XCRLAM4jNb,7,8,1165,2186,en,303027143,1740666717813035327,SantapanMinda,https://twitter.com/SantapanMinda/status/1740666717813035327,https://pbs.twimg.com/media/GAkxP-AbIAA8uGo.jpg,"Selangor, Malaysia",Akronim
2023-12-29 16:31:32+07:00,1740666852702105621,*Ketua Lembaga Kerapatan Adat Minangkabau (LKAM) di Sumbar menyerukan kpd seluruh orang Minang dimanapun berada agar satukan suara utk Anies...                 *Rancak Bana  Bravo Uda Jo Uni🤲🙏🇮🇩* https://t.co/DsmHwjzLeA,67,128,1958,4777,in,1450037307826860039,1740666852702105621,QianzyZ,https://twitter.com/QianzyZ/status/1740666852702105621,https://pbs.twimg.com/ext_tw_video_thumb/1740666820544335873/pu/img/Gp3EvwiYrS7rlCjH.jpg,,Pres
2023-12-29 16:33:08+07:00,1740667256164765940,@VIVAcoid Apakah jurnalis @VIVAcoid tidak pernah belajar jurnalistik? Kok bikin berita goblok banget. Jurnalis itu cuma menyampaikan berita  bukan memberi penilaian. Dari mana jurnalis tau tensi Anies meninggi? Meninggi ndasmu,0,24,27,277,in,1660630931626139651,1740658686031544349,Rionaldiox,https://twitter.com/Rionaldiox/status/1740667256164765940,,,Pres
2023-12-29 16:34:57+07:00,1740667714006638927,Amin Amin,0,0,1,13,en,1510148983,1740667714006638927,mustafademirok5,https://twitter.com/mustafademirok5/status/1740667714006638927,,,Akronim
2023-12-29 16:37:48+07:00,1740668431077081119,TKD Pemenangan AMIN Jawa Barat Adakan Konsolidasi Strategi Anies Baswedan-Muhaimin Iskandar https://t.co/IFmY0AHUoz,0,1,32,75,in,1443801854756880385,1740668431077081119,kba_news,https://twitter.com/kba_news/status/1740668431077081119,,,Wapres
2023-12-29 16:38:32+07:00,1740668615517683943,@tvOneNews Akhirnya Anies Baswedan buka suara Soal JuBir yang ditangkap Kejaksaan  https://t.co/FPcgbPoWRV,0,0,0,0,in,1684726137652649984,1740297121902072095,babfgirl,https://twitter.com/babfgirl/status/1740668615517683943,https://pbs.twimg.com/ext_tw_video_thumb/1740668161106808832/pu/img/lFQT5nVwHefEXvIP.jpg,TVA ,Pres
2023-12-29 16:45:38+07:00,1740670402979070039,GANJAR-MAHFUD SEKOLAH DAPAT GAJI  PASTI KERJA 21 PROGRAM UNGGULAN GANJAR-MAHFUD .  Lulus Langsung K3rja  Sekolah Gratis Ganjar  Jijik  Ahok  PBNU  Muhaimin Iskandar  Jayapura  Ketua PWNU Jawa Timur  Selingkuh  Mahasiswa  UNHCR  Agus  Pagiii  Dosen  CSIS  Arsenal  MorninggUS https://t.co/PdnsD7MqIa,0,0,6,8,in,1244292531090624512,1740670402979070039,YudhaShanny2,https://twitter.com/YudhaShanny2/status/1740670402979070039,https://pbs.twimg.com/media/GCgagbLbQAAcgPr.jpg,Indonesia,Wapres
2023-12-29 16:46:12+07:00,1740670545367306740,@imanlagi Bang saran banyakin konten kampanye  hasil kerja anies di jakarta  msh bnyk orang yg mikir anies gabisa kerja. Sy pengguna transum di jakarta padahal ngerasain bgt hasilnya   susah bgt kalo ngasih tau ke orang yg gapernah pake transum  bilang gaada perubahan karena masih macet-_-,1,3,17,93,in,1635811725198114816,1740654923652722944,puurrpink,https://twitter.com/puurrpink/status/1740670545367306740,,,Pres
2023-12-29 16:46:16+07:00,1740670560563249556,Mantap Pak Anies akan Stop Ekpor Pasir Laut..!! https://t.co/d0GgylVMl7,0,0,31,84,in,1401837073166860291,1740670560563249556,DaengWahidin2,https://twitter.com/DaengWahidin2/status/1740670560563249556,https://pbs.twimg.com/ext_tw_video_thumb/1740670482847076352/pu/img/J5rnMKM1LNm-_D62.jpg,"Jatinegara, Indonesia",Pres
2023-12-29 16:47:40+07:00,1740670914319335874,CALON wakil presiden (cawapres) nomor urut 1 Muhaimin Iskandar (Cak  Imin) mengaku mendapat informasi soal beberapa Kiai - Kiai PKB yang  dibungkam suaranya untuk tidak mendukung dirinya dan Anies Baswedan.   Sumber: https://t.co/rS9BJ5aU4Y,2,5,6,21,in,68930552,1740670914319335874,mediaindonesia,https://twitter.com/mediaindonesia/status/1740670914319335874,,Jakarta - Indonesia,Wapres
2023-12-29 16:49:01+07:00,1740671254062154204,Calon wakil presiden Muhaimin Iskandar mengklaim kalangan Nahdlatul Ulama solid memberikan dukungan kepadanya bersama calon presiden Anies Baswedan.   Namun  Muhaimin menyatakan mendapatkan informasi ada warga NU yang diberikan uang untuk tak mendukung mereka.   #TempoQuotes https://t.co/fCWGyqBosN,9,32,271,788,in,18129942,1740671254062154204,tempodotco,https://twitter.com/tempodotco/status/1740671254062154204,https://pbs.twimg.com/media/GCgbR1qbwAAHgK9.jpg,Indonesia,Pres
2023-12-29 16:49:04+07:00,1740671265042788703,Muhaimin tidak menyebutkan siapa warga NU yang mendapatkan fulus itu. Namun  dia mengaku mendatangi orang tersebut.  https://t.co/ccg7yCWxic,0,0,2,16,in,18129942,1740671254062154204,tempodotco,https://twitter.com/tempodotco/status/1740671265042788703,,Indonesia,Wapres
2023-12-29 16:50:04+07:00,1740671516881342866,@Fahrihamzah AMIN itu sudah tepat  Anies-muhaiMIN. Sulit ya bikin singkatan Prabowo-Gibran  jadinya GEMOY. 🤭😄 Ganjar-Mahfud masih mending disingkat jadi GAMA  meski kurang enak tapi tepat. GAMA juga nama huruf ke-3 abjad Yunani.,0,3,2,19,in,1474735144531468291,1740667897620676740,doncharbone,https://twitter.com/doncharbone/status/1740671516881342866,,,Wapres
2023-12-29 16:50:21+07:00,1740671590638236126,@tvOneNews Berani untuk menghadiri Event Desa Desak Bersama Anies Baswedan di Banyuwangi https://t.co/pvVN2Tlswu,0,0,0,1,in,1684726137652649984,1740297121902072095,babfgirl,https://twitter.com/babfgirl/status/1740671590638236126,https://pbs.twimg.com/ext_tw_video_thumb/1740671285792063488/pu/img/GQP1B0dl0KkRmUKk.jpg,TVA ,Pres
2023-12-29 16:51:00+07:00,1740671751812702458,@Fahrihamzah Beda ANIES baswedan dengan ANIS matta Anies baswedan memperjuangkan nasib rakyat Anis matta memperjuangkan nasib PARTAI...,0,11,1,80,in,1125224467536310272,1740670577139237293,suleizdn,https://twitter.com/suleizdn/status/1740671751812702458,,,Pres
2023-12-29 16:52:15+07:00,1740672067459322299,@Fahrihamzah Semoga bang Fahri Hamzah sehat selalu  untuk menyaksikan pelantikan presiden 2024 Anies Baswedan - Muhaimin,1,5,3,49,in,256850431,1740670577139237293,dodmalmsteen,https://twitter.com/dodmalmsteen/status/1740672067459322299,,Ciledug,Wapres
2023-12-29 16:53:33+07:00,1740672393251807690,@nialubis_ Beliau lagi berjuang  meyakinkan Rakyat Indonesia  bahwasanya perjuangan beliau adalah perjuangan tentang kesetaraan  keadilan  dan kesejahteraan rakyat...  Anies hadir untuk Rakyat...,0,2,3,21,in,827329890,1740550254825758925,Arsad_KR,https://twitter.com/Arsad_KR/status/1740672393251807690,,"Sulawesi Tenggara, Indonesia",Pres
2023-12-29 16:57:50+07:00,1740673471636807856,Anies Presiden Ku ! Muhaimin Wapres Ku ! 2024 - 2029 https://t.co/mwh2yNj4eJ,6,18,463,1374,in,1227719379103571968,1740673471636807856,sutanmangara,https://twitter.com/sutanmangara/status/1740673471636807856,https://pbs.twimg.com/media/GCgdTD9akAAww6k.jpg,Indonesia,Pres
2023-12-29 16:57:55+07:00,1740673494449562069,Saat ke Blambangan kami mencoba Pecel Pitik  kuliner khas Komunitas Osing. Disajikan langsung di atas daun pisang  dan kalau di sana tradisinya makan menggunakan tangan  bikin makannya makin nikmat. Saya diceritakan oleh Pak Usi  Ketua Komunitas Osing  kalau Pecel Pitik ini juga… https://t.co/UlbpDxvW6J,31,104,1297,4397,in,110312278,1740673494449562069,aniesbaswedan,https://twitter.com/aniesbaswedan/status/1740673494449562069,https://pbs.twimg.com/ext_tw_video_thumb/1740657749321736192/pu/img/EdgHzlNePChMe5Pj.jpg,Indonesia,Pres
2023-12-29 16:58:52+07:00,1740673732841005222,On This Blessed Jumma  May Allah Bless You With His Infinite Love And Mercy. May Your Heart Be Filled With Faith  And May You Always Find Strength And Courage In The Face Of Adversity. Amin Ya Allahu 🤍🤲🏻  📸 : @justnaturemusic   Check The Link In My BIO &gt;&gt;&gt; KEEP SUPPORTING 💐💜 https://t.co/X5saOcZTCl,0,0,6,7,en,1662406931120549888,1740673732841005222,reeskyleonews,https://twitter.com/reeskyleonews/status/1740673732841005222,https://pbs.twimg.com/media/GCgdhydXoAAfusK.jpg,"GOD First, Worldwide",Akronim
2023-12-29 17:01:02+07:00,1740674278901850432,pak anies join VLIVE,0,1,0,6,en,1382707400420032520,1740674278901850432,an2tiwi,https://twitter.com/an2tiwi/status/1740674278901850432,,,Pres
2023-12-29 17:03:01+07:00,1740674776723865932,300 Ribu Orang Nonton Live Anies di TikTok https://t.co/AjJCzBWW2X,5,4,127,388,in,887743587579944960,1740674776723865932,OposisiCerdas,https://twitter.com/OposisiCerdas/status/1740674776723865932,,,Pres
