created_at,id_str,full_text,quote_count,reply_count,retweet_count,favorite_count,lang,user_id_str,conversation_id_str,username,tweet_url,image_url,location,keyword
2023-12-29 19:27:50+07:00,1740711220888601041,Pak Anies Baswedan berdialog dengan nelayan saat mengunjungi Tempat Pelelangan Ikan Bronjong  Lamongan  Jumat (29/12/2023).  Nelayan Lamongan Dukung dan Doakan Capres Anies 🤲😊 #AMINAjaDulu https://t.co/AnaDPJ8I4y,3,4,245,690,in,719725925215170561,1740711220888601041,marlina_idha,https://twitter.com/marlina_idha/status/1740711220888601041,https://pbs.twimg.com/ext_tw_video_thumb/1740711094992433152/pu/img/1kjclFxAH00KFsYe.jpg,Jakarta Capital Region,Pres
2023-12-29 19:30:24+07:00,1740711868124344385,Gapoktan se-Banjarnegara Konsolidasi Memenangkan Anies Baswedan-Muhaimin Iskandar https://t.co/uZR7QXH6Lb,2,10,193,531,in,30766806,1740711868124344385,Reiza_Patters,https://twitter.com/Reiza_Patters/status/1740711868124344385,,"Tomage-Fakfak, Indonesia",Pres
2023-12-29 19:31:13+07:00,1740712073242546407,@_BangFu waktu itu di desak anies yg di daerah timur gue lupa dimana  ntb kalo gasalah (cmiiw). ada kok warga yg dateng pake kaos paslon lain terus dikasih kesempatan nanya dia ga diapa²in tuh  aman aman aja. padahal dia disitu udah bilang dia pendukung paslon lain,2,1,0,8,in,1246627017686003713,1740695820390068473,yaallahbingung,https://twitter.com/yaallahbingung/status/1740712073242546407,,"Kota Bandung, Jawa Barat",Pres
2023-12-29 19:31:19+07:00,1740712098488017399,@Arie_Kriting Kan Zarry katanya minta Ahok ikut acara desak Anies  terus kubu Anies mempersilahkan Zarry untuk mengajak Ahok ikut karena acara terbuka tanpa undangan yang penting mendaftar biar panitia menyiapkan kursi.   Yang saya baca timeline nya begitu bang  😊😊,0,6,4,99,in,243998004,1740698982584844649,Ar_910,https://twitter.com/Ar_910/status/1740712098488017399,,solo,Pres
2023-12-29 19:33:25+07:00,1740712624655143272,"Desak Anies mendesak"" Gemoy?  Malem-malam gini iseng lihat perbandingan trend pemberitaan dan percakapan tentang Gemoy dan Desak Anies  di berita online dan Twitter/X.  Hasilnya menarik.   Dalam seminggu terakhir  trend pemberitaan di online news terkait ""Gemoy"" mulai turun… https://t.co/Lac00ojroB""",159,375,1816,7483,in,34075325,1740712624655143272,ismailfahmi,https://twitter.com/ismailfahmi/status/1740712624655143272,https://pbs.twimg.com/media/GCg-c-Ca8AA5Z_Y.jpg,"Jakarta Selatan, DKI Jakarta",Pres
2023-12-29 19:33:57+07:00,1740712757832696205,Kami pasang Spanduk AMIN di jalan Sudirman Jember.  Keren👍😎 😁 Yuk bergerak ✊ #AMINAjaDulu https://t.co/YkhFei8c1N,9,23,489,1459,in,1417489643759710208,1740712757832696205,MissKoral,https://twitter.com/MissKoral/status/1740712757832696205,https://pbs.twimg.com/ext_tw_video_thumb/1740712584112979968/pu/img/mYHFcEX5rR7Rfxga.jpg,"Yogyakarta, Indonesia",Akronim
2023-12-29 19:34:04+07:00,1740712787423514922,Juru bicara Timnas AMIN  Sugeng Bahagijo  ungkap sejumlah alasan Anies-Muhaimin lebih siap mengelola pemerintahan. Menurut Sugeng  Visi Misi Anies-Muhaimin lebih feasible dan nyata. #AMINAjaDulu #AminPalingSiapUntukIndonesia @aniesbaswedan @cakimiNOW @BahagijoSugeng https://t.co/6vszCbRTuO,0,0,5,9,in,1152690460193804289,1740712787423514922,RPKIndonesia,https://twitter.com/RPKIndonesia/status/1740712787423514922,https://pbs.twimg.com/ext_tw_video_thumb/1740710290130714624/pu/img/kJn88dyhZKlpEWy_.jpg,Indonesia,Wapres
2023-12-29 19:37:52+07:00,1740713746857934991,https://t.co/WuChmG3mLH,0,0,0,0,zxx,1444798439338901507,1740713746857934991,MuhaiminArdy,https://twitter.com/MuhaiminArdy/status/1740713746857934991,https://pbs.twimg.com/ext_tw_video_thumb/1740713698480828416/pu/img/Fkn4DMhtHNjla0ba.jpg,"Ngamprah, Indonesia",Wapres
2023-12-29 19:38:54+07:00,1740714006183293356,Mas @aniesbaswedan memang tak kaya dan paling miskin dibanding capres lain Tapi ANIES kayak ide gagasan nyata untuk Indonesia adil dan makmur untuk semua. Rakyat Bergerak Bersama melakukan Gerakan Rakyat buat spanduk Rakyat yg terbuat dari karung beras. Insya Allah 01 MENANG https://t.co/prnbdnMEWs,6,11,319,693,in,1493158746205614080,1740714006183293356,LANGKAHANIES,https://twitter.com/LANGKAHANIES/status/1740714006183293356,https://pbs.twimg.com/ext_tw_video_thumb/1740713435124596737/pu/img/He38stQP2nIFCNTF.jpg,,Pres
2023-12-29 19:42:06+07:00,1740714812739609034,"Tim 01 maunya pake strategi bikin image I'm the father you wish you had😊"" buat Anies""",0,0,0,13,en,1084051929645211650,1740714812739609034,3250mh,https://twitter.com/3250mh/status/1740714812739609034,,,Pres
2023-12-29 19:43:27+07:00,1740715150062338097,AMİN,0,0,1,6,en,1289629422509850624,1740715150062338097,ahmettylmz_,https://twitter.com/ahmettylmz_/status/1740715150062338097,,"Mersin, Türkiye",Akronim
2023-12-29 19:43:51+07:00,1740715252218753511,Stream  https://t.co/jpahQMLQC9,0,0,51,28,en,1179759637240922112,1740715252218753511,Al_aminWizkidFc,https://twitter.com/Al_aminWizkidFc/status/1740715252218753511,,BigWizTravisScottRealmadrid💯,Akronim
2023-12-29 19:45:41+07:00,1740715710719135773,Kasihan ya pendukung 02 itu ga kenal ma junjungannya. Jelas jelas yg datang Anies kok dikira Prabowo. Awokwokwokwok..  #AMINAjaDulu,0,2,3,10,in,303620172,1740715710719135773,Radjahoki_pro,https://twitter.com/Radjahoki_pro/status/1740715710719135773,,"Awantimanu, Ghana",Pres
2023-12-29 19:46:20+07:00,1740715877971226982,Anies's room,0,2,0,1,en,1459533354349465603,1740715877971226982,Cbdweakki,https://twitter.com/Cbdweakki/status/1740715877971226982,,,Pres
2023-12-29 19:46:39+07:00,1740715956819906982,@herculep638 Demi Allah rasa mau nangis dengar pengakuan penjahat ini.  Demikian parah pelaksana Negara ini.  Ya Allah dengarkan doa kami  Menangkan Anies Baswedan.  Biarkan kami melihat dia bekerja  Apakah sesuai dengan janjinya menciptakan perubahan di Indonesia.  Karena yang lain Jelas NO.,0,10,16,144,in,732115060844175360,1740667538743435534,cahayafikiran,https://twitter.com/cahayafikiran/status/1740715956819906982,,Jayapura,Pres
2023-12-29 19:47:22+07:00,1740716137359315080,Berkaca pada survei terbaru dari CSIS  elektabilitas dari pasangan capres-cawapres  Anies Baswedan-Muhaimin Iskandar  masih yang terendah dibandingkan dua pasangan calon lainnya. #Polhuk #AdadiKompas   https://t.co/DH3E7jatFC,0,1,0,1,in,255866913,1740716137359315080,hariankompas,https://twitter.com/hariankompas/status/1740716137359315080,,"Palmerah, Jakarta",Wapres
2023-12-29 19:49:17+07:00,1740716616634257448,Miris aja Lihat Kelakuan Pendukung Wowo teriak -teriak di depan pak Anies Seperti ini saat pak Anies Berkunjung Ke Tempat pelelangan ikan Lamongan Jawa timur  di Pikir Pendukung Wowo ini dengan Seperti itu Pak Anies Terpancing Marah justru pak Anies Santai orangnya https://t.co/uEJgJvfBAc,135,407,410,1728,in,1456283686312103939,1740716616634257448,Yurissa_Samosir,https://twitter.com/Yurissa_Samosir/status/1740716616634257448,https://pbs.twimg.com/ext_tw_video_thumb/1740716593309765632/pu/img/a-T8FDkgMdACdMRy.jpg,,Pres
2023-12-29 19:57:23+07:00,1740718657708405055,.  *KEMANA KITA MELAPOR JIKA ADA KECURANGAN PEMILU 2024 ?*  Kapten Timnas AMIN : Habib Muhammad Syaugi Alaydrus Meminta Para Relawan   *Laporkan Jika Ada Kecurangan :*  *- WA     : 081242424319*    *- Email : timhukumnasional@a-min.id https://t.co/lSkXPPQwqb* https://t.co/d1aoa9aI5x,10,7,481,757,in,3263218255,1740718657708405055,MSApunya,https://twitter.com/MSApunya/status/1740718657708405055,https://pbs.twimg.com/ext_tw_video_thumb/1740718610472108032/pu/img/NQGRnwxSpqPVmCTo.jpg,Jakarta Capital Region,Akronim
2023-12-29 19:57:26+07:00,1740718668026413316,Legend says Mr. Anies Baswedan still do livetstream tiktot till now 😭,0,1,2,12,en,264545020,1740718668026413316,ciroooo17,https://twitter.com/ciroooo17/status/1740718668026413316,,Universe ,Pres
2023-12-29 20:05:06+07:00,1740720597725069334,baru nyadar ya punya wakil yang kaya gtu  kesel sndri kan lo liat nya anies wkwkwk anis ga lama jga struk cawapresnya kaya gini . . #miftah  #PakaiHonestCard #Elmer Desak Anies #selingkuh #discord #Pilot #JulidFiSabilillah #julidfiisabilillah #julidfisabillah #julidfisabililah https://t.co/jrBzFhyQJV,0,20,1,21,in,1713491139909844992,1740720597725069334,MalikaRusdita,https://twitter.com/MalikaRusdita/status/1740720597725069334,https://pbs.twimg.com/ext_tw_video_thumb/1740719690975244288/pu/img/vdhDu0v29TY-s0ab.jpg,,Pres
2023-12-29 20:06:22+07:00,1740720917616173247,Jannah is a home of honour where all Muslims aspire to be. May Allah (SWT) make it a final destination for all US. Amin❤️   Jummah Mubarak 🕌🕋📿💫,2,11,38,74,en,1545968643787395073,1740720917616173247,sarauniya_yahya,https://twitter.com/sarauniya_yahya/status/1740720917616173247,,Nigeria,Akronim
2023-12-29 20:09:37+07:00,1740721735736103413,Thanks remindernya pak anies 👍,0,3,7,21,en,2515431258,1740721735736103413,RanggaWidigda,https://twitter.com/RanggaWidigda/status/1740721735736103413,,,Pres
2023-12-29 20:11:03+07:00,1740722097260032294,Direktur LSI Denny JA Adjie Alfaraby menyebut pasangan nomor 1 Anies Baswedan-Muhaimin Iskandar menempati posisi dua dengan 25 3% dan Ganjar Pranowo-Mahfud MD di posisi ketiga dengan 22 9%.  #Projo #Jokowi #Gibran #Prabowo #PrabowoGibran https://t.co/K5jCaqlt2c,2,26,20,61,in,872175115793858561,1740722097260032294,RcyberProj0,https://twitter.com/RcyberProj0/status/1740722097260032294,https://pbs.twimg.com/media/GChJhYnaIAAu51H.jpg,"Jakarta Capital Region, Indone",Pres
2023-12-29 20:13:35+07:00,1740722734240604427,Pelatih Tim Nasional Pemenangan Anies-Muhaimin (Timnas AMIN) Tamsil Linrung optimistis pasangan calon presiden dan wakil presiden nomor urut 1 Anies B... https://t.co/RGm6jQzav6,1,0,3,11,in,46693036,1740722734240604427,inilahdotcom,https://twitter.com/inilahdotcom/status/1740722734240604427,,,Wapres
2023-12-29 20:17:59+07:00,1740723840488264021,Just collected from @solati_zahra  owlinion  shill your stuff on #solana https://t.co/cUDKA3kIUx,1,1,3,11,en,1519020880558448643,1740723840488264021,AminHayeri,https://twitter.com/AminHayeri/status/1740723840488264021,https://pbs.twimg.com/media/GChLCNtXYAABU7-.jpg,,Akronim
2023-12-29 20:20:17+07:00,1740724418530492576,Tuban  Jawa Timur.   Lagu Yalal Wathon menggema...  Siap mengawal perjuangan Pak Anies dan Gus Imin hingga tuntas Menang di Pilpres 2024.  BerSATU untuk sebuah PERUBAHAN  #AMINAjaDulu #AniesMuhaimin2024 https://t.co/VWDNAKpyDA,9,12,430,1140,in,1132425764622675969,1740724418530492576,BangPino__,https://twitter.com/BangPino__/status/1740724418530492576,https://pbs.twimg.com/ext_tw_video_thumb/1740724359311097856/pu/img/t5_uiEBDP6sMUvC3.jpg,"London, England",Pres
2023-12-29 20:20:29+07:00,1740724471433228691,Wah rame Yaudah saya cuma mau ingetin 14 Februari 2024 jangan lupa pilih Anies Baswedan - Muhaimin Iskandar 🙏🙏🙏,0,3,4,171,in,1493170253995462662,1740699458625839498,kukeKIKEkoke,https://twitter.com/kukeKIKEkoke/status/1740724471433228691,,,Wapres
2023-12-29 20:20:33+07:00,1740724488562680274,Pasangan Calon Presiden Anis dan Muhaimin  bersama dengan PKS  telah menegaskan konsistensi mereka dalam mendukung nilai-nilai demokrasi.  #Demokrasiii,0,0,0,0,in,1727916177480142848,1740724488562680274,afifahsahla2817,https://twitter.com/afifahsahla2817/status/1740724488562680274,,"Jakarta Selatan, DKI Jakarta",Wapres
2023-12-29 20:22:22+07:00,1740724943162413563,Melalui visi dan misi yang diusung  Anis  Muhaimin  dan PKS menunjukkan komitmen mereka yang tak tergoyahkan terhadap prinsip demokrasi.  #Demokrasiii,0,0,0,0,in,1727916177480142848,1740724943162413563,afifahsahla2817,https://twitter.com/afifahsahla2817/status/1740724943162413563,,"Jakarta Selatan, DKI Jakarta",Wapres
2023-12-29 20:22:48+07:00,1740725052583321770,Dalam setiap langkahnya  Anis  Muhaimin  dan PKS selalu menekankan pentingnya menjaga dan memperkuat sistem demokrasi di negara ini.  #Demokrasiii,0,0,0,0,in,1727916177480142848,1740725052583321770,afifahsahla2817,https://twitter.com/afifahsahla2817/status/1740725052583321770,,"Jakarta Selatan, DKI Jakarta",Wapres
2023-12-29 20:23:59+07:00,1740725350295048577,"@ismailfahmi Harus diakui  strategi campaign desak anies"" ini sprtinya cukup efektif meraih simpati gen milenial dan gen-z awal. Karena mereka cenderung melihat capres dari wawasan dan konsep yg ditawarkan. PR selanjutnya bgmna me-reach genz akhir yg dominan aktif di tiktok.""",0,5,5,59,in,1530480135337820161,1740712624655143272,kelapamuda0468,https://twitter.com/kelapamuda0468/status/1740725350295048577,,,Pres
2023-12-29 20:24:24+07:00,1740725457094598894,Terima kasih atas sambutannya yang sangat meriah🙏  Pak Anies Baswedan Temui Kiai  Ustadz dan Wali Santri Ponpes Darul Muttaqin Trenggalek  Jawa Timur   #AMINAjaDulu  #AniesMuhaimin2024 https://t.co/wo6FxJCRbB,4,8,268,739,in,1334853481019056128,1740725457094598894,Mdy_Asmara1701,https://twitter.com/Mdy_Asmara1701/status/1740725457094598894,https://pbs.twimg.com/ext_tw_video_thumb/1740725339347927040/pu/img/ZOUqBT2u0KOJPyGA.jpg,Jakarta Capital Region,Pres
2023-12-29 20:27:25+07:00,1740726213927412199,@are_inismyname @jokowi @seeksixsuck @P4P4B0W0_2024 @bengkeldodo @BANGSAygSUJUD @Bank_Joee_ @florieliciouss @Kimberley_2024 @Ndons_Back @kurawa @Alie_Fahnoor Nih Dana Buatan utk nampung air hujan di zaman kepemimpinan pak Anies. Dana buatan di Jagakarsa perbatasan Depok. Tau Depok ngga. Main dong biar tau. Ini bukan baru rencana tapi sdh terealisir. Jadi bukan baru ngomong doang. https://t.co/57muMJyLsP,0,10,60,265,in,2377644162,1740390281722376536,JokoLipService,https://twitter.com/JokoLipService/status/1740726213927412199,https://pbs.twimg.com/ext_tw_video_thumb/1740726168415055872/pu/img/ld1BrTyr5Mp8kGRu.jpg,Jakarta,Pres
2023-12-29 20:27:38+07:00,1740726269849874633,Soal PKH  Anies-Muhaimin Pastikan Ada Progam Bansos Plus dan Tepat Sasaran https://t.co/iFU1C16mVT,0,0,3,6,in,1443801854756880385,1740726269849874633,kba_news,https://twitter.com/kba_news/status/1740726269849874633,,,Wapres
2023-12-29 20:30:47+07:00,1740727062791647301,Di Medsos X Pendukung 01 Juaranya...  Di Tiktok perlu kita kerjain juga guys...   Pak Anies sudah memulai kemarin malam perdana live Tiktok.   Yuk kita garap tiktok juga...  BP™ sudah kurleb 1 bulan ngerjain Tiktok. Setelah akun pertama tumbang.   https://t.co/jSgua0GLnR https://t.co/OTVNSLlavz,14,36,681,691,in,1132425764622675969,1740727062791647301,BangPino__,https://twitter.com/BangPino__/status/1740727062791647301,https://pbs.twimg.com/media/GChOCNdaIAA3V-e.jpg,"London, England",Pres
2023-12-29 20:31:02+07:00,1740727125139964148,I missed Friday prayer at the masjid I usually pray at tunga today  it’s the most uneasy I’ve felt this whole year! It felt like the whole world was ending  later got prayer at the third masjid I went to.  May Allah keep us firm on the deen &amp; grant us Jannah before we die… Amin!,1,6,9,55,en,714227915538432000,1740727125139964148,moh_mean,https://twitter.com/moh_mean/status/1740727125139964148,,"Minna, Nigeria",Akronim
2023-12-29 20:31:16+07:00,1740727185995190337,"Temen-Temen  Makasih udah nemenin. Ini pemanasan"" 😄😄😅  ""Breaking my record  tgl 28 Desember 2023 ini pertama kali saya live tiktok yeyyy""😁😁  Nantikan edisi ""Temani saya di jalan"" bareng pak Anies lainnya... Bang kapan lagi bangg?? @AnggaPutraF @imanlagi https://t.co/wtJ6Zwt9VY""",260,31,330,2407,in,1589259456801832960,1740429986132345224,mileorphile,https://twitter.com/mileorphile/status/1740727185995190337,https://pbs.twimg.com/ext_tw_video_thumb/1740726852480884736/pu/img/a0JLlMB7-WzDwE6C.jpg,,Pres
2023-12-29 20:32:42+07:00,1740727545287541112,Kepemimpinan Anies-Muhaimin menjadi penjaga api demokrasi  membuka ruang partisipasi masyarakat untuk menciptakan keputusan yang adil. #Demokrasiii,0,0,0,0,in,1355913224,1740727545287541112,maulansaid,https://twitter.com/maulansaid/status/1740727545287541112,,Sukoharjo,Wapres
2023-12-29 20:33:48+07:00,1740727821495042051,Amin,0,0,2,2,en,749747886167130112,1740727821495042051,beyazgl33254168,https://twitter.com/beyazgl33254168/status/1740727821495042051,,Türkiye❤️💛❤️💛 aşkına,Akronim
2023-12-29 20:33:51+07:00,1740727834258391137,Muhaimin sebagai wakil Anies turut memperkuat fondasi demokrasi  memastikan representasi yang inklusif bagi semua elemen masyarakat. #Demokrasiii,0,0,0,0,in,1355913224,1740727834258391137,maulansaid,https://twitter.com/maulansaid/status/1740727834258391137,,Sukoharjo,Wapres
2023-12-29 20:34:17+07:00,1740727941909422088,@tweetmiliter The guy is literally Anies camp buzzer  he haven't met nor discuss with Anies in person like I do however.🤷🤷🤷,0,3,1,23,en,1604147333935271936,1740694552191930843,rotikan_star,https://twitter.com/rotikan_star/status/1740727941909422088,,,Pres
2023-12-29 20:35:11+07:00,1740728171451097461,Muhaimin menyoroti pentingnya keadilan sosial dalam sistem demokrasi  memastikan setiap warga negara merasakan manfaatnya. #Demokrasiii,0,0,0,0,in,1355913224,1740728171451097461,maulansaid,https://twitter.com/maulansaid/status/1740728171451097461,,Sukoharjo,Wapres
2023-12-29 20:35:35+07:00,1740728269312492026,Di Tuban saya ketemu Pak Rozi  seorang nelayan. Beliau bilang BBM gratis itu bagus  tapi lebih bagus lagi itu harga BBM terjangkau dan stok tersedia. Lebih parah lagi BBM subsidi untuk nelayan di pesisir saat ini dijatah  rata-rata 10-15 liter per nelayan  bahkan tak jarang… https://t.co/xL7KhU9ucz,11,59,832,2418,in,1490116879,1740728269312492026,cakimiNOW,https://twitter.com/cakimiNOW/status/1740728269312492026,https://pbs.twimg.com/amplify_video_thumb/1740727591483609088/img/pcBgYsoEwiyOVWhk.jpg,Indonesia,Wapres
2023-12-29 20:36:28+07:00,1740728492042653905,Soal PKH  Anies-Muhaimin Pastikan Ada Progam Bansos Plus dan Tepat Sasaran https://t.co/v9RHFllIOL,3,0,20,53,in,30766806,1740728492042653905,Reiza_Patters,https://twitter.com/Reiza_Patters/status/1740728492042653905,,"Tomage-Fakfak, Indonesia",Wapres
2023-12-29 20:36:39+07:00,1740728537211146452,@kdrama_menfess TXT DEBUT ACTOR SOON (amin) https://t.co/M8UsK90bz1,8,0,41,522,en,703409391278514177,1740713678566219931,isprng,https://twitter.com/isprng/status/1740728537211146452,https://pbs.twimg.com/ext_tw_video_thumb/1740712779190050816/pu/img/-0WaY9KAipU0dNUY.jpg,Indonesia,Akronim
2023-12-29 20:37:33+07:00,1740728766249484557,@ajengcute16__ @aniesbaswedan buat anies aku kasih 1(satu) lembar saja   ….laen kali kalok buat acara lihat lihat dulu ye.. https://t.co/IlDmYb8FP4,0,4,4,1,in,3793530314,1740696645355086050,AdiAdimsamin,https://twitter.com/AdiAdimsamin/status/1740728766249484557,https://pbs.twimg.com/ext_tw_video_thumb/1740728727364157440/pu/img/iXkzJPbWhxhoiVfQ.jpg,,Pres
2023-12-29 20:38:22+07:00,1740728972332413155,Suara rakyat memperjuangkan keadilan sudah lama dilaksanakan oleh PKS dan sekarang sejalan dengan calon Presiden Anies Baswedan dan Muhaimin Iskandar AMIN. #Demokrasiii,0,0,0,0,in,1561723380134715393,1740728972332413155,SobirinNur2,https://twitter.com/SobirinNur2/status/1740728972332413155,,Pekanbaru ,Wapres
2023-12-29 20:38:26+07:00,1740728988593741978,Awalnya ragu mau milih Pak Anies  karna alasan ngga bisa kerja cuma bisa ngomong.   Trus mikir    Resiko paling besar kalo Pak Anies jadi presiden palingan cuma program ga jalan aja  ya karna banyak omong dan ga bisa kerja. Masih bisa ditolerir  Tapi resiko dari si paslon ini…,510,730,5529,21293,in,328919751,1740728988593741978,adiiprnmo,https://twitter.com/adiiprnmo/status/1740728988593741978,,"Surakarta, Jawa Tengah",Pres
2023-12-29 20:39:13+07:00,1740729183557611793,Anies Baswedan @aniesbaswedan menegaskan akan mengikut sertakan para nelayan ke dalam program BPJS Ketenagakerjaan dan kesehatan. Menurutnya  hal ini perlu dilakukan untuk menjamin keselamatan dan kesejahteraan para nelayan.  Download #metrotvxtend di app store &amp; play store… https://t.co/nO2RUdf5yg,5,13,280,782,in,57261519,1740729183557611793,Metro_TV,https://twitter.com/Metro_TV/status/1740729183557611793,https://pbs.twimg.com/amplify_video_thumb/1740729092616728576/img/HY9wuLauXlzgjYTh.jpg,,Pres
2023-12-29 20:40:34+07:00,1740729525460492565,@kurawa Ada kok beberapa kali di acara Anies  yang datang pake kaos paslon lain  atau yel yel paslon lain  tetap dilayani tanya jawabnya  terus lu nunjukin video ini? Ya itu sama aja lu nunjukin kualitas pendukung 02 gimana hahahaaa... Beneran ya gw ga nyangka kurawa jadi begini 😂😂😂,0,3,5,57,in,1621246893169983488,1740631896772731118,Jarimaniskoe,https://twitter.com/Jarimaniskoe/status/1740729525460492565,,,Pres
2023-12-29 20:41:53+07:00,1740729855464165596,Lihat video relawan_anies! #TikTok https://t.co/Jx39zD2phO,0,0,0,0,en,1707054152759877632,1740729855464165596,BRIGADE0188,https://twitter.com/BRIGADE0188/status/1740729855464165596,,,Pres
2023-12-29 20:44:28+07:00,1740730506067738897,@cakimiNOW Semoga pasangan no 1 Anies - Muhaimin menang dan bisa  membawa barokah dan kesejahteraan untuk seluruh rakyat Indonesia #AMINAjaDulu,1,1,1,13,in,1596027931129937920,1740728269312492026,anas_pnk90,https://twitter.com/anas_pnk90/status/1740730506067738897,,Indonesia,Wapres
2023-12-29 20:46:22+07:00,1740730982775521709,live tiktok adalah bukti keberanian anies baswedan https://t.co/TfXWsrE3po,14,19,358,902,in,1722014606712094720,1740730982775521709,herculep638,https://twitter.com/herculep638/status/1740730982775521709,https://pbs.twimg.com/ext_tw_video_thumb/1740730893827031040/pu/img/P7NbEm0WswGVppKK.jpg,,Pres
2023-12-29 20:46:55+07:00,1740731122882081169,🇪🇬 Ehab Amin is lending his support to Ahl Masr Hospital  the first and largest specialized facility in the Middle East and Africa providing free treatment to burn victims.  🗳️ Vote for Ehab by Liking  Sharing  and Commenting on this post! https://t.co/ytGKkCATsZ,0,1,6,18,en,21831565,1740731122882081169,theBAL,https://twitter.com/theBAL/status/1740731122882081169,https://pbs.twimg.com/amplify_video_thumb/1740731034671382528/img/0VIsUzIO-kjsQArM.jpg,,Akronim
2023-12-29 20:47:09+07:00,1740731180742574309,💚 Most Consistent Trader Of 2023 💚  Goes to… @AminAssamo!   27 payouts with BFP in just 1 year! 😱  Totalling $30 815 👏🏻  Congratulations to Amin 🙏🏻💚 https://t.co/vJ93qs443M,0,14,31,113,en,1447331232484823044,1740731180742574309,Bespoke_Funding,https://twitter.com/Bespoke_Funding/status/1740731180742574309,https://pbs.twimg.com/media/GChRNACWEAAqMEh.jpg,United Kingdom,Akronim
2023-12-29 20:50:46+07:00,1740732091091059161,Inshaalloh AMIN Anies-Muhaimin menang Satu Putaran 🤲🙏 https://t.co/ZNW3SmwvmF,0,0,3,3,in,1199772596,1740732091091059161,sumadiseloguno,https://twitter.com/sumadiseloguno/status/1740732091091059161,https://pbs.twimg.com/ext_tw_video_thumb/1740732042470649856/pu/img/CHttvtA9lcAQEGdT.jpg,"Jawa Barat, Indonesia",Wapres
2023-12-29 20:54:36+07:00,1740733055961334231,@ainunnajib -Desak anies -Nginep ganjar -Hipertensi prabowo 3 acara yg hebat.. -Merangkul.. -Membaur.. -Meniadakan..,26,46,72,795,in,1464497688,1740704103976874362,ramaarsk,https://twitter.com/ramaarsk/status/1740733055961334231,,Indonesia,Pres
2023-12-29 20:55:11+07:00,1740733202749325750,LSI Denny JA: Baru Pertama Elektabilitas Anies-Muhaimin Salip Ganjar-Mahfud https://t.co/Nz8zltbDWQ,2,3,5,9,in,3319260420,1740733202749325750,geloraco,https://twitter.com/geloraco/status/1740733202749325750,,Indonesia,Wapres
2023-12-29 20:55:21+07:00,1740733243161489481,@nenggsyifa @Reiza_Patters Seandainya Anies Ganjar,1,15,7,111,in,1606473952146362375,1740721932465824219,sfmgunners,https://twitter.com/sfmgunners/status/1740733243161489481,,"Riau, Indonesia",Pres
2023-12-29 20:56:53+07:00,1740733632333901904,Amin 🙏,0,1,1,3,en,1387008389578956801,1740733632333901904,Thug_Banker,https://twitter.com/Thug_Banker/status/1740733632333901904,,United Kingdom,Akronim
2023-12-29 20:58:31+07:00,1740734040100262374,Melalui #Demokrasiii  Anies-Muhaimin mengajak seluruh elemen masyarakat untuk bersama-sama menjaga dan mengembangkan sistem demokrasi.,0,0,0,0,in,1355913224,1740734040100262374,maulansaid,https://twitter.com/maulansaid/status/1740734040100262374,,Sukoharjo,Wapres
2023-12-29 20:58:41+07:00,1740734083167322453,apresiasi anak muda atas acara desak anies.. https://t.co/eexzxnGxGY,1,2,14,47,in,1722014606712094720,1740734083167322453,herculep638,https://twitter.com/herculep638/status/1740734083167322453,https://pbs.twimg.com/ext_tw_video_thumb/1740734019598499840/pu/img/inFQQV_FFVrluW5n.jpg,,Pres
2023-12-29 20:59:31+07:00,1740734293457170521,Imagine anies baswedan as ur dad Im crying,0,0,0,8,en,1151787571543867392,1740734293457170521,naurrrrr555,https://twitter.com/naurrrrr555/status/1740734293457170521,,,Pres
2023-12-29 21:00:04+07:00,1740734432909394266,@eradotid Lapor ke Tim Hukum Anies biar dapat bantuan hukum https://t.co/dHNLn1mamr,0,11,21,153,in,377832081,1740717192013045824,andi7044,https://twitter.com/andi7044/status/1740734432909394266,https://pbs.twimg.com/media/GChUvHKakAAUOlB.jpg,depok,Pres
2023-12-29 21:01:32+07:00,1740734801131561047,My #artsummary2023 of this year. https://t.co/BdwPD07jtp,0,2,4,17,en,1508002331681751043,1740734801131561047,Amin33189810,https://twitter.com/Amin33189810/status/1740734801131561047,https://pbs.twimg.com/media/GChVE1MacAAuqmU.jpg,,Akronim
2023-12-29 21:02:13+07:00,1740734972879876487,LSI Denny JA: Baru Pertama Elektabilitas Anies-Muhaimin Salip Ganjar-Mahfud https://t.co/BOi7DxP4WY,1,2,14,24,in,887743587579944960,1740734972879876487,OposisiCerdas,https://twitter.com/OposisiCerdas/status/1740734972879876487,,,Wapres
