"created_at","id_str","full_text","quote_count","reply_count","retweet_count","favorite_count","lang","user_id_str","conversation_id_str","username","tweet_url","image_url","location"
"Sun Dec 10 11:54:14 +0000 2023","1733817397361180972","Putaran 2 Prabowo-Gibran vs Anies-Muhaimin  Qodari: "... jadi dengan melihat pola yg sudah ada klo tdk 1 putaran dan ada putaran ke-2 akan berhadapan Prabowo-Gibran Lawan Anies-Muhaimin..." https://t.co/sn7j2yVeKO","7","73","64","161","in","2395238000","1733817397361180972","tijabar","https://twitter.com/tijabar/status/1733817397361180972","https://pbs.twimg.com/ext_tw_video_thumb/1733815087285276672/pu/img/_vaupkWheWJwwDZo.jpg","Bandung, Jawa Barat"
"Sun Dec 10 16:06:57 +0000 2023","1733880995630453224","PAK ANIES AKAN HADIRI DI SIDANG PBB? https://t.co/K4j4qwCfwP","14","32","778","1172","in","1450037307826860039","1733880995630453224","QianzyZ","https://twitter.com/QianzyZ/status/1733880995630453224","https://pbs.twimg.com/ext_tw_video_thumb/1733880566616088576/pu/img/aL4VSng4fQCaHaug.jpg",""
"Sun Dec 10 10:41:03 +0000 2023","1733798976619737581","Rekam Jejak pak Anies saat jd Gub DKI  Beliau memberi pembelajaran akan tingginya peradaban dg memberikan penghormatan bagi para Lansia &amp; mrk yg memiliki kebutuhan khusus.  Itulah yg disebut keadilan &amp; kesetaraan utk semua. Mampu memberikan Prioritas pd orang yg tepat.… https://t.co/2R262FuvTD","20","20","622","1481","in","1132425764622675969","1733798976619737581","BangPino__","https://twitter.com/BangPino__/status/1733798976619737581","https://pbs.twimg.com/ext_tw_video_thumb/1733798879475499008/pu/img/_KBqfxFdMA89l1k1.jpg","London, England"
"Sun Dec 10 14:28:57 +0000 2023","1733856329218072869","Pesan bijaksana dari Pak Anies ... semoga @bawaslu_RI  n @DivHumas_Polri  juga bertindak  adil  n  bijaksana https://t.co/EUtyYRsyH5","1","5","107","231","in","1052339653","1733856329218072869","siregar_najeges","https://twitter.com/siregar_najeges/status/1733856329218072869","https://pbs.twimg.com/ext_tw_video_thumb/1733856286281003008/pu/img/GLfxZtGVWS8jomqE.jpg","Indonesia🇮🇩"
"Sun Dec 10 12:34:54 +0000 2023","1733827631467110645","Nomer Satu...  Satu putaran...  Pilih Anies...  Anies-Muhaimin....   #AniesMuhaimin2024  #AMINAjaDulu https://t.co/PMfEdLY27r","13","22","530","1698","in","1132425764622675969","1733827631467110645","BangPino__","https://twitter.com/BangPino__/status/1733827631467110645","https://pbs.twimg.com/ext_tw_video_thumb/1733827569018183680/pu/img/tzXYdBboHmyNr35b.jpg","London, England"
"Sun Dec 10 13:02:46 +0000 2023","1733834643873698221","Kami terharu saat disambut oleh ribuan warga Cirebon yang memadati Alun-Alun Kasepuhan. Mereka ikut  berkumpul untuk perubahan. Semoga  kita semua yang datang di sana akan jadi penggerak perubahan  bukan hanya penonton.  Kamu juga mau kan ikut jadi penggerak perubahan Indonesia?… https://t.co/rABog6E4Ab","37","433","1997","5819","in","110312278","1733834643873698221","aniesbaswedan","https://twitter.com/aniesbaswedan/status/1733834643873698221","https://pbs.twimg.com/ext_tw_video_thumb/1733834364612747264/pu/img/c51M8Bz-KqypWsP4.jpg","Indonesia"
"Sun Dec 10 16:21:07 +0000 2023","1733884560138813442","Bila ternyata ikhtiar kita ini menemukan ujungnya yang tidak seperti kita inginkan..sudah  kita kembalikan semua kepada ALLAH... Karena kita ingin punya kesadaran  bahwa pada masalah apapun yang kita hadapi..kita katakan  bahwa kita punya ALLAH.. ~Anies Rasyid Baswedan~ https://t.co/pPpiUwnN87","9","7","152","338","in","1390050216","1733884560138813442","SayyiidHaddaad","https://twitter.com/SayyiidHaddaad/status/1733884560138813442","https://pbs.twimg.com/ext_tw_video_thumb/1733884517809786880/pu/img/DY0cmZLDjOVxcWTj.jpg","Indonesia"
"Sun Dec 10 13:11:37 +0000 2023","1733836870432489910","Yakinlah Semua akan AMIN Pada Waktunya   Partai Pelita Deklarasikan Dukungan kepada Anies - Muhaimin pasangan No 1 Indonesia Adil dan Makmur untuk Semua 💞  #AMINAjaDulu  #AniesMuhaimin2024 https://t.co/857QHOEKqI","15","177","661","1798","in","1334853481019056128","1733836870432489910","Mdy_Asmara1701","https://twitter.com/Mdy_Asmara1701/status/1733836870432489910","https://pbs.twimg.com/ext_tw_video_thumb/1733836748512432128/pu/img/JuplZYnUJL38bGM3.jpg","Jakarta Capital Region"
"Sun Dec 10 11:20:26 +0000 2023","1733808887923704076","Gue sih yes!  Anies Baswedan Janji Akan Buat Kebijakan Miskinkan Koruptor Jika Terpilih Jadi Presiden   #AMINAjaDulu  #AniesMuhaimin2024 https://t.co/kRTOwDsJxG","17","75","761","1958","in","1334853481019056128","1733808887923704076","Mdy_Asmara1701","https://twitter.com/Mdy_Asmara1701/status/1733808887923704076","https://pbs.twimg.com/ext_tw_video_thumb/1733808722122883072/pu/img/qXQMQQ5hxQ7TLpCU.jpg","Jakarta Capital Region"
"Sun Dec 10 09:30:05 +0000 2023","1733781120343580956","Kita bikin polling dulu sodara2  sesuai no urut sbb: 1. Anies-Muhaimin = RT 2. Prabowo-Gibran = LIKE 3. Ganjar-Mahfud = REPLY  Gaskeun sodara2  campakkan itu hsl surpai-surpei berbyr murahan!🤣🤣🤣 https://t.co/0xNA7r4JgU","29","217","4656","471","in","105085302","1733781120343580956","bachrum_achmadi","https://twitter.com/bachrum_achmadi/status/1733781120343580956","https://pbs.twimg.com/media/GA-gvQGagAA-j65.jpg","Bekasi - Indonesia"
"Sun Dec 10 11:00:22 +0000 2023","1733803840032719100","Setengah Hati Golkar Menangkan Prabowo  Partai Golkar disebut-sebut belum sepenuh hati memenangkan Prabowo-Gibran. Ada yang merapat ke kubu Anies-Muhaimin.  Simak selengkapnya Program Bocor Alus Politik di Channel Youtube Tempodotco dan Spotify  #BocorAlusPolitik #PodcastBAP… https://t.co/849udNeNef","25","161","191","632","in","18129942","1733803840032719100","tempodotco","https://twitter.com/tempodotco/status/1733803840032719100","https://pbs.twimg.com/media/GA-1ZfIaYAAAUIu.jpg","Indonesia"
"Sun Dec 10 08:26:12 +0000 2023","1733765042850705502","Kamu suka yang mana?    #amin #AniesMuhaimin2024 #anies #MuhaiminIskandar #AminMenang1Putaran #coblosno1 https://t.co/9YyiqpJ0DX","19","112","301","848","in","836539655478624258","1733765042850705502","aniesmania","https://twitter.com/aniesmania/status/1733765042850705502","https://pbs.twimg.com/ext_tw_video_thumb/1733764984562405376/pu/img/dwZG_ME48s1ibD01.jpg",""
"Sun Dec 10 09:03:06 +0000 2023","1733774328528093530","Jangan pernah percaya hasil survei Paslon 1 Anies-Muhaimin paling rendah? Sementara fakta di lapangan selalu terbanyak warga yang hadir  tanpa bagi-bagi kaos/sembako/amplop! Warga sadar  mendukung PERUBAHAN Indonesia lebih baik  AD1L MAKMUR. #AMINAjaDulu  #AniesMuhaimin2024 https://t.co/NpZiqhzBk2","11","42","500","1449","in","129750289","1733774328528093530","ZAEffendy","https://twitter.com/ZAEffendy/status/1733774328528093530","https://pbs.twimg.com/ext_tw_video_thumb/1733773903783411712/pu/img/VCgsNf6QFVj82khe.jpg","South East Asia"
"Sun Dec 10 11:47:32 +0000 2023","1733815708587626878","Pie Jal 😁 https://t.co/hZ439O63lJ","8","38","52","93","pl","1335552103457034240","1733815708587626878","sobat_anies","https://twitter.com/sobat_anies/status/1733815708587626878","https://pbs.twimg.com/ext_tw_video_thumb/1733815665247809536/pu/img/TE8S5oeB47GTOeTF.jpg","Surakarta, Jawa Tengah"
"Sun Dec 10 13:12:51 +0000 2023","1733837182035800266","Adem melihatnya....  Pak Anies Mengunjungi Vihara Welas Asih Cirebon sebagai bentuk merangkul semua Ethnis dan Golongan utk Indonesia Satu.   #AniesMuhaimin2024 #AMINAjaDulu https://t.co/tYPRABN45V","1","10","225","697","in","1132425764622675969","1733837182035800266","BangPino__","https://twitter.com/BangPino__/status/1733837182035800266","https://pbs.twimg.com/ext_tw_video_thumb/1733836999176638464/pu/img/rXGGe6_uOxNJXnVJ.jpg","London, England"
"Sun Dec 10 10:27:07 +0000 2023","1733795472052232499","BAHKAN PENYANDANG DISABILITASPUN MENDAPAT PERHATIAN KHUSUS DARI PAK ANIES. SANGAT TERHARU..  YA ALLAH  LINDUNGILAH PEMIMPIN BAIK INI..🤲  #InsyaAllahAniesPresiden ☝️ https://t.co/i1d64pLCaJ","20","37","620","1401","in","1603593688005115905","1733795472052232499","Malika6027","https://twitter.com/Malika6027/status/1733795472052232499","https://pbs.twimg.com/ext_tw_video_thumb/1733795366242598912/pu/img/t-030LgPcmH1BB2G.jpg",""
"Sun Dec 10 12:38:04 +0000 2023","1733828426518462714","Mendapat sambutan dan jamuan dari Panglima Keraton Kasepuhan Cirebon. Kami diceritakan berbagai sejarah yang ada di Cirebon ini. Kami juga diberi kesempatan untuk memgang Keris Sanghyang Naga peninggalan Sunan Gunung Jati. Ada yang sudah pernah masuk ke sini dan lihat berbagai… https://t.co/Ud5urh1vDN","6","57","846","2724","in","110312278","1733828426518462714","aniesbaswedan","https://twitter.com/aniesbaswedan/status/1733828426518462714","https://pbs.twimg.com/ext_tw_video_thumb/1733818319302782976/pu/img/L578a-tUq1cFNzzU.jpg","Indonesia"
"Sun Dec 10 12:30:00 +0000 2023","1733826396181422277","Sekjen Gerindra  Ahmad Muzani  menanggapi pernyataan capres nomor urut 1  Anies Baswedan yang mengkritik proyek IKN hanya menguntungkan aparat. Muzani sebut IKN telah diputuskan dalam undang-undang dan bersifat mengikat. https://t.co/5B6cA3hksA","34","91","21","68","in","69183155","1733826396181422277","detikcom","https://twitter.com/detikcom/status/1733826396181422277","https://pbs.twimg.com/ext_tw_video_thumb/1733814145592782848/pu/img/Hyif25eUCYbR_Moq.jpg","Jakarta, Indonesia"
"Sun Dec 10 13:12:51 +0000 2023","1733837179376541825","Perubahan itu semakin nyata  cukup 1 saja 😊☝❤🇮🇩  #papua #indonesia #fyp #amin #AniesMuhaimin2024 #AminMenang1Putaran #CoblosNo1 https://t.co/JBFNkGXVZm","14","27","400","1025","in","836539655478624258","1733837179376541825","aniesmania","https://twitter.com/aniesmania/status/1733837179376541825","https://pbs.twimg.com/ext_tw_video_thumb/1733836862702419968/pu/img/gSG9T7P-8w83N2IG.jpg",""
"Sun Dec 10 08:14:16 +0000 2023","1733762037124379055","PENDUKUNG 01 (AMIN) Setuju PERUBAHAN 👉 Retweet https://t.co/bvdsAtDJTm","9","18","883","1043","in","1335552103457034240","1733762037124379055","sobat_anies","https://twitter.com/sobat_anies/status/1733762037124379055","https://pbs.twimg.com/media/GA-PYNHaMAA4zmd.jpg","Surakarta, Jawa Tengah"
"Sun Dec 10 10:04:28 +0000 2023","1733789770852213103","Secara personal  Perasaan dan Cinta kang ojek pada para capres: Prabowo : 70% Anies : 28% Ganjar : 2%  Kalau untuk pribadi  maka Prabowo pilihannya  tapi yg kita pilih ini pemimpin negara  tentu kepentingan negara  agama dan rakyat yg utama. Anieslah yg paling Tepat tuk dipilih. https://t.co/rXlqL6gbrD","3","22","121","322","in","1038483432391634944","1733789770852213103","RomitsuT","https://twitter.com/RomitsuT/status/1733789770852213103","https://pbs.twimg.com/ext_tw_video_thumb/1733789740225441792/pu/img/kKHciEEHSQTurTZR.jpg",""
"Sun Dec 10 14:35:23 +0000 2023","1733857949960077374","KPU Umumkan Format dan Isu Debat Capres-Cawapres 2024  Menurut gue lebih menarik debat di Kampus² atau desak Anies  pertanyaannya tajam-tajam  materi nggak ditentukan dan yang nanya juga random 😉 https://t.co/kTz18Le1Bz","4","16","179","388","in","1334853481019056128","1733857949960077374","Mdy_Asmara1701","https://twitter.com/Mdy_Asmara1701/status/1733857949960077374","https://pbs.twimg.com/ext_tw_video_thumb/1733857837095493633/pu/img/tOe9w8YLX2dKF3pb.jpg","Jakarta Capital Region"
"Sun Dec 10 08:34:31 +0000 2023","1733767134038388812","Adil Makmur Untuk Semua ! Anies Baswedan - Muhaimin Iskandar.   #AMINAjaDulu https://t.co/JGnOmnu0cY","8","14","285","783","in","1227719379103571968","1733767134038388812","sutanmangara","https://twitter.com/sutanmangara/status/1733767134038388812","https://pbs.twimg.com/media/GA-UA-bbEAApeyx.jpg","Indonesia"
"Sun Dec 10 08:58:56 +0000 2023","1733773281000591834","Gw klo liat muka Pak Anies  lebih sejuk diliatnya daripada muka 2 capres lainnya...  Aslik jujur ini gw https://t.co/3oIaOpKyAM","0","1","6","18","in","1165900976286388224","1733773281000591834","musaKSQ","https://twitter.com/musaKSQ/status/1733773281000591834","https://pbs.twimg.com/ext_tw_video_thumb/1733773176470183936/pu/img/eU4EYKj6PsZ0vyUx.jpg",""
"Sun Dec 10 15:56:28 +0000 2023","1733878355169292689","EMAK- EMAK RELAWAN ANIES TURUN KELAPANGAN IKUT MASANG SPANDUK DI DAERAH BOGOR. DEMI  MENGHARAP ADANYA PERUBAHAN. https://t.co/eYBJVsP9TF","11","17","282","765","in","1667233216091279363","1733878355169292689","Andria75777","https://twitter.com/Andria75777/status/1733878355169292689","https://pbs.twimg.com/ext_tw_video_thumb/1733878043276709888/pu/img/8we8RwcI9E6LC4DD.jpg","Jabodetabek, Indonesia"
"Sun Dec 10 12:30:01 +0000 2023","1733826399440605537","@Hasbil_Lbs @aniesbaswedan @cakimiNOW Cak Imin adalah blunder terbesarnya Anies. 😂😂 ✌️✌️ https://t.co/jIfxnXomJ9","0","1","1","7","in","1603498565548277760","1733818103254131061","Kenikir27","https://twitter.com/Kenikir27/status/1733826399440605537","https://pbs.twimg.com/ext_tw_video_thumb/1733826358567198720/pu/img/5JmIORYjthpARUMq.jpg","Duren Sawit, DKI, Indonesia"
"Sun Dec 10 14:50:29 +0000 2023","1733861750490140963","Mau dip0les seperti apapun  Wowo tetap gak l4ku 😂 Str4tegi lama  rasa baru 🤣 https://t.co/mCTqB4RXxz","1","19","63","287","in","576025157","1733861750490140963","anies_maniaa","https://twitter.com/anies_maniaa/status/1733861750490140963","https://pbs.twimg.com/ext_tw_video_thumb/1733861717598453760/pu/img/y81vWMm42I_UNXdP.jpg","Indonesia "
"Sun Dec 10 13:53:13 +0000 2023","1733847339088138455","SKENARIO KUBU GANJAR-MAHFUD NGERJAIN KUBU ANIES-IMIN  *sebuah thread* https://t.co/tF8oOILqGh","91","603","617","3430","in","869327120","1733847339088138455","PartaiSocmed","https://twitter.com/PartaiSocmed/status/1733847339088138455","https://pbs.twimg.com/media/GA_c9kfbIAAIoVs.jpg","Indonesia"
"Sun Dec 10 10:28:34 +0000 2023","1733795838802149672","Partai Pelita Deklarasikan Dukungan kepada Anies Baswedan https://t.co/AjDcoREQHZ","4","21","116","597","in","55507370","1733795838802149672","tvOneNews","https://twitter.com/tvOneNews/status/1733795838802149672","","Pulo Gadung, Indonesia"
"Sun Dec 10 14:07:08 +0000 2023","1733850839247364526","Anies pernah mengalahkan Anak Mantan Presiden loh?  Apakah 2024 akan mengalahkan Anak Presiden Sedang Berkuasa? (Yg punya segala2nya)","7","56","209","853","in","1270980383761330176","1733850839247364526","Tan_Mar3M","https://twitter.com/Tan_Mar3M/status/1733850839247364526","",""
"Sun Dec 10 16:19:35 +0000 2023","1733884172891263176","Dear ararantum team paslon 01 Pasca kejadian si Aulia komika menjadikan nama Muhammad sebagai jokes ga lucu  muncul trending topic. Ada sekelompok bazzer put a blame on team kubu Anies atas kelakuan si aulia. Mereka secara massif meramaikannya di TL  Ini bisa menjurus ke fitnah.… https://t.co/r42xc150yW","2","12","62","112","in","963751550","1733884172891263176","KangSemproel","https://twitter.com/KangSemproel/status/1733884172891263176","https://pbs.twimg.com/media/GA_-c9-a4AA1WSl.jpg","Abu Nouas, Baghdad, Iraq"
"Sun Dec 10 08:40:38 +0000 2023","1733768673528254878","Mardani Ali Sera: Politisi PKS. Satu²nya paslon yg gak menerima bantuan Oligarki yaitu AMIN.   Pak Anies berkampanye hanya minta disiapkan hotel bintang 3 dan mobil ino** selebihnya beliau yg nanggung. Clear bhw beliau gak ada beban kpd Cukong dan Oligarki.   #AMINAjaDulu ☝️ 🤲🤲 https://t.co/XNBVLePrWl","16","33","522","949","in","852327811","1733768673528254878","rahmaniarbaftim","https://twitter.com/rahmaniarbaftim/status/1733768673528254878","https://pbs.twimg.com/ext_tw_video_thumb/1733768192861097984/pu/img/_3_uF1Jnyt1uKL4o.jpg","Di Bumi Allah"
"Sun Dec 10 08:04:10 +0000 2023","1733759497997607394","Selalu ada alasan untuk tidak mendukung Anies. https://t.co/ldOR009jfC","1","3","8","18","in","1427095335084515333","1733759497997607394","99propaganda","https://twitter.com/99propaganda/status/1733759497997607394","https://pbs.twimg.com/ext_tw_video_thumb/1733759442699907072/pu/img/Lq0_A6HlTd-EDqoF.jpg",""
"Sun Dec 10 07:36:36 +0000 2023","1733752561751265663","Pak Anies Kampanye di Cirebon kemarin  PECAH rakyat relawan semua tumpah ruah siap menangkan AMIN 💪  #InsyaAllahAniesPresiden ☝️ https://t.co/jVp7yCjNkN","10","17","503","1125","in","1603593688005115905","1733752561751265663","Malika6027","https://twitter.com/Malika6027/status/1733752561751265663","https://pbs.twimg.com/ext_tw_video_thumb/1733752426703036416/pu/img/K6NefsYULtmNYbOS.jpg",""
"Sun Dec 10 13:43:19 +0000 2023","1733844848804065697","Ni orang serem banget. Masak orang yang gak dukung Anies harus dipertanyakan keislamannya? Bisa diperjelas  hubungannya apa? https://t.co/crGoltIh5w","29","250","49","172","in","1647786833148018691","1733844848804065697","adearmando61","https://twitter.com/adearmando61/status/1733844848804065697","https://pbs.twimg.com/ext_tw_video_thumb/1733844824128966656/pu/img/8V4wy0n5xO6eklLP.jpg",""
"Sun Dec 10 08:46:11 +0000 2023","1733770071179456702","Anies Baswedan-Muhaimin Libur Kampanye untuk Persiapan Debat  Syaugi Alaydrus: Butuh Persiapan! https://t.co/GsJ7aNAha1","0","7","2","16","in","55507370","1733770071179456702","tvOneNews","https://twitter.com/tvOneNews/status/1733770071179456702","","Pulo Gadung, Indonesia"
"Sun Dec 10 13:43:32 +0000 2023","1733844902365311139","Momen keseruan Anak-Anak Capres Main Game Bareng  salah satu anak dari pasangan nomor 1 Anies Baswedan (@aniesbaswedan) yaitu #MutiaraBaswedan mengatakan bahwasannya walaupun berbeda pendapat  tetapi tetap main bareng dan kita semua temenan.  #Main #Game #Anak #Capres #Cawapres… https://t.co/nR0VeYJfce","0","2","9","33","in","57261519","1733844902365311139","Metro_TV","https://twitter.com/Metro_TV/status/1733844902365311139","https://pbs.twimg.com/ext_tw_video_thumb/1733843974836912128/pu/img/JS8zYDRSMO5bt1se.jpg",""
"Sun Dec 10 13:35:57 +0000 2023","1733842994112204988","Anies itu punya rekam jejak mengalahakan anak presiden dalam kontestasi  Prabowo juga punya  jejak dikalahkan oleh mantan gubernur DKI..2x  edisi cocoklogi😎","3","12","29","156","in","1333696739258167298","1733842994112204988","BangEdiii","https://twitter.com/BangEdiii/status/1733842994112204988","","PSW Tower Antasari"
"Sun Dec 10 12:57:37 +0000 2023","1733833346403401907","Kalau lihat pak Anies dan Pak Tom Lembong Udah Besti-an banget ya 🥰🥰...ini namanya Besti-an Berkelas   Punya Kharisma dan Berwawasan Luas https://t.co/IBltAxVu0O","3","15","392","1189","in","1456283686312103939","1733833346403401907","Yurissa_Samosir","https://twitter.com/Yurissa_Samosir/status/1733833346403401907","https://pbs.twimg.com/ext_tw_video_thumb/1733833326035968000/pu/img/A2nlplX93Y7ByBWb.jpg",""
"Sun Dec 10 09:09:26 +0000 2023","1733775923928047735","Bisakah Anies menang pilpres 2024? iya bisa jika KPU  tdk pakai quick count hitung cpt.  KPU pusat catat capres yg menang dari hitung manual di 38 Propinsi Indonesia  kemenangan tiap provinsi ini yg sah dan akurat  Jk pakai Quick Count diduga setting curang seperti pilpres 2019. https://t.co/7Cc6IjMiTp","3","1","6","8","in","1482600556669460485","1733775923928047735","ForRezim","https://twitter.com/ForRezim/status/1733775923928047735","https://pbs.twimg.com/media/GA-Z5GRbEAAWws5.jpg","Bumi Allah SWT"
"Sun Dec 10 12:18:34 +0000 2023","1733823519698616367","Begini Tanggapan TKN Prabowo-Gibran Gibran soal Anies Sebut IKN Hanya Untungkan Aparatur Negara https://t.co/t9yG0Gedyf #TempoNasional","0","1","0","0","in","18129942","1733823519698616367","tempodotco","https://twitter.com/tempodotco/status/1733823519698616367","","Indonesia"
"Sun Dec 10 10:45:14 +0000 2023","1733800029985608181","Anies Baswedan Janji Akan Buat Kebijakan Miskinkan Koruptor Jika Terpilih Jadi Presiden https://t.co/zT2Wlp2soe","24","99","164","691","in","71436318","1733800029985608181","KompasTV","https://twitter.com/KompasTV/status/1733800029985608181","","Indonesia"
"Sun Dec 10 08:40:24 +0000 2023","1733768615152042230","Calon presiden (capres) nomor urut 2  Prabowo Subianto merespons sindiran capres nomor urut 1  Anies Baswedan soal kebiasaan joget gemoy.  Cek deh  ini kata Prabowo.   Oh iya  jangan lupa  12 Desember 2023  jam 18.00 WIB. Kita nobar debat capres ronde pertama. Hari itu bakal… https://t.co/U98yvItsAP","9","127","36","146","in","1158355819512991747","1733768615152042230","NarasiNewsroom","https://twitter.com/NarasiNewsroom/status/1733768615152042230","https://pbs.twimg.com/amplify_video_thumb/1733768217045417984/img/B6aPArFUohKjqQ24.jpg",""
"Sun Dec 10 11:08:44 +0000 2023","1733805943455170597","Untuk ikhtiar pemenangan AMIN  di Pilpres 2024 Relawan Sobat Anies All Out  mengerjakan yang mampu di kerjakan.  #SobatAnies  #AMINAjaDulu https://t.co/16TqWZbOx9","0","0","19","43","in","1417489643759710208","1733805882889384342","MissKoral","https://twitter.com/MissKoral/status/1733805943455170597","https://pbs.twimg.com/media/GA-3RG8bYAA2ELT.jpg","Yogyakarta, Indonesia"
"Sun Dec 10 12:32:35 +0000 2023","1733827044914643115","Begini Tanggapan TKN Prabowo-Gibran soal Anies Sebut IKN Hanya Untungkan Aparatur Negara https://t.co/5Bh1ZrAj7m #TempoNasional","0","1","0","0","in","18129942","1733827044914643115","tempodotco","https://twitter.com/tempodotco/status/1733827044914643115","","Indonesia"
"Sun Dec 10 12:55:18 +0000 2023","1733832765039403142","Ada kalimat menarik disini yang di lontarkan TIMNAS ANIES BASWEDAN  " jika ada eskalasi proses hukum guna membantu Aulia".  Kalimat ini Menjadi Tanda tanya kita semua MEMBANTU dalam hal apa ? Itu AULIA jelas Jelas MENISTKAN AGAMA  wajar TV ONE Memberikan judul  " BELA TERSANGKA " https://t.co/6riVdRzPey","0","10","9","10","in","1133311906976952320","1733832765039403142","Catatan_ali7","https://twitter.com/Catatan_ali7/status/1733832765039403142","https://pbs.twimg.com/media/GA_PteXbEAAf-GW.jpg","Klaten, Jawa Tengah"
"Sun Dec 10 07:22:23 +0000 2023","1733748981887566205","Ada 10% pemilih Prabowo pindah ke Anies   🚦","0","4","3","18","in","119691957","1733748981887566205","aewin86","https://twitter.com/aewin86/status/1733748981887566205","","Jakarta Capital Region"
"Sun Dec 10 06:49:47 +0000 2023","1733740778931757421","“Desak Anies berujung petaka”. Dah mah dibayar cuma sejuta lagi.","4","42","9","30","in","230313497","1733740778931757421","hasmibakhtiar","https://twitter.com/hasmibakhtiar/status/1733740778931757421","","Jakarta, Indonesia"
"Sun Dec 10 12:14:07 +0000 2023","1733822397541949737","Kok malah di bela?   Billy David Juru Bicara Tim Nasiona Pemenangan Anies-Muhaimin (AMIN)  memastikan tim hukum Timnas AMIN siap memberikan keterangan serta mempersiapkan bahan²   langkah  dan strategi jika ada eskalasi proses hukum guna membantu Aulia.  https://t.co/2ui0CI9uSM","1","5","4","9","in","1427095335084515333","1733822397541949737","99propaganda","https://twitter.com/99propaganda/status/1733822397541949737","",""
"Sun Dec 10 07:31:26 +0000 2023","1733751258664882579","acara desak anies tapi ko ada komika yang menghina nabi  parah gk sih dijadikan bahan komika  apalagi PenghinaNabi DibelaAMIN haduh  AMIN PengkhianatUmat https://t.co/JImzorSPgS","0","3","4","5","in","2375265788","1733751258664882579","DutaTamaSports","https://twitter.com/DutaTamaSports/status/1733751258664882579","https://pbs.twimg.com/media/GA-Fk_uaUAAr-OW.jpg",""
"Sun Dec 10 08:48:26 +0000 2023","1733770636076659174","Suddenly Anies isnt that bad after all😁","0","0","0","2","en","771323773068775424","1733770636076659174","handsofsapphire","https://twitter.com/handsofsapphire/status/1733770636076659174","","instagram @kiranasafirra"
"Sun Dec 10 14:31:02 +0000 2023","1733856855020212227","ANIES - LEBIH MASUK AKAL mereka masih survey  insyaAllah di Kota Batam aman 1 suara untk anies 🤣🤣🤣 1 suara penentu kemenangan... https://t.co/pfaTBr3qkU","0","0","2","7","in","1075401814646743040","1733856855020212227","olink1978","https://twitter.com/olink1978/status/1733856855020212227","https://pbs.twimg.com/media/GA_la4uaUAAWYjw.jpg",""
"Sun Dec 10 10:51:25 +0000 2023","1733801586240205063","Anies fans club Indonesia https://t.co/V221VOSZVu","0","0","0","0","en","1411709087532781572","1733801586240205063","AnasisFeri","https://twitter.com/AnasisFeri/status/1733801586240205063","https://pbs.twimg.com/ext_tw_video_thumb/1733801507450220544/pu/img/DMT44XuOELz-k2Mj.jpg",""
"Sun Dec 10 11:04:13 +0000 2023","1733804809059471726","Kita mah asyik asyik aja gak usah tegang gak usah muter muter cukup 1 putaran prabowo gibran 2024 jangan seperti anies kebanyakan ngomong muter muter .  Prabowo Gibran 2024 https://t.co/YlKIMm3ztE","0","1","3","11","in","1460301693917151232","1733804809059471726","YepryR","https://twitter.com/YepryR/status/1733804809059471726","https://pbs.twimg.com/ext_tw_video_thumb/1733804720136069120/pu/img/gGVkkfnrC0T5NYln.jpg","Banten, Indonesia"
"Sun Dec 10 14:50:54 +0000 2023","1733861854617931879","Belimbing sayur mending belajar dulu sama bapaknya nama ikan 😂 https://t.co/UKnpTqk958","0","0","2","7","in","576025157","1733861750490140963","anies_maniaa","https://twitter.com/anies_maniaa/status/1733861854617931879","https://pbs.twimg.com/ext_tw_video_thumb/1733861830286819328/pu/img/t7Rh_lG-yrq6VCwG.jpg","Indonesia "
"Sun Dec 10 07:17:53 +0000 2023","1733747849073234144","Mungkin yg kamu @alextham878 maksud adalah   Tanda alam watak lahir seorang GANJAR dgn lisan ULAR berbisa   Yg meler seperti Anies yg kerap dusta serta bengkok2 monyong nya congor @ekokuntadhi1 @MazdjoPray dan Bibir dower seperti @islah_bahrawi @ch_chotimah2  Hahaha https://t.co/y6teM56p3A","0","5","2","11","in","1707296384347697152","1733747849073234144","icikiwir_08","https://twitter.com/icikiwir_08/status/1733747849073234144","https://pbs.twimg.com/ext_tw_video_thumb/1733747838188978176/pu/img/mPbGQb-NWHOWvPXr.jpg",""
