created_at,id_str,full_text,quote_count,reply_count,retweet_count,favorite_count,lang,user_id_str,conversation_id_str,username,tweet_url,image_url,location
2023-12-18 20:25:42+07:00,1736739515212222814,"Cawapres No 01 ( Muhaimin Iskandar ) :  Jangan kayak Orang Bekasi  Mal Megah tapi Dompetnya Kempis"" sumber : @kompascom  . . . Padahal UMR Bekasi masuk kategori Tertinggi  di Indonesia https://t.co/Sm5YfZFj1K""",7,109,46,117,in,1251824880967774208,1736739515212222814,Heraloebss,https://twitter.com/Heraloebss/status/1736739515212222814,https://pbs.twimg.com/media/GBojYGjboAAhy9z.jpg,+62
2023-12-18 20:37:56+07:00,1736742595257307417,@OposisiCerdas @keuangannews_id @Malika6027 @Muslim_AntiPKI9 @VIVAcoid @ekowboy2 @awemany @ruthnats @PutraErlangga95 @AnggaPutraF @mazzini_gsp @BosPurwa @geloraco @democrazymedia @ferizandra @putrisakera @shallypristine MOST SHARED IMAGES  Gambar yang paling banyak dishare adalah foto pakta integritas yang ditandatangani oleh Anies - Muhaimin. https://t.co/vpZPc731C6,0,2,3,17,in,34075325,1736735988783935852,ismailfahmi,https://twitter.com/ismailfahmi/status/1736742595257307417,https://pbs.twimg.com/media/GBol6vUbAAA1Wnp.jpg,"Jakarta Selatan, DKI Jakarta"
2023-12-18 20:42:51+07:00,1736743832006570064,@KompasTV Bismillah Sekeluarga c0blos no 1 AMIN Anies Muhaimin https://t.co/mrLXtIj97L,0,0,1,7,in,1722461843829174272,1736580684398150103,Hasan39309617,https://twitter.com/Hasan39309617/status/1736743832006570064,https://pbs.twimg.com/ext_tw_video_thumb/1736743660807766016/pu/img/mA_QwPJw4PI6q1j1.jpg,
2023-12-18 20:45:43+07:00,1736744553699590583,"Bismillah  MasyaAllah Tabaraqallah 🤲 Ada spanduk Rakyat yg menjadi sebuah simbol dari Rakyat yg Merindukan satu Perubahan.  Spanduk dari Rakyat untuk AMIN""  (Anies &amp; Muhaimin)  Allahu Akbar ☝️  #AMINAjaDulu https://t.co/EEFRudkPKG""",0,0,25,43,in,1651123026203901952,1736744553699590583,NinzExe07,https://twitter.com/NinzExe07/status/1736744553699590583,https://pbs.twimg.com/ext_tw_video_thumb/1736744507276992512/pu/img/vYc_pCQZx-bJimEk.jpg,
2023-12-18 21:19:34+07:00,1736753072041517520,KPU Jawab Keluhan Muhaimin Iskandar Soal Tamu Undangan Debat: Jumlahnya Sama https://t.co/fnPlSsYGbs #TempoNasional,0,0,1,2,in,18129942,1736753072041517520,tempodotco,https://twitter.com/tempodotco/status/1736753072041517520,,Indonesia
2023-12-18 21:24:39+07:00,1736754353300791663,@Muslim_AntiPKI9 Aamiin Coblos No 1 AMIN Anies Muhaimin https://t.co/KMMLMf1j26,0,0,0,2,tl,1722461843829174272,1736446004029964733,Hasan39309617,https://twitter.com/Hasan39309617/status/1736754353300791663,https://pbs.twimg.com/ext_tw_video_thumb/1736754169246285824/pu/img/ryfAYTNb2lczs1e0.jpg,
2023-12-18 21:29:24+07:00,1736755545561092539,Papua NTT manta berjuang bersama perubahan Amin Anies Muhaimin menang putaran 1 Amin 🤲 😇 https://t.co/uNbDYVV5wl,0,0,0,0,in,1649696119927226368,1736755545561092539,Deai1248856,https://twitter.com/Deai1248856/status/1736755545561092539,,
2023-12-18 21:57:17+07:00,1736762563688648810,Alhamdulillah... Ikut berkontribusi dlm timnas Anis-Muhaimin(AMIN) Prov.Sum-Bar. Ketua tim Form.Kebijakan. Cv @syafniir  @6undul0h  @_Si_Bee  @UtunPerubahan  @5t3v3n_P3g3L  @AdamVelcro  @anaktermudaa  @dharmasrayapks2  @Minang_cyber  @mahyeldi_sp  @MIrvanDarwin1  @Gank_Of_Petojo https://t.co/rCpH6YK1Cw,4,22,27,102,in,1557398948825903104,1736762563688648810,AndiPitopang7,https://twitter.com/AndiPitopang7/status/1736762563688648810,https://pbs.twimg.com/media/GBo4UTwakAAnhcZ.jpg,"Pulau Punjung, Indonesia"
2023-12-18 22:03:31+07:00,1736764133306192263,"Cawapres no urut 1 Muhaimin iskandar : Jangan kayak orang Bekasi  di sini malnya banyak megah-megah  tapi cuma lihat sambil muter  karna dompetnya KEMPES  Jalan-jalan ke mal muter saja  terus anaknya bilang  'Cuma lihat-lihat dong  Bu?' Lah iya  orang dompetnya ""KEMPES"" https://t.co/9Nv0fBbOz6""",6,16,19,47,in,1636655161656631301,1736764133306192263,REP0RT_ID,https://twitter.com/REP0RT_ID/status/1736764133306192263,https://pbs.twimg.com/ext_tw_video_thumb/1736763948509413376/pu/img/cjcfPMhAe6sKYVd2.jpg,
2023-12-18 22:41:02+07:00,1736773574453870774,REKOMENDASI MITIGASI  Berikut adalah beberapa rekomendasi dari AI bagi pasangan Anies-Muhaimin untuk memitigasi kemungkinan dampak negatif dari tanda tangan pakta integritas:  Komunikasi yang jelas: Pasangan Anies-Muhaimin perlu melakukan komunikasi yang jelas dan terbuka kepada… https://t.co/az4XL8jzBh,0,2,5,18,in,34075325,1736735988783935852,ismailfahmi,https://twitter.com/ismailfahmi/status/1736773574453870774,https://pbs.twimg.com/media/GBpCKhPbkAAfg2n.jpg,"Jakarta Selatan, DKI Jakarta"
2023-12-18 22:49:59+07:00,1736775827432571130,Mau kan   mau lah   Insya Allah Amin   Anies Muhaimin https://t.co/VtxQhgJqbH,0,0,0,0,in,805569468688527360,1736775827432571130,devcepi60,https://twitter.com/devcepi60/status/1736775827432571130,https://pbs.twimg.com/ext_tw_video_thumb/1736775438335365120/pu/img/r9FnikOt_r_WOQv7.jpg,
2023-12-18 23:04:39+07:00,1736779516524265631,Gibran  Muhaimin  dan Mahfud MD Bakal Berdebat Dikawal 11 Panelis https://t.co/ExvEe9Q6Ly,0,6,0,3,in,55507370,1736779516524265631,tvOneNews,https://twitter.com/tvOneNews/status/1736779516524265631,,"Pulo Gadung, Indonesia"
2023-12-18 23:15:37+07:00,1736782277252968921,Ponpes LIRBOYO Sepakat Membulatkan Tekad Memenangkan Muhaimin Untuk Menjadi  Wakil Presiden 2024  #AniesMuhaimin2024 https://t.co/n0Q2bPLSVa,0,0,3,5,in,1580531078280146944,1736782277252968921,msw_andi,https://twitter.com/msw_andi/status/1736782277252968921,https://pbs.twimg.com/media/GBpKRhcawAActnx.jpg,"Jawa Tengah, Indonesia"
2023-12-18 23:22:50+07:00,1736784094074421544,Jika Benar Warga NU Sudah 60% Dukung AMIN - Anies Muhaimin   Maka Kemenangan 1 Putaran Tak Lagi Hal Yg Mustahil .  60% Warga NU = Skitar 85.000.000 https://t.co/bzWml2wkuJ,0,0,1,5,in,1580531078280146944,1736784094074421544,msw_andi,https://twitter.com/msw_andi/status/1736784094074421544,https://pbs.twimg.com/media/GBpL7d_bsAAFv6Z.jpg,"Jawa Tengah, Indonesia"
2023-12-18 00:22:34+07:00,1736436738594394367,Kesiapan Muhaimin  Gibran dan Mahfud MD Hadapi Debat pada 22 Desember Mendatang https://t.co/zqtk7t9sE7,1,1,2,3,in,71436318,1736436738594394367,KompasTV,https://twitter.com/KompasTV/status/1736436738594394367,,Indonesia
2023-12-18 01:02:10+07:00,1736446701869633621,Alhamdulillah. Allahu Akbar https://t.co/cu8Weap0dn,0,1,1,2,in,1637572714205421595,1736446701869633621,liaasister,https://twitter.com/liaasister/status/1736446701869633621,,
2023-12-18 02:03:05+07:00,1736462033913004218,ALL THE TINGS SWING MY WAY MY WOOD IS LARGE AND IM RICH BENGALI THRAXXTUBBY GANG MEMBER https://t.co/vfZKvmMseb,0,3,3,24,en,1305621151939465216,1736462033913004218,brokeurmuhymen,https://twitter.com/brokeurmuhymen/status/1736462033913004218,https://pbs.twimg.com/media/GBkmtrfWIAA0rQl.jpg, 🏴󠁧󠁢󠁥󠁮󠁧󠁿🇧🇩 19 
2023-12-18 03:46:09+07:00,1736487972948910541,@Mayapada0812 Maa syaa Allah. Alhamdulillah  semoga pilpres berjalan dengan jurdil  sehingga Bapak Anis Baswedan dan Bapak Muhaimin Iskandar pimpin RI 24 29 untuk keadilan sosial bagi seluruh rakyat Indonesia. Aamiin ❗ https://t.co/9F3eaq5tuf,0,0,5,29,in,1247097802938712064,1736429432695595515,AbdHali59646742,https://twitter.com/AbdHali59646742/status/1736487972948910541,https://pbs.twimg.com/media/GBk-m4daUAAD5P1.jpg,"Beji, Pasuruan, Jawa Timur"
2023-12-18 04:43:32+07:00,1736502412373057754,@Dennysiregar7 Insya Allah Anis-Muhaimin Daja Jelas Konsep Perubahan Untuk Indonesia yg lebih Baik https://t.co/PCStNG08lu,1,19,13,71,in,2919163734,1736416226170081503,cowokkeren72,https://twitter.com/cowokkeren72/status/1736502412373057754,https://pbs.twimg.com/media/GBlLvPxa8AAiElc.jpg,"Yogyakarta, Indonesia"
2023-12-18 04:57:31+07:00,1736505932505591988,@yusuf_dumdum Yg Aman Itu Pilih ANIS-Muhaimin Saja  Jelas Rekam Jejak dan Visi  Misi Perubahan yg Logis Untuk Indonesia yg lebih baik https://t.co/LsvfpJ3gB7,0,0,1,2,in,2919163734,1736182425225707993,cowokkeren72,https://twitter.com/cowokkeren72/status/1736505932505591988,https://pbs.twimg.com/media/GBlO8IUaoAAD9w7.jpg,"Yogyakarta, Indonesia"
2023-12-18 05:00:13+07:00,1736506612851097659,@Fahrihamzah Insya Allah NTB Tetap Anis -Muhaimin Saja https://t.co/0Frkw6P32n,0,0,0,0,in,2919163734,1736200848831881686,cowokkeren72,https://twitter.com/cowokkeren72/status/1736506612851097659,https://pbs.twimg.com/media/GBlPjuobkAAUlQ2.jpg,"Yogyakarta, Indonesia"
2023-12-18 05:09:20+07:00,1736508904295817490,Wahai Rakyat Indonesia   mari kita bersama Bangkit utk menuju Indonesia adil  makmur  dn sejahtera bersam BPK Anis RB dn Bpk Muhaimin Iskandar dn mencoblos di Pilpres no 01 !!! https://t.co/k9QG8IkYsH,0,0,0,0,in,1452143716177637376,1736508904295817490,MochZamroni9,https://twitter.com/MochZamroni9/status/1736508904295817490,https://pbs.twimg.com/ext_tw_video_thumb/1736508866983235584/pu/img/Gbk9DC8a-4WRZsty.jpg,
2023-12-18 05:56:12+07:00,1736520699349704733,@tvOneNews Anies - Muhaimin □ AMIN no ☝️ Terbaik untuk NKRI 😊 🇲🇨🇲🇨  #AniesMuhaimin2024 https://t.co/3YSAFId9yA,0,0,0,0,in,1721752213620764672,1736229816112947659,pahlawi65,https://twitter.com/pahlawi65/status/1736520699349704733,https://pbs.twimg.com/media/GBlcX5obcAAtZ--.jpg,
2023-12-18 06:00:49+07:00,1736521860219891963,Udah jelas banget kan  Prabowo-Gibran itu bukan pilihan yang tepat. Mendingan yang udah teruji  Anies-Muhaimin. @Kuli_hotel  https://t.co/zt41wHB3jC,0,0,0,0,in,1679068198858280967,1736521860219891963,ZulheviSik,https://twitter.com/ZulheviSik/status/1736521860219891963,,Gunungsitoli
2023-12-18 06:09:34+07:00,1736524061961031829,Anies + Muhaimin itu personifikasi dua wajah Islam inklusif yang menjadi pintu gerbang politik  dan pembangunan akan dijalankan secara moderat.   Keduanya lahir dari basis sosial yang moderat.  Keduanya lahir dari basis nilai organisasi yang menekankan eksistensinya sebagai kader…,0,5,56,112,in,1244819229578121216,1736524061961031829,Munir_Timur,https://twitter.com/Munir_Timur/status/1736524061961031829,,
2023-12-18 06:45:27+07:00,1736533093031584250,VISI MISI mas Anies Baswedan dan Gus Muhaimin Iskandar paling mateng😍 gagasan untuk Indonesianya sudah jelas  perubahan! Keadilan! Kesetaraan! Itu yang sebenernya dibutuhkan masyarakat Indonesia saat ini! 💚🇮🇩 #AMINAjaDulu https://t.co/yoss8czpio,0,1,7,18,in,432390156,1736533093031584250,UncDeep,https://twitter.com/UncDeep/status/1736533093031584250,https://pbs.twimg.com/media/GBlnZyKaoAA_3j0.png,Ngalam
