created_at,id_str,full_text,quote_count,reply_count,retweet_count,favorite_count,lang,user_id_str,conversation_id_str,username,tweet_url,image_url,location
2023-12-18 16:14:49+07:00,1736676380950327342,KPU jewer kelakuan Gibran  Mega Ijazah Scoopy Kairi Muhaimin Senin Sore Ndasmu Apel Pagi Banyumas JEON WONWOO Sehun WHO IN NCT DREAM  郵政民営化 細田前議長 難聴系男子 一人称ボク うっ血性心不全 https://t.co/47YMQStARu,0,0,1,1,ja,1639214998319931393,1736676380950327342,chadamayanti0,https://twitter.com/chadamayanti0/status/1736676380950327342,https://pbs.twimg.com/ext_tw_video_thumb/1736674138138509312/pu/img/LrvRx8dLsrJopJgJ.jpg,Indonesia
2023-12-18 16:17:06+07:00,1736676954139668957,Anies-Muhaimin Janji Evaluasi Proyek Strategis Nasional Jokowi https://t.co/TMVGd5JW9h #TempoBisnis,44,1858,1063,1566,in,18129942,1736676954139668957,tempodotco,https://twitter.com/tempodotco/status/1736676954139668957,,Indonesia
2023-12-18 16:21:10+07:00,1736677979680563456,Iran-backed Hamas leaders declared on Houthi's TV about Jerusalem  Christians  etc.😳  Watch and share. Hello  Mega Assad Ndasmu Khalistan Muhaimin Gardai Oslo Ukrainian The Irish Secret Service Deport Scoopy Pope Article 7 Iran Qatar Hezbollah Houthi Houthis Hamas #HamasisISIS,0,1,1,1,en,1682591883586064385,1736677979680563456,HerryRodinNapit,https://twitter.com/HerryRodinNapit/status/1736677979680563456,,
2023-12-18 16:24:35+07:00,1736678838413959293,Muhaimin Iskandar atau yang akrab disapa Cak Imin  berjanji akan memberantas pinjaman online (pinjol) dan judi online jika terpilih sebagai Wakil Presiden Republik Indonesia pada Pemilihan Presiden (Pilpres) 2024 mendatang.  “Jadi sebetulnya kemarin ada sebuah media melaporkan… https://t.co/njPglxXjOm,10,50,102,515,in,55507370,1736678838413959293,tvOneNews,https://twitter.com/tvOneNews/status/1736678838413959293,https://pbs.twimg.com/media/GBnsK8bbgAAgQpX.jpg,"Pulo Gadung, Indonesia"
2023-12-18 16:32:40+07:00,1736680870223007944,Ibu Mega memberikan dukungan penuh kepada Pasangan 01 Anies - Muhaimin  https://t.co/SsfOxRTcyY,0,0,5,36,in,1596027931129937920,1736680870223007944,anas_pnk90,https://twitter.com/anas_pnk90/status/1736680870223007944,https://pbs.twimg.com/ext_tw_video_thumb/1736625436107714560/pu/img/ceuhIByzU6hwIbSN.jpg,Indonesia
2023-12-18 16:33:16+07:00,1736681024359448853,Prabowo - Gibran Presiden 2024 Dan Demokrat Menang Rakyat Berdaulat Indonesia Berjaya Anies Baswedan - Muhaimin Serta Ganjar - Mahfud Tetap Bersama Bangun Negeri  Piye Enak To Ga Buat Ndasmu Mumet Maneh https://t.co/8X5nGkSYgr,3,29,25,48,in,117694469,1736681024359448853,dhemit_is_back,https://twitter.com/dhemit_is_back/status/1736681024359448853,https://pbs.twimg.com/ext_tw_video_thumb/1736680855991685120/pu/img/6Hef5qfna-GvYTIG.jpg,"Singapur, India"
2023-12-18 16:34:36+07:00,1736681357122891930,Muhaimin Iskandar Respons Prabowo: Jangan Remehkan Etika https://t.co/IpxeW3unCa #TempoVideo,0,3,2,3,in,18129942,1736681357122891930,tempodotco,https://twitter.com/tempodotco/status/1736681357122891930,,Indonesia
2023-12-18 16:38:48+07:00,1736682415601660100,Semoga Pak Ganjar nanti bisa menyelesaikannya  Mega Ijazah Scoopy Kairi Muhaimin Senin Sore Ndasmu Apel Pagi Banyumas JEON WONWOO Sehun WHO IN NCT DREAM  郵政民営化 細田前議長 難聴系男子 一人称ボク うっ血性心不全 https://t.co/BcNOaeswCB,0,0,1,3,ja,1633762084805824513,1736682415601660100,RustamYuna,https://twitter.com/RustamYuna/status/1736682415601660100,https://pbs.twimg.com/ext_tw_video_thumb/1736681712917381121/pu/img/moRufXLGrZ0l2uBN.jpg,Indonesia
2023-12-18 16:45:38+07:00,1736684133504717285,Aduh.. yaudah ngamuk lg nih😂  ROY MORGAN POLL Anies-Muhaimin : 25% Prabowo-Gibran : 30% Ganjar-Mahfud : 38% POLTRACKING INDONESIA Anies-Muhaimin : 23 1% Prabowo-Gibran : 45 2% Ganjar-Mahfud: 27 3% LITBANG KOMPAS Anies-Muhaimin: 16 7% Prabowo-Gibran : 39 3% Ganjar-Mahfud : 15 3% https://t.co/V0hHa5IA81,12,238,27,100,in,1523245126784413696,1736684133504717285,Chaves1305,https://twitter.com/Chaves1305/status/1736684133504717285,https://pbs.twimg.com/media/GBnxAw4agAAcxpG.jpg,
2023-12-18 16:49:55+07:00,1736685212464279760,Masih gemoy kah? seperti nya gimmick gemoy udah gagal total neh. Rusak gegara Ndasmu Etik  wkwk 😬 #PrabowoGemoy   [[ Prabowo-Gibran Muhaimin Anies Baswedan Mega Ijazah Polri Ndasmu Senin Siang Miftah ]] https://t.co/UWI8hdpCdz,0,0,0,3,in,950942410057510914,1736685212464279760,mikaylalala17,https://twitter.com/mikaylalala17/status/1736685212464279760,https://pbs.twimg.com/media/GBnx_0Nb0AAxdzc.jpg,
2023-12-18 16:55:07+07:00,1736686521418489858,Sandiaga Uno❗ Pak Menteri ini x Ganjar Bagaimana program kemajuan untuk Indonesia📈  Mega Ijazah Muhaimin Scoopy Kairi Banyumas Ndasmu Miftah https://t.co/0j1aa36qpW,0,0,2,19,in,1562705824262557696,1736686521418489858,arini_kamal,https://twitter.com/arini_kamal/status/1736686521418489858,https://pbs.twimg.com/ext_tw_video_thumb/1736686471778840576/pu/img/E4urdDr0MGS780Y7.jpg,
2023-12-18 16:58:16+07:00,1736687314859090110,Bu Mega berkunjung ke Roma untuk bahas acara Zayed Award 2024. Megawati akan jadi juri Zayed Award pada penghargaan Zayed untuk persaudaraan manusia 2024 ~   [[ Prabowo-Gibran Muhaimin Anies Baswedan Mega Ijazah Polri Ndasmu Senin Siang Miftah ]] https://t.co/XTWORAusdY,0,0,0,4,in,950942410057510914,1736687314859090110,mikaylalala17,https://twitter.com/mikaylalala17/status/1736687314859090110,https://pbs.twimg.com/media/GBnz578bEAAgAAi.jpg,
2023-12-18 16:58:36+07:00,1736687396589392168,Yakini Ganjar Pilihan Tepat❗ Ini alasan yakini Ganjar Pilihan Tepat dari Kyai🔥  Mega Ijazah Muhaimin Scoopy Kairi Banyumas Ndasmu Miftah Fadil https://t.co/qFX2ufAIMg,0,0,4,13,in,1578633990067859456,1736687396589392168,Jamilahlarasa,https://twitter.com/Jamilahlarasa/status/1736687396589392168,https://pbs.twimg.com/ext_tw_video_thumb/1736687353073422336/pu/img/GIdH140jE00-OltW.jpg,
2023-12-18 17:00:05+07:00,1736687770167648666,Anies-Muhaimin Janjikan Modal Rp 10 Juta untuk Anak Muda Buka Usaha https://t.co/DJRBOfUL3a #TempoBisnis,2,3,9,27,in,18129942,1736687770167648666,tempodotco,https://twitter.com/tempodotco/status/1736687770167648666,,Indonesia
2023-12-18 17:00:54+07:00,1736687975961096588,Wowwww❗ Masa PSBB lagi si  isu virus ini mulai menyebar ke beberapa negara termasuk Indonesia terkait Cov1d📈  Mega Ijazah Muhaimin Scoopy Kairi Banyumas Ndasmu Miftah Fadil https://t.co/QTFG4jWTRN,0,0,1,7,in,1571710925656444929,1736687975961096588,KikiAnj11376045,https://twitter.com/KikiAnj11376045/status/1736687975961096588,https://pbs.twimg.com/ext_tw_video_thumb/1736687939122503680/pu/img/ydoB8qklm3NeLLHe.jpg,
2023-12-18 17:05:48+07:00,1736689208243417242,Emang boleh  emang boleeh yaa begitu  huhu.. apa jadinya kloo.. ahsudahlah.. :(  [[ Prabowo-Gibran Muhaimin Anies Baswedan Mega Ijazah Polri Ndasmu Senin Siang Miftah ]]  Gak Gemoy ishh.. #PrabowoGemoy https://t.co/3aANnPN8R2,0,0,6,11,in,950611484559601665,1736689208243417242,nurulrahmi92,https://twitter.com/nurulrahmi92/status/1736689208243417242,https://pbs.twimg.com/ext_tw_video_thumb/1736689174194040832/pu/img/tmIaWaRNdLHM9qfG.jpg,
2023-12-18 17:09:04+07:00,1736690034202595608,Baru jadi calon ibu negara saja  sambutannya sangat hangat. Bu Atiqoh sangat ramah dan lembut  makanya dicintai masyarakat :)  [[ Prabowo-Gibran Muhaimin Anies Baswedan Mega Ijazah Polri Ndasmu Senin Siang Miftah ]]  #GanjarMahfudSatset #GanjarMahfudM3nang  #GanjarMahfud https://t.co/Ur5CfDCLaT,0,0,3,12,in,950611484559601665,1736690034202595608,nurulrahmi92,https://twitter.com/nurulrahmi92/status/1736690034202595608,https://pbs.twimg.com/ext_tw_video_thumb/1736689978443468800/pu/img/29uk9P09NHODa1NQ.jpg,
2023-12-18 17:13:52+07:00,1736691238177472986,Wow isu anggaran kampanye Prabowo-Gibran 400 T ???  Emang boleh segede itu 😋😜  Muhaimin pasti iri...  Apa 24 jam gapake libur? 🔥  Bakalan banyak yg nanya  dihabiskan buat apa itu...  Dan dari mana datangnya bulan... 😜😋😁 _____ Koran BTOB POPE ijazah Mega #StrikeForGaza https://t.co/RcecfQCW1U,2,0,0,2,in,1322542259191963649,1736691238177472986,langityang7,https://twitter.com/langityang7/status/1736691238177472986,https://pbs.twimg.com/ext_tw_video_thumb/1736691193457836032/pu/img/kwUPgO4bvih5rUAv.jpg,"Washington, DC"
2023-12-18 17:14:07+07:00,1736691303814209818,@_TheJebs @KKMPutrajaya https://t.co/ZE6VFh5jRl,0,1,7,5,qme,4857330196,1736599979341582390,YusofMuhaimin,https://twitter.com/YusofMuhaimin/status/1736691303814209818,https://pbs.twimg.com/media/GBn3hQHbIAA_3si.jpg,Shah Alam
2023-12-18 17:15:37+07:00,1736691681716843005,Tuhh kan.. gue kate juga apee.. 😅 lucu bgt lagi video nya.. sa ae neh yg bikin giniaan  wkwk   [[ Prabowo-Gibran Muhaimin Anies Baswedan Mega Ijazah Polri Ndasmu Senin Siang Miftah ]]  #PrabowoGemoy #PrabowoBukanJokowi https://t.co/BkoLVUwO5d,0,0,2,11,in,950608676926013441,1736691681716843005,callmesarry,https://twitter.com/callmesarry/status/1736691681716843005,https://pbs.twimg.com/ext_tw_video_thumb/1736691635252338688/pu/img/nnqfNfLKvtljqyYx.jpg,"Yogyakarta, Indonesia"
2023-12-18 17:19:19+07:00,1736692610914529311,Duhh.. ratusan hektar dong.. udah mah babat hutan  nihil pula hasil nya. Ckckck.. 😮‍💨😶  [[ Prabowo-Gibran Muhaimin Anies Baswedan Mega Ijazah Polri Ndasmu Senin Siang Miftah ]]  #PrabowoGemoy #PrabowoBukanJokowi https://t.co/SekHJ0jskp,0,0,2,11,in,950608676926013441,1736692610914529311,callmesarry,https://twitter.com/callmesarry/status/1736692610914529311,https://pbs.twimg.com/ext_tw_video_thumb/1736692531021447168/pu/img/idqf0jMIqyfd02ha.jpg,"Yogyakarta, Indonesia"
2023-12-18 17:29:50+07:00,1736695256656253242,Serius ini?. Wah wah waaaaah.  Rp 102-an miliar untuk Prabowo-Gibran ?.  Mega Miftah Muhaimin Fadil https://t.co/qFrAXXZ1gd,0,0,0,3,in,950959941489065985,1736695256656253242,Bilgiss087,https://twitter.com/Bilgiss087/status/1736695256656253242,https://pbs.twimg.com/media/GBn7IbJaoAAHpdq.jpg,
2023-12-18 17:30:31+07:00,1736695431277748592,Suka dehh sama mbak Inayah Wahid klo udah rosting Gemoy  wkwkk.. ngakak bgt dehh 🤣  [[ Prabowo-Gibran Muhaimin Anies Baswedan Mega Ijazah Polri Ndasmu Senin Siang Miftah ]]  #PrabowoGemoy #PrabowoBukanJokowi https://t.co/bTzsv12cxh,0,0,4,11,in,950608676926013441,1736695431277748592,callmesarry,https://twitter.com/callmesarry/status/1736695431277748592,https://pbs.twimg.com/ext_tw_video_thumb/1736695317360476160/pu/img/-1Dg3BVv5Z-MMQ75.jpg,"Yogyakarta, Indonesia"
2023-12-18 17:37:34+07:00,1736697205552280032,Ini dia gagasan dari paslon nomor 1  Anies-Muhaimin tentang transportasi publik~ https://t.co/f3LambCQVC,10,2,23,91,in,1158355819512991747,1736697198388383912,NarasiNewsroom,https://twitter.com/NarasiNewsroom/status/1736697205552280032,https://pbs.twimg.com/media/GBn6DtabYAAYfKJ.jpg,
2023-12-18 17:53:22+07:00,1736701181458878686,Wkwkwk.. jan pada galak napa  harus riang gembira dan gemoy dong  hehee..   [[ Prabowo-Gibran Muhaimin Anies Baswedan Mega Ijazah Polri Ndasmu Senin Siang Miftah Fadil Libur ]]  #PrabowoGemoy #PrabowoBukanJokowi https://t.co/jLiP8Itj4P,0,0,5,13,in,950942410057510914,1736701181458878686,mikaylalala17,https://twitter.com/mikaylalala17/status/1736701181458878686,https://pbs.twimg.com/ext_tw_video_thumb/1736700401410584576/pu/img/Y3m7dZa3jz4BYncy.jpg,
2023-12-18 17:57:23+07:00,1736702192940442100,Suka deh sama habit hidup sehat pak Ganjar Pranowo. Kesehatan aja dijaga  apalagi rakyat kan  muehehee 🤟  [[ Prabowo-Gibran Muhaimin Anies Baswedan Mega Ijazah Polri Ndasmu Senin Siang Miftah Fadil Libur #PrabowoBukanJokowi ]]  #GanjarMahfudSatset #GanjarMahfudM3nang https://t.co/eIiakGGGkX,0,1,3,9,in,950611484559601665,1736702192940442100,nurulrahmi92,https://twitter.com/nurulrahmi92/status/1736702192940442100,https://pbs.twimg.com/ext_tw_video_thumb/1736701940212670464/pu/img/fH-pQloDnmuXlKzH.jpg,
2023-12-18 17:57:52+07:00,1736702311177838675,Cawapres nomor urut 01  Muhaimin Iskandar @cakiminow menghadiri pertemuan dengan Ketua Majelis Ta'lim se-Bekasi Jawa Barat. Dalam perkataannya  Cak Imin pastikan akan melibatkan warga khususnya buruh dalam pembuatan Undang-Undang ke depannya.  Download #metrotvxtend di app store… https://t.co/4rEVWhTZPN,2,2,93,284,in,57261519,1736702311177838675,Metro_TV,https://twitter.com/Metro_TV/status/1736702311177838675,https://pbs.twimg.com/ext_tw_video_thumb/1736698858007392256/pu/img/QPIB_evzxHV-7KRD.jpg,
2023-12-18 17:59:54+07:00,1736702823197503941,Bagi saya buruh ini pahlawan bukan hanya bagi keluarga dan perusahaan  tetapi juga bagi negara. Bayangkan saja  tanpa peran mereka roda perekonomian suatu negara tidak mungkin bisa berjalan optimal. Karena itu  negara wajib hadir dan memfasilitasi hak mereka secara adil.  Ada… https://t.co/5yMY1B7c8a,11,47,775,2261,in,1490116879,1736702823197503941,cakimiNOW,https://twitter.com/cakimiNOW/status/1736702823197503941,https://pbs.twimg.com/amplify_video_thumb/1736702516132450304/img/kXhml3O7Bi7M2m0k.jpg,Indonesia
2023-12-18 18:02:36+07:00,1736703505392640195,Ganjar Usul Aturan Debat  Muhaimin: Semua Terserah KPU  Kita Ikut yang Diminta https://t.co/Wzel2rTcGA,1,50,20,68,in,71436318,1736703505392640195,KompasTV,https://twitter.com/KompasTV/status/1736703505392640195,,Indonesia
2023-12-18 18:04:23+07:00,1736703954200015240,Mikir dong sebelum pilih  masa iya Prabowo-Gibran yang notabene gak berkelas mau dipilih. Anies-Muhaimin yang bener. @wonunuwon  https://t.co/5Mxkrrx1jQ,0,0,0,0,in,1678336036940939264,1736703954200015240,agamparulian_,https://twitter.com/agamparulian_/status/1736703954200015240,,Gunungsitoli
2023-12-18 18:20:36+07:00,1736708033525526856,Calon Wakil Presiden (Cawapres) nomor urut dua  Muhaimin Iskandar berjanji akan modali anak muda senilai Rp10 Juta jika menang.  Cak Imin berjanji akan memberikan modal bagi anak muda yang  ingin jadi pengusaha. Adapun modal usaha yang dijanjikan sebesar Rp10 Juta tanpa adanya… https://t.co/vDldjllGBn,2,18,3,10,in,55507370,1736708033525526856,tvOneNews,https://twitter.com/tvOneNews/status/1736708033525526856,https://pbs.twimg.com/ext_tw_video_thumb/1736707604922130432/pu/img/9T2_A4v2hnoM71Mn.jpg,"Pulo Gadung, Indonesia"
2023-12-18 18:30:24+07:00,1736710502032834721,Haruus Gemoy dong ahh.. ndak boleh misu misu yaa.. kubu #PrabowoGemoy harus riang gembira gemoy selalu dong..  [[ Senin Sore Prabowo Pemarah Ndasmu Fadil Muhaimin Anies Baswedan Mega Ijazah Polri Miftah Libur Ponpes Lirboyo Kediri ]] https://t.co/dzu94xKsz9,1,3,9,18,in,950608676926013441,1736710502032834721,callmesarry,https://twitter.com/callmesarry/status/1736710502032834721,https://pbs.twimg.com/ext_tw_video_thumb/1736709739214700544/pu/img/gefElnEOGjKk9wqb.jpg,"Yogyakarta, Indonesia"
2023-12-18 18:31:45+07:00,1736710841993695412,Ini sih wajib diusut tuntas  hingga terang benderang. Jangan bungkam dong klo emg ndak salah.. #PrabowoGemoy   [[ Senin Sore Prabowo Pemarah Ndasmu Fadil Muhaimin Anies Baswedan Mega Ijazah Polri Miftah Libur Ponpes Lirboyo Kediri ]] https://t.co/gyUYD75R6o,0,0,3,8,in,950608676926013441,1736710841993695412,callmesarry,https://twitter.com/callmesarry/status/1736710841993695412,https://pbs.twimg.com/media/GBoJToqaQAAANT-.jpg,"Yogyakarta, Indonesia"
2023-12-18 18:33:25+07:00,1736711259536674939,"((( ALHAMDULILLAH ))) PONPES LIRBOYO DUKUNG AMIN di PILPRES 2024  KH Anwar Manshur  Kami bersama-sama membulatkan tekad memenangkan Muhaimin Iskandar. Kalau kita ini bersatu insyaallah  Allah akan mempermudah. Warga Nahdlatul Ulama itu kan banyak  kalau bersama-sama  insyaallah… https://t.co/vpe9jhuASQ""",5,28,419,1064,in,1466651308102877187,1736711259536674939,papa_loren,https://twitter.com/papa_loren/status/1736711259536674939,https://pbs.twimg.com/media/GBoJru1agAAT5Tk.jpg,~#
2023-12-18 18:49:38+07:00,1736715340795814180,Duh.. usuuut sut tuntaaasss.. masa begitu  usut tuntas biar jelas..   [[ Senin Sore Prabowo Pemarah Ndasmu Fadil Muhaimin Anies Baswedan Mega Ijazah Polri Miftah Libur Ponpes Lirboyo Kediri ]]  #PrabowoGemoy https://t.co/YkwbB8pMYF,0,1,4,11,in,950611484559601665,1736715340795814180,nurulrahmi92,https://twitter.com/nurulrahmi92/status/1736715340795814180,https://pbs.twimg.com/media/GBoNZeZa8AAU8tZ.jpg,
2023-12-18 18:58:01+07:00,1736717452132905294,Hutan beratus-ratus hektar digunduli  tapi hasilnyaa... tak sesuai harapan.. Percuma sudah.. #PrabowoGemoy   [[ Senin Sore Prabowo Pemarah Ndasmu Fadil Muhaimin Anies Baswedan Mega Ijazah Polri Miftah Libur Ponpes Lirboyo Kediri ]] https://t.co/ItHRfMKKfZ,1,4,13,39,in,950611484559601665,1736717452132905294,nurulrahmi92,https://twitter.com/nurulrahmi92/status/1736717452132905294,https://pbs.twimg.com/ext_tw_video_thumb/1736717354913189888/pu/img/ZtJMV_JEkOvM1FnG.jpg,
2023-12-18 19:00:10+07:00,1736717992971641264,Mbak Inayah emg the best.. seneng deh klo udah rosting kubu pak Gemoy.. #PrabowoGemoy   [[ Senin Sore Prabowo Pemarah Ndasmu Fadil Muhaimin Anies Baswedan Mega Ijazah Polri Miftah Libur Ponpes Lirboyo Kediri ]] https://t.co/H5CEjGavDr,2,2,37,100,in,950611484559601665,1736717992971641264,nurulrahmi92,https://twitter.com/nurulrahmi92/status/1736717992971641264,https://pbs.twimg.com/ext_tw_video_thumb/1736717885492658176/pu/img/aoXKlvdYECkXuYm-.jpg,
2023-12-18 19:13:31+07:00,1736721350281294000,PARA PENDEKAR PEMBERANTASAN KORUPSI YANG MENJADI BAGIAN DARI TIMNAS AMIN...  3 MANTAN PIMPINAN KPK MASUK TIM SUKSES ANIES-MUHAIMIN....‼️  #GemoyHausKekuasaan  #GemoyHausKekuasaan  🆘🆗 https://t.co/Pr3hyPYxxw,6,8,215,457,in,1679184284098367489,1736721350281294000,P3n99u94t_,https://twitter.com/P3n99u94t_/status/1736721350281294000,https://pbs.twimg.com/ext_tw_video_thumb/1736721333210476544/pu/img/11-KfJ-8_ZMklw9N.jpg,
2023-12-18 19:13:48+07:00,1736721422180082065,Khan maeen  ini lucu banget sih.. wkwk.. ada aja yg bikin giniaan  wkwkk.. #PrabowoGemoy   [[ Senin Sore Prabowo Pemarah Ndasmu Fadil Muhaimin Anies Baswedan Mega Ijazah Polri Miftah Libur Ponpes Lirboyo Kediri ]] https://t.co/Wvp6pxzl84,0,0,5,15,in,950611484559601665,1736721422180082065,nurulrahmi92,https://twitter.com/nurulrahmi92/status/1736721422180082065,https://pbs.twimg.com/ext_tw_video_thumb/1736721388336291840/pu/img/P0kQWjzDVlrBtS1m.jpg,
2023-12-18 19:13:54+07:00,1736721447744385395,"Kentongan 57 adalah gerakan rakyat untuk perubahan.  57% adalah target kemenangan Anies Muhaimin AMIN  Bismillah  gerakan 57 kentongan pertama kali diresmikan di Kalimantan Timur.""  #GemoyHausKekuasaan  #GemoyHausKekuasaan https://t.co/BhqUz8gwx9""",0,0,9,14,in,1373967328979787779,1736721447744385395,bianca01403,https://twitter.com/bianca01403/status/1736721447744385395,https://pbs.twimg.com/ext_tw_video_thumb/1736721390483734529/pu/img/t_fP46iQ-i9gkFGc.jpg,
2023-12-18 19:16:56+07:00,1736722212198256691,Gama dan Amin sudah minta buka. Yuk 02 ikutan.  https://t.co/6dmKJo5WKK,2,4,165,276,in,99926414,1736722212198256691,pakaipeci,https://twitter.com/pakaipeci/status/1736722212198256691,,Bumi
2023-12-18 19:28:11+07:00,1736725040673198315,"Prabowo Gibran bisa dikalahkan.   Saya tidak punya agenda menenangkan Anies Muhaimin. Saya tidak punya agenda memenangkan Ganjar Mahfud. Saya cuma punya 1 agenda yaitu mengalahkan Joko Widodo."" (Eep)  #GemoyHausKekuasaan  #GemoyHausKekuasaan https://t.co/MCsARLsr5G""",1,0,3,8,in,1373967328979787779,1736725040673198315,bianca01403,https://twitter.com/bianca01403/status/1736725040673198315,https://pbs.twimg.com/ext_tw_video_thumb/1736725005290074112/pu/img/PlwU0mFKBhlY8dpS.jpg,
2023-12-18 19:28:59+07:00,1736725241962152182,Panjang Umur Perjuangan  Semua Akan AMIN Pada Waktunya💪  Baliho pasangan AMIN Anies Baswedan - Muhaimin Iskandar No 1 sudah terpasang di Bali guys   #AMINAjaDulu https://t.co/Q20THbfH8n,8,14,440,1152,in,1334853481019056128,1736725241962152182,Mdy_Asmara1701,https://twitter.com/Mdy_Asmara1701/status/1736725241962152182,https://pbs.twimg.com/ext_tw_video_thumb/1736725203059879936/pu/img/RLI10XtrNUa_srt5.jpg,Jakarta Capital Region
2023-12-18 19:32:14+07:00,1736726062363803752,Bagi Yg Mendukung Pak Anies Dari 2021 Tentu Inget Betul Penjegalan Terus Dilakukan Kubu Yg Tak Ingin Anies Maju Pilpres   Alhamdulillah Kini Anies Baswedan &amp; Muhaimin Iskandar Resmi Capres cawapres 2024   Mari Menangkan !!! https://t.co/MaP3icEko2,0,2,9,19,in,1580531078280146944,1736726062363803752,msw_andi,https://twitter.com/msw_andi/status/1736726062363803752,https://pbs.twimg.com/media/GBoXJm2bkAAC6Ul.jpg,"Jawa Tengah, Indonesia"
2023-12-18 19:40:49+07:00,1736728222220558786,Keren si Keluarga Ini♥️ Bagaimana mendidiknya terlihat Cerdas dan di didik dengan Baik  Mantap Pak  Mega Ijazah Muhaimin Scoopy Kairi Banyumas Ndasmu Miftah Fadil Pram Kendall Samsul https://t.co/tzqnIfxL1I,1,0,2,18,in,1577554318559174656,1736728222220558786,aristi_widya,https://twitter.com/aristi_widya/status/1736728222220558786,https://pbs.twimg.com/ext_tw_video_thumb/1736728178436325376/pu/img/mxTBkjT6kFWSuu8_.jpg,Surabaya
2023-12-18 19:44:11+07:00,1736729070086541558,Wow  masa mau Part lagi si  Virus❗ Semoga cepat mereda  diatasi pemerintah  gimana menurut kalian guys❓  Mega Ijazah Muhaimin Scoopy Kairi Banyumas Ndasmu Miftah Fadil Pram Kendall Samsul https://t.co/J7dRfFdHVC,0,0,1,7,in,1577561349680664576,1736729070086541558,AdindaSilvy12,https://twitter.com/AdindaSilvy12/status/1736729070086541558,https://pbs.twimg.com/ext_tw_video_thumb/1736729002281504769/pu/img/NtmTkmjSvvKjKpwd.jpg,Bogor
2023-12-18 19:44:16+07:00,1736729088734482888,Bukan Saja Relawan AMIN Tak Minta Bayaran Tapi Relawan &amp; Simpatisan AMIN Yg Sangat Militan Juga Swadaya Membuat APK Demi Memperjuangkan Keadilan   Kemakmuran &amp; Kesetaraan Yg Dinahkodai Oleh Anies Baswedan &amp; Muhaimin Iskandar.  #AniesMuhaimin2024 https://t.co/qtnNekEe4s,0,0,2,7,in,1580531078280146944,1736729088734482888,msw_andi,https://twitter.com/msw_andi/status/1736729088734482888,https://pbs.twimg.com/media/GBoZ5sHbgAA7IoO.jpg,"Jawa Tengah, Indonesia"
2023-12-18 19:47:17+07:00,1736729847299494074,Kalian yakini pemimpin pilihan Tepat itu pada siapa guys⁉️ Semakin dekat dengan pemilu  pemimpin pilihan tepat diyakini memang dengan rekam jejak dan juga pengalamnnya  Mega Ijazah Muhaimin Scoopy Kairi Banyumas Ndasmu Miftah Fadil Pram Kendall Samsul Copenhagen UCL internet https://t.co/Qap4VAROGi,1,1,3,13,in,1577864302320418818,1736729847299494074,PikiranNkri,https://twitter.com/PikiranNkri/status/1736729847299494074,https://pbs.twimg.com/ext_tw_video_thumb/1736729780228399104/pu/img/RuPyHWeMfGhFVMkk.jpg,
2023-12-18 19:47:50+07:00,1736729985224675633,Tantangan bagi bagi timses Anies Baswedan dan Muhaimin Iskandar (AMIN) untuk lebih bersungguh-sungguh mnedekati kelompok pemilih dari kelas menengah kebawah https://t.co/EVGzXgbu7W,1,0,4,4,in,158162219,1736729985224675633,arwidodo,https://twitter.com/arwidodo/status/1736729985224675633,https://pbs.twimg.com/ext_tw_video_thumb/1736729928568074240/pu/img/PE4lM_aGM3zuhuJm.jpg,Indonesia
2023-12-18 19:53:28+07:00,1736731406884360339,Alhamdulillah 🤲🏽  Pondok Pesantren Lirboyo dukung Anies-Muhaimin #AniesMuhaimin2024  #AminPalingSiapUntukIndonesia https://t.co/vOQxmLLYtK,0,1,74,182,in,1329714991512002560,1736731406884360339,baharirwan2,https://twitter.com/baharirwan2/status/1736731406884360339,https://pbs.twimg.com/ext_tw_video_thumb/1736731361346727937/pu/img/u80GEhuNMi3Qp51a.jpg,Kutub Utara
2023-12-18 19:54:28+07:00,1736731656852234265,Gus Imin: Guru Ngaji Membangun Akhlak  Negara Harus Beri Perhatian  https://t.co/yeCV5N294n,5,31,298,1062,in,1490116879,1736731656852234265,cakimiNOW,https://twitter.com/cakimiNOW/status/1736731656852234265,,Indonesia
2023-12-18 20:00:16+07:00,1736733116964982899,"Soal Ndasmu Etik""  Jubir Anies-Muhaimin: Kita Jadi Mengerti Prabowo yang Sesungguhnya https://t.co/ahKTQt3hEA""",1,0,30,42,in,887743587579944960,1736733116964982899,OposisiCerdas,https://twitter.com/OposisiCerdas/status/1736733116964982899,,
2023-12-18 20:11:41+07:00,1736735988783935852,PAKTA INTEGRITAS IJTIMA ULAMA  Pakta integritas Ijtima Ulama yang ditandatangani oleh Anies-Muhaimin mendapatkan dukungan dari beberapa pihak  namun juga mendapatkan kritik terkait dengan beberapa poin yang dianggap kontradiktif dan adanya stigma terhadap Anies terkait dengan… https://t.co/T8Ry3m5Lga,2,16,184,578,in,34075325,1736735988783935852,ismailfahmi,https://twitter.com/ismailfahmi/status/1736735988783935852,https://pbs.twimg.com/media/GBof2Wga4AArrBM.jpg,"Jakarta Selatan, DKI Jakarta"
2023-12-18 20:20:05+07:00,1736738102872571961,Komitmen itu  kata dia  mencegah terjadinya stunting   https://t.co/YP6QJMgICS,0,1,1,4,in,68930552,1736738102872571961,mediaindonesia,https://twitter.com/mediaindonesia/status/1736738102872571961,,Jakarta - Indonesia
2023-12-18 20:22:59+07:00,1736738835072221413,PRO-KONTRA IJTIMA ULAMA  Pandangan yang mendukung:  - Beberapa akun seperti @OposisiCerdas  @keuangannews_id  @Malika6027  dan @Muslim_AntiPKI9 menyatakan dukungan terhadap pakta integritas Ijtima Ulama yang ditandatangani oleh Anies-Muhaimin.  - Dukungan ini datang dari berbagai… https://t.co/RAlrlol1SL,0,3,9,28,in,34075325,1736735988783935852,ismailfahmi,https://twitter.com/ismailfahmi/status/1736738835072221413,https://pbs.twimg.com/media/GBoilWBbAAAQg8G.jpg,"Jakarta Selatan, DKI Jakarta"
2023-12-18 20:24:32+07:00,1736739224689476047,Calon Presiden nomor urut 1 Anies baswedan menghadiri peringatan maulid nabi yang juga haul ketiga Habib Muhammad di Simpang Ulim  Aceh Timur.  Sementara calon wakil presiden nomor urut 1 Muhaimin iskandar tengah menunaikan ibadah umroh.  Pada acara haul tersebut  Anies Baswedan… https://t.co/U2KJMfGCB6,0,4,6,45,in,55507370,1736739224689476047,tvOneNews,https://twitter.com/tvOneNews/status/1736739224689476047,https://pbs.twimg.com/ext_tw_video_thumb/1736739040546959360/pu/img/66B2QEF0BrrZ_bml.jpg,"Pulo Gadung, Indonesia"
