created_at,id_str,full_text,quote_count,reply_count,retweet_count,favorite_count,lang,user_id_str,conversation_id_str,username,tweet_url,image_url,location,keyword
2023-12-25 00:09:20+07:00,1738970121782358265,@detikcom Fokus pada menangkan GAMA jadi pemimpin berikutnya biar rakyat Indonesia sejahtera,0,0,0,0,in,1729994818322132992,1736959541773050022,EdiRekareka,https://twitter.com/EdiRekareka/status/1738970121782358265,,,Wapres
2023-12-25 03:09:44+07:00,1739015522648207820,Ya ce  baƙuwa kika yi haka ne?  Eh wallahi  ƙawata ce tun ta ƙuruciya kuma ita ce babbar Aminiyata kuma Amintacciya......... Tana da kirki sosai!  Allah sarki! Dama fita zan yi  in ta gama tazo mu tafi na rage mata hanya.  A'a babu komai yi tafiyarka  ba yanzu zata tafi ba..!…,8,12,20,74,in,1039267748,1739015522648207820,el_uthmaan,https://twitter.com/el_uthmaan/status/1739015522648207820,,"Abuja, Nigeria",Wapres
2023-12-25 06:18:29+07:00,1739063023032254639,@mochamadarip Rakyat yg akan menyaksikan bisakah mereka gerombolan Koruptor  Partai-2 yg ketumnya terjerat hukum/TO KPK  yg didukung para Jenderal yg ikut mengadili Pelanggar Ham berat dan Aktivis 98 yg berkhianat  apa bisa tumbangkan PDI-P  yg pasti rakyat pilih GAMA apapun partainya.,0,3,0,4,in,1078554222252023808,1738852086060908896,CakMugik,https://twitter.com/CakMugik/status/1739063023032254639,,"Kota Surabaya, Jawa Timur ",Wapres
2023-12-25 07:22:37+07:00,1739079162198200477,halo aku mau giveaway saldo 20.000 buat satu orang🌟  syaratnya rt like tweet ini sama tweet di bawah ini nanti rep apaa aja kalo udah  thank you  end tba.  t. #zonauang,0,313,361,326,in,1691375991678230529,1739079162198200477,mahaeterus,https://twitter.com/mahaeterus/status/1739079162198200477,,RPS MARKHYUCK ,Wapres
2023-12-25 07:53:42+07:00,1739086982729621600,Merry Xmas buat kita sekalian dmn pun berada...  Salam damai dan salam toleransi buat kita sesama pendukung GAMA...  🌲🌲🌲📯📯📯🌤 https://t.co/PQXIY8U3xX,2,16,9,46,in,1603661462190247936,1739086982729621600,Nagashima_007,https://twitter.com/Nagashima_007/status/1739086982729621600,https://pbs.twimg.com/ext_tw_video_thumb/1739086969991520256/pu/img/NoiCmonjakN3uHUH.jpg,Wiraswasta/Citraland Gama City,Wapres
2023-12-25 07:58:45+07:00,1739088256967581869,@PDI_Perjuangan Kereeen wapres ku 😎 GAMA menang 1 putaran 🇮🇩🤟🤟🤟🇮🇩 https://t.co/28MfXoJwqH,0,1,3,13,in,1452508101505028098,1738939200106635642,EviDrajat,https://twitter.com/EviDrajat/status/1739088256967581869,https://pbs.twimg.com/ext_tw_video_thumb/1739088219025854464/pu/img/FQqaJVsU-_bE5CDt.jpg,,Wapres
2023-12-25 09:14:24+07:00,1739107295370649888,Ini kota Solo boss🥰  Ras terkuat dimuka bumi emak² kompak dukung GANJAR🤟MAHFUD https://t.co/NQ9BpxbhDr,6,47,162,490,in,1572608169100316672,1739107295370649888,PUTRY_NUSANTARA,https://twitter.com/PUTRY_NUSANTARA/status/1739107295370649888,https://pbs.twimg.com/ext_tw_video_thumb/1739107257810595840/pu/img/VNQzhljO4VHidR4Z.jpg,,Akronim
2023-12-25 09:33:34+07:00,1739112116215337117,@hansssolo Gaspoll dukung selalu Pak Ganjar Mahfud 🤟,0,0,0,0,in,1726631515407503360,1738720747210842150,22Erikkaa,https://twitter.com/22Erikkaa/status/1739112116215337117,,,Akronim
2023-12-25 09:35:49+07:00,1739112681624489992,GASPOL NGAB...! GANJAR MAHFUD D'BEST 🤟  Di tengah kesibukan kampanye  Ganjar Pranowo tetap menyempatkan waktu untuk berolahraga dan berinteraksi hangat dengan warga Solo di Car Free Day.  @ganjarpranowo  #SahabatGanjar   #GanjarMahfud2024 https://t.co/3N6EtdqG79,0,0,11,19,in,4200088157,1739112681624489992,KutaReal_X,https://twitter.com/KutaReal_X/status/1739112681624489992,https://pbs.twimg.com/ext_tw_video_thumb/1739112564334981120/pu/img/aJJUDnl9ecaSr3GY.jpg,Jakarta Capital Region,Akronim
2023-12-25 10:06:02+07:00,1739120289521467799,@yusuf_dumdum Ganjar Mahfud itu sama sama kita. Mereka rakyat kecil yg bekerja keras dari bawah. Sekaelrang Gerah dqn muak lihat orang kaya dan pejabat petentengan pongah di Indonesia. Kesempatan dikangkangi semua sama mereka. Tidak ada pemerataan. Kemaruk...  Hanya ada satu kata  lawan.. https://t.co/P0GI3DTVu6,0,1,1,3,in,327912017,1738874364127555688,aharisth,https://twitter.com/aharisth/status/1739120289521467799,https://pbs.twimg.com/ext_tw_video_thumb/1739119982964027392/pu/img/8ppAfH63KleEVV-B.jpg,,Akronim
2023-12-25 10:13:04+07:00,1739122058188263511,@Fahrihamzah Ganjar Mahfud itu sama spt kita. Mereka rakyat kecil yg bekerja keras dari bawah. Sekarang Gerah dan muak lihat orang kaya dan pejabat petentengan pongah di Indonesia. Kesempatan dikangkangi semua sama mereka. Tidak ada pemerataan. Kemaruk...  Hanya ada satu kata  lawan.. https://t.co/d6iqJOTLGQ,0,3,4,24,in,327912017,1739107371723673793,aharisth,https://twitter.com/aharisth/status/1739122058188263511,https://pbs.twimg.com/ext_tw_video_thumb/1739121696186220544/pu/img/VrXz_uEfcizg-W_W.jpg,,Akronim
2023-12-25 10:16:35+07:00,1739122943517679873,GAMA m3nang https://t.co/Bnb3t3qViJ,0,0,0,0,in,1726816188368617472,1739122943517679873,GuardiaSta43617,https://twitter.com/GuardiaSta43617/status/1739122943517679873,https://pbs.twimg.com/ext_tw_video_thumb/1739122887708336128/pu/img/1LVevqAUJ2T0ZDuE.jpg,,Wapres
2023-12-25 10:19:57+07:00,1739123791660556327,Semua Gama Indonesia Emas https://t.co/Z4ffAsaFHb,0,0,0,0,in,1685566159356342273,1739123791660556327,BordingSag48268,https://twitter.com/BordingSag48268/status/1739123791660556327,https://pbs.twimg.com/media/GCKb3y-aYAAVa6I.jpg,,Wapres
2023-12-25 10:36:15+07:00,1739127891190063272,Samsul juara cuma dimata buzzer nya doang  dimata rakyat Pak Mahfud tetap idola 😍 https://t.co/R0LKV8IdWb,2,10,34,155,in,1274590242645798913,1739127891190063272,Trending_Issue,https://twitter.com/Trending_Issue/status/1739127891190063272,https://pbs.twimg.com/media/GCKfmGzakAAtV1d.jpg,Jakarta,Akronim
2023-12-25 10:45:35+07:00,1739130238637092875,@Bambangmulyonoo Satu server kita Pak 🤟🏼🇮🇩✊🏼 Jasa Pak Jokowi dalam membangun NTT akan selalu kami ingat 😇 ..dan saya yakin Ganjar-Mahfud adalah pasangan yang paling tepat untuk melanjutkan pemerataan pembangunan dari Sabang sampai Merauke.. Kiranya TUHAN memberkati 🙏😇🙏,0,2,0,3,in,1366633217495683073,1739034992720986222,MarcoAn14650456,https://twitter.com/MarcoAn14650456/status/1739130238637092875,,,Akronim
2023-12-25 10:52:09+07:00,1739131894456107184,Mahfud Batal Kampanye di NTB  Disarankan Dokter Beristirahat Beberapa Hari https://t.co/U0hn5qSesN,16,45,16,130,in,71436318,1739131894456107184,KompasTV,https://twitter.com/KompasTV/status/1739131894456107184,,Indonesia,Akronim
2023-12-25 11:08:57+07:00,1739136123048443945,21 Program unggulan GAMA untuk Indonesia💪  || Home Alone Fuji Mo Salah Jogja Chelsea Morninggg WA Aja Samsul Lembang Berkah Dalem Morowali besok senin Minat DM SGIE Selamat Natal Christmas || https://t.co/yltaSb72zq,0,0,7,8,in,1598891921103261697,1739136123048443945,AsmianiM44,https://twitter.com/AsmianiM44/status/1739136123048443945,https://pbs.twimg.com/ext_tw_video_thumb/1739135562555224064/pu/img/G64cFN-9j3a6XjIt.jpg,,Wapres
2023-12-25 11:09:27+07:00,1739136245845102640,https://t.co/pq1GOD7P4b  Katanya disuruh Presiden  cari dimana kebocoran bea dan pajak.   Giliran dibuka Rp 349 Trilyun. JKW bungkam.   Case closed..??,0,0,1,1,in,1542540315835260929,1739136245845102640,hamas191,https://twitter.com/hamas191/status/1739136245845102640,,,Akronim
2023-12-25 11:09:56+07:00,1739136369237332122,@detikcom Lawan pak Mahfud kami mendukung mu,0,0,0,0,in,1704373738131910657,1738732472622559443,Aziz020420,https://twitter.com/Aziz020420/status/1739136369237332122,,,Akronim
2023-12-25 11:20:05+07:00,1739138924201844913,Penampilan Cawapres no. urut 3  Mahfud MD di debat Pilpres 2024 menuai apresiasi &amp; tren positif. Dia dinilai tampil memukau &amp; meyakinkan saat debat perdana cawapres yg digelar Jumat  22 Des 2023. disampaikan o/ Pengamat UIN Syarif Hidayatullah  Adi Prayitno.   #SahabatGanjar https://t.co/db3N7hVqO3,0,0,7,8,in,1135452266142429184,1739138924201844913,sjahtie,https://twitter.com/sjahtie/status/1739138924201844913,https://pbs.twimg.com/media/GCKpooTbwAA9pfC.jpg,"Banyuwangi, Jatim, Indonesia",Akronim
2023-12-25 11:21:27+07:00,1739139265848852771,Mahfud Batal Kampanye di NTB  Disarankan Dokter Beristirahat Beberapa Hari  GWS pak Mapud 😇   https://t.co/TRcGVCqKXa,2,4,29,93,in,1132425764622675969,1739139265848852771,BangPino__,https://twitter.com/BangPino__/status/1739139265848852771,,"London, England",Akronim
2023-12-25 11:26:07+07:00,1739140442380480721,Mahfud MD Kelelahan  Batal Menghadiri Sejumlah Kegiatan di NTB #MahfudMD https://t.co/oySLa1oPck,0,146,62,127,in,79130206,1739140442380480721,jpnncom,https://twitter.com/jpnncom/status/1739140442380480721,,Indonesia,Akronim
2023-12-25 11:29:48+07:00,1739141366876409865,Debat Cawapres: Mahfud MD Paling Matang Dan Beretika  Oleh : Ario Subagyo   Di antara ketiga kandidat dalam debat cawapres semalam  hanya @mohmahfudmd yang sejauh ini terlihat paling matang. Baik soal pemahaman bagaimana memberikan solusi atas masalah  maupun sikapnya yang tenang… https://t.co/n4gplV0rT3,5,1283,719,1041,in,48359478,1739141366876409865,Melihat_Indo,https://twitter.com/Melihat_Indo/status/1739141366876409865,https://pbs.twimg.com/media/GCKr2oBagAAYxW8.jpg,Indonesia,Akronim
2023-12-25 11:32:45+07:00,1739142108441972969,@islah_bahrawi Rakyat tdk akan pernah percaya anak karbitan. GaMa selalu di hati,0,0,0,0,in,1589082630045061120,1739056163461947406,AgricolaFilius,https://twitter.com/AgricolaFilius/status/1739142108441972969,,,Wapres
2023-12-25 11:33:54+07:00,1739142397962101153,Selamat merayakan Hari Natal 2023 utk kaum Kristiani. Titik temu (kalimatun sawa') semua agama adalah persaudaraan atas dasar kemanusiaan. Maka jika ada orang yg memusuhi orang lain krn perbedaan anutan agama sdh pasti orang itu salah dalam beragama  apa pun agama yg dianutnya.🙏,54,987,1400,6196,in,282006208,1739142397962101153,mohmahfudmd,https://twitter.com/mohmahfudmd/status/1739142397962101153,,Jakarta,Akronim
2023-12-25 11:38:27+07:00,1739143545225986059,@TeddGus Prof Mahfud diakui paling menguasai dlm debat cawapres https://t.co/BNQCYmJJ9u,0,0,2,6,in,969099873856335877,1738891302652243971,ParapatYohanes,https://twitter.com/ParapatYohanes/status/1739143545225986059,https://pbs.twimg.com/media/GCKt1mIa4AAayhl.jpg,,Akronim
2023-12-25 11:38:48+07:00,1739143632534516157,SINGKATAN BHS INGGRIS  ko dibaca bhs indonesia Singkatan ga umum rakyat banyak ga tahu ga guna ditanyakan Yg penting ditanyakan esensinya  Bukan singkatannya  Ini bukan cerdas cermat  @gibran_tweet  Pertanyaan 75 % ES GE i E negatip Jd samsul dibully https://t.co/yAhplSFeKz,0,6,8,14,in,1637841258231271424,1739143632534516157,Ganjar_Mahfud03,https://twitter.com/Ganjar_Mahfud03/status/1739143632534516157,,Indonesia,Akronim
2023-12-25 11:44:26+07:00,1739145051043979314,"Menko Polhukam Mahfud MD menyambangi Gereja Katedral  Jakarta Pusat  Minggu (24/12/2023). Gereja Katedral malam ini menggelar misa malam Natal.  Mahfud menitipkan pesan perdamaian. Dia berharap kehidupan antar-umat beragama di Indonesia semakin baik.  Tentu saja kita berharap… https://t.co/Adh1C710sT""",7,9,83,437,in,214159664,1739145051043979314,Paltiwest,https://twitter.com/Paltiwest/status/1739145051043979314,https://pbs.twimg.com/ext_tw_video_thumb/1739144810085388288/pu/img/pQsfh8smKEw1AFza.jpg,"Medan dan Jakarta, Indonesia",Akronim
2023-12-25 11:45:23+07:00,1739145291859997169,Mahfud MD menjadi calon wakil presiden yang paling jelas dan memuaskan saat debat  .  tag || Home Alone Jogja Lembang Fuji Bandung WA Aja Christmas Berkah Dalem JYPE Kingdom Samsul Motaz besok senin SGIE Sarapan || https://t.co/vorHoMTCnB,0,1,7,52,in,1630837652504313856,1739145291859997169,DessitaChairun1,https://twitter.com/DessitaChairun1/status/1739145291859997169,https://pbs.twimg.com/ext_tw_video_thumb/1739143682320936960/pu/img/CrqhG1vu9RYDORLf.jpg,tangerang,Akronim
2023-12-25 12:11:31+07:00,1739151865265451512,Halangan dan Rintangan dlm menggapai Tujuan akan makin mengasah kemampuan menjadi pemimpin yg hebat  Pemimpin yg hebat tdk lahir dari kemudahan 2 fasilitas dan Tdk mengunakan menghalalkan segala cara  Ganjar Mahfud pemimpin hebat yg lahir dari integritas dan rekam jejak yg baik https://t.co/NOlmw60F7t,2,7,88,410,in,1144772185229160449,1739151865265451512,eddy_widodo_165,https://twitter.com/eddy_widodo_165/status/1739151865265451512,https://pbs.twimg.com/ext_tw_video_thumb/1739150874772205568/pu/img/Y6c91sT_bis2PNOc.jpg,"Bogor, Jawa Barat",Akronim
2023-12-25 12:13:12+07:00,1739152288005210488,Mahfud MD Respons Penampilan Gibran di Debat: Kalau Cuma Istilah Sulit  Saya Bisa Cari Seribu Sehari https://t.co/SzhC632DdA,254,458,426,2331,in,71436318,1739152288005210488,KompasTV,https://twitter.com/KompasTV/status/1739152288005210488,,Indonesia,Akronim
2023-12-25 12:13:58+07:00,1739152484374077809,@tempodotco Demi Indonesia yang lebih maju dukung penuh GAMA,0,0,0,0,in,1724361191441735680,1738855562962714639,Ayusinta0,https://twitter.com/Ayusinta0/status/1739152484374077809,,,Wapres
2023-12-25 12:25:41+07:00,1739155431401173078,@tvOneNews Warga bandung siap mengawal kem3nangan GAMA menjadi RI 1 dan RI 2 #LanjutGANsemuakerja,0,0,0,0,in,895928358789193728,1738976474739388683,AnggunPutryChr_,https://twitter.com/AnggunPutryChr_/status/1739155431401173078,,,Wapres
2023-12-25 12:32:28+07:00,1739157137434272236,Penampilan Cawapres no 3  Mahfud MDdi debat Pilpres 2024 menuai apresiasi dan tren positif. Mahfud dinilai tampil memukau dan meyakinkan saat debat perdana cawapres yg digelar pada Jumat  22 Desember 2023. #SahabatGanjar #GanjarPresiden  #GanjarMahfud2024 #SatSet #PastiLebihBaik https://t.co/gXgkNXAugW,0,0,4,14,in,1404063206142734337,1739157137434272236,Murahs3nyum,https://twitter.com/Murahs3nyum/status/1739157137434272236,https://pbs.twimg.com/ext_tw_video_thumb/1739157040587792384/pu/img/lbjvVfm8jV33yhuU.jpg,Indonesia,Akronim
2023-12-25 12:33:23+07:00,1739157368221671913,SELAMAT NATAL 2023  U yg merayakan dan  SELAMAT TAHUN BARU 2024 u smua rakyat Indonesia  INDONESIA UNGGUL &amp; CEPAT  BERSAMA GAMA #GanjarMahfudSatset #GanjarMahfud2024 @ganjarpranowo @mohmahfudmd https://t.co/pMdyG9vYZY https://t.co/7p3TuzUGTN,2,0,16,25,in,1637841258231271424,1739157368221671913,Ganjar_Mahfud03,https://twitter.com/Ganjar_Mahfud03/status/1739157368221671913,https://pbs.twimg.com/ext_tw_video_thumb/1739157351142465536/pu/img/kZBx4qRtwZcsM7L4.jpg,Indonesia,Wapres
2023-12-25 12:33:39+07:00,1739157437192765567,@tvOneNews GAMA sudah pasti menang 🔥🔥🔥 #GanjarSikatKorupsi,0,0,0,0,in,1725409103248502784,1738965655020556570,devyandin,https://twitter.com/devyandin/status/1739157437192765567,,Indonesia ,Wapres
2023-12-25 12:45:39+07:00,1739160457846620666,"Ketua Tim Pemenangan Nasional (TPN) Ganjar-Mahfud  Arsjad Rasjid  mengatakan pasangan calon nomor urut 3 Ganjar Pranowo-Mahfud MD. selalu mengunjungi desa saat kampanye karena tak melupakan asalnya sebagai anak desa. Alhamdulillah  mereka dapat pendidikan  masuk jadi anggota DPR… https://t.co/mD36w9uKva""",0,0,11,59,in,153407983,1739160457846620666,PDI_Perjuangan,https://twitter.com/PDI_Perjuangan/status/1739160457846620666,https://pbs.twimg.com/media/GCK9FB7bUAAS604.jpg,Indonesia,Akronim
2023-12-25 12:54:17+07:00,1739162628810064036,@hansssolo Dukung selalu pak Ganjar Mahfud 🤟,0,0,0,1,in,1700587022514286592,1738720747210842150,Joniii55_,https://twitter.com/Joniii55_/status/1739162628810064036,,,Akronim
2023-12-25 12:54:59+07:00,1739162803322359970,AMIN itu ibarat android (Terbuka) (Reformasi)  PRAGIB Itu ibarat iphone (tertutup) (Orba)  GAMA Itu Ibarat Symbian (Jadul) (Orla),3,11,36,217,in,1270980383761330176,1739162803322359970,Tan_Mar3M,https://twitter.com/Tan_Mar3M/status/1739162803322359970,,,Wapres
2023-12-25 13:02:23+07:00,1739164668613349873,Menko Polhukam Mahfud MD senang Umat Kristiani bisa ibadah dengan aman  Selamat Natal #SelamatNatal https://t.co/U6PZqpkr2J,4,5,70,305,in,1159475566069731331,1739164668613349873,BiLLRaY2019,https://twitter.com/BiLLRaY2019/status/1739164668613349873,https://pbs.twimg.com/ext_tw_video_thumb/1739164225996718080/pu/img/wjUA30YGikXRPU4K.jpg,,Akronim
2023-12-25 13:05:22+07:00,1739165418659709044,Hadiri Haul Pendiri Ponpes Al Islah Gresik  Ini Pesan @mohmahfudmd MD ke Para Santri  Menteri Koordinator Bidang Politik Hukum dan Keamanan (Menkopolhukam) Mahfud MD memberikan semangat kepada para santri dalam menuntut ilmu. Sehingga memberikan manfaat kepada masyarakat.   “Jika… https://t.co/a87kiHSVIF,4,99,81,308,in,435004096,1739165418659709044,Aryprasetyo85,https://twitter.com/Aryprasetyo85/status/1739165418659709044,https://pbs.twimg.com/ext_tw_video_thumb/1739163765663514624/pu/img/H-zxSYlvQ5qJBdhZ.jpg,"Central Java, Indonesia",Akronim
2023-12-25 13:13:45+07:00,1739167529883574749,"Ketika seorang yang dijuluki Peluru Tak Terkendali"" bicara tentang bagaimana toleransi.. Indonesia didirikan Bersama sama Mayoritas dan Minoritas  saling melindungi  ""Saya akan Back up"" kata Mahfud MD  Punya Wakil Presiden yang begini adalah impian kita bersama selama ini https://t.co/wOqyLJN71T""",22,130,284,1151,in,55200751,1739167529883574749,WagimanDeep212_,https://twitter.com/WagimanDeep212_/status/1739167529883574749,https://pbs.twimg.com/ext_tw_video_thumb/1739167404108992512/pu/img/zr4i81mV5OJI4A1_.jpg,,Akronim
2023-12-25 13:16:36+07:00,1739168243410227446,Bansos akan bermasalah jika Ganjar-Mahfud jadi Presiden dan Wakil Presiden? Tentu tidak...  Ganjar-Mahfud akan tetap melanjutkan dengan cara lebih mempermudah penyalurannya  cukup dengan KTP Sakti  semua bantuan pemerintah bisa di akses. #GanjarMahfud2024 https://t.co/hyLzD2WXWw,1,1,38,79,in,1276794185425670144,1739168243410227446,AnakLolina2,https://twitter.com/AnakLolina2/status/1739168243410227446,https://pbs.twimg.com/ext_tw_video_thumb/1739168216558305280/pu/img/CsiDdozI7irlo4iN.jpg,,Akronim
2023-12-25 13:22:12+07:00,1739169655603052626,Ganjar Mahfud  2.500 T untuk semua harapan rakyat  dari pendidikan  kesehatan  rumah layak  hingga kesejahteraan. Bandingkan dgn 02  2000 T hny untuk makan siang gratis.😝  Internet Gratis Ganjar dan KTPSakti Trending  Netizen: Ganjar Mahfud Solusi Rakyat. https://t.co/nq9exdmJBL,4,27,74,240,in,154435354,1739169655603052626,ch_chotimah2,https://twitter.com/ch_chotimah2/status/1739169655603052626,,"Kalimantan Timur, Indonesia",Akronim
2023-12-25 13:23:14+07:00,1739169912579608715,Ganjar Pranowo dan Mahfud MD mengucapkan Selamat Hari Natal bagi yang merayakannya  dan Selamat Tahun Baru 2024 untuk seluruh rakyat Indonesia. . #Natal2023 #TahunBaru2024 #GanjarMahfud #GanjarPranowo #GerakCepat #MahfudMD #IndonesiaUnggul #IndonesiaLebihBaik https://t.co/k8myKd7J3C,0,100,87,93,in,132078023,1739169912579608715,officialinews_,https://twitter.com/officialinews_/status/1739169912579608715,https://pbs.twimg.com/ext_tw_video_thumb/1739169814718119936/pu/img/OrghPbFOzctHW9pD.jpg,iNews Tower,Akronim
2023-12-25 13:46:34+07:00,1739175786379366901,Tuntaskan Kasus Pencucian Uang Jika Menang Pilpres  Cak Imin Sebut Mahfud Md Cocok Jadi Menkopolhukam Lagi https://t.co/DYbFqhx1GM #TempoNasional,11,264,201,1223,in,18129942,1739175786379366901,tempodotco,https://twitter.com/tempodotco/status/1739175786379366901,,Indonesia,Akronim
2023-12-25 13:51:16+07:00,1739176971131933065,Pasangan calon presiden dan calon wakil presiden (capres-cawapres) Ganjar Pranowo-Mahfud MD menjamin kebebasan sipil.  Pasangan capres-cawapres itu memastikan akan menghadirkan sistem demokrasi yang efektif dalam menjalankan pemerintahan lima tahun ke depan.  #GanjarMahfud2024… https://t.co/tDzeFw6erR,4,101,124,320,in,2650421658,1739176971131933065,NgkongRoses,https://twitter.com/NgkongRoses/status/1739176971131933065,https://pbs.twimg.com/ext_tw_video_thumb/1739176871588450304/pu/img/n830ZrAy8e7WMcm0.jpg,Di Hatimu! ,Akronim
2023-12-25 13:51:42+07:00,1739177079164604911,Oalaaaaaa yg kuat semakin kuat.....kshan yg lemah dong !  Pilihlah pemimpin yg pro rakyat....jgn sampai kita menyesal !!! Hanya capres dan cawapres kita yg sll pro rakyat        ---URAAAAAA---     GAMA 🇮🇩🤟🤟🤟🇮🇩 https://t.co/NpVrPHHBQg,2,13,17,52,in,1452508101505028098,1739177079164604911,EviDrajat,https://twitter.com/EviDrajat/status/1739177079164604911,https://pbs.twimg.com/ext_tw_video_thumb/1739177057576517632/pu/img/QMDf-xKGurLVFxvs.jpg,,Wapres
2023-12-25 13:53:18+07:00,1739177480332931432,Calon Presiden 2024 nomer urut 3 Ganjar Pranowo akan menerapkan program optimalisasi yang sudah di laksanakan pada Badan Amil Zakat Nasional Jawa Tengah ke Tingkat Nasional jika menangi Pilpres 2024 bersama Cawapres Mahfud MD  #SahabatGanjar #GanjarMahfud2024  #SatSetLebihBaik https://t.co/Et0l3oTzBL,0,0,5,10,in,251408624,1739177480332931432,Annas_Cim,https://twitter.com/Annas_Cim/status/1739177480332931432,https://pbs.twimg.com/ext_tw_video_thumb/1739177454965825536/pu/img/rsodvMsKvxiVOapA.jpg,Jakarta indonesia,Akronim
2023-12-25 13:54:52+07:00,1739177874807271672,@ganjarpranowo menginap di rumah alumni SMK Jateng  bernama Bagus yang sudah bisa menyejahterakan keluarganya. Satu fenomena dari lulusan SMK Jateng itu adalah bukti dimana Ganjar ingin mengembangkan inovasinya untuk melebarkan gagasannya di bidang pendidikan  lewat program 1… https://t.co/GG7cmShLZo,0,0,2,5,in,1226725839099707392,1739177874807271672,aan_muba,https://twitter.com/aan_muba/status/1739177874807271672,https://pbs.twimg.com/ext_tw_video_thumb/1739177785615323136/pu/img/6QGRLfh-ADEMQHCe.jpg,,Pres
2023-12-25 13:59:20+07:00,1739178998238998547,@antaranews Ayo ke Jawa barat pak  kami juga dukung GAMA m3nang #GanjarSikatKorupsi,0,0,0,0,in,1555719252057161729,1738981509426708927,imchildbabe,https://twitter.com/imchildbabe/status/1739178998238998547,,"Frânceşti, România",Wapres
2023-12-25 13:59:54+07:00,1739179143735198016,@antaranews 1. Datang ke TPS 2. Ambil surat suara 3. Coblos Surat suara 🔥 GAMA CAYOO,0,0,0,0,in,1732329900479062016,1738919747826352273,classybdss,https://twitter.com/classybdss/status/1739179143735198016,,,Wapres
2023-12-25 14:01:00+07:00,1739179419292569973,Hasil Survei CPCS : Elektabilitas Prabowo Gibran lewati 50% . Prabowo Gibran menempati urutan teratas  unggul jauh dari pasangan AMIN dan GAMA Gibran Oke Banget #GibranOkBingitz https://t.co/TIvLh4iUXc,0,5,42,30,in,1477831612284895233,1739179419292569973,nur_albi90,https://twitter.com/nur_albi90/status/1739179419292569973,https://pbs.twimg.com/media/GCLOduiasAAvVgl.jpg,,Wapres
2023-12-25 14:01:05+07:00,1739179438250823736,@antaranews Ayoo tetap dukung pak @ganjarpranowo  Mahfud untuk m3nang  GAMA layak m3nang #LanjutGANsemuakerja,0,0,0,0,in,1688977869710786560,1738919747826352273,AiraGreselya,https://twitter.com/AiraGreselya/status/1739179438250823736,,,Wapres
2023-12-25 14:01:20+07:00,1739179501182161081,@antaranews GAMA the best untuk Indonesia maju #GanjarPalingTegas,0,0,0,0,in,1723926023295963136,1738912944493379912,Khaylila18698,https://twitter.com/Khaylila18698/status/1739179501182161081,,,Wapres
2023-12-25 14:03:34+07:00,1739180066695983255,TGB Zainul Majdi ceritakan jasa Mahfud untuk petani tembakau di NTB  https://t.co/kQte6Uuoqo,0,89,35,84,in,18071520,1739180066695983255,antaranews,https://twitter.com/antaranews/status/1739180066695983255,,NKRI,Akronim
2023-12-25 14:05:44+07:00,1739180608642040198,Yaa Allahh .. semoga jadi Presiden dan Wakil Presiden Ganjar Mahfud biar gak ada lagi masalah sentimen beragama di negeri ini. Dengan masalah sentimen beragama bisa diselesaikan  maka pembangunan di negeri ini akan lebih lancar  melejit maju ke depan!   https://t.co/tKwWO0gHDF,6,26,214,744,in,1128649413633560577,1739180608642040198,HusinShihab,https://twitter.com/HusinShihab/status/1739180608642040198,https://pbs.twimg.com/ext_tw_video_thumb/1739141459675430913/pu/img/zRCf1bc6jbNkvVX5.jpg,"Jakarta Selatan, DKI Jakarta",Akronim
2023-12-25 14:07:55+07:00,1739181161199640930,@antaranews Indonesia membutuhkan pemimpin yang hebat dan cerdas seperti GAMA,0,0,0,0,in,1723926023295963136,1738889031176671639,Khaylila18698,https://twitter.com/Khaylila18698/status/1739181161199640930,,,Wapres
2023-12-25 14:09:13+07:00,1739181486711153118,@tempodotco Semoga Pak Mahfud dan pak Ganjar tetap sehat. Pokoknya soal rekam jejak  GAMA tak tertandingi.,0,0,0,0,in,1723518285709496320,1738970687715627112,naolazie,https://twitter.com/naolazie/status/1739181486711153118,,,Wapres
2023-12-25 14:09:23+07:00,1739181528821936275,@kumparan Semoga Pak Mahfud dan pak Ganjar tetap sehat. Pokoknya soal rekam jejak  GAMA tak tertandingi.,0,0,0,0,in,1723518285709496320,1738956720880398336,naolazie,https://twitter.com/naolazie/status/1739181528821936275,,,Wapres
2023-12-25 14:19:22+07:00,1739184041314996259,@zy_zy_its_me @gibran_tweet Bapak nya samsul kalo ga ada ganjar n pdip  cuma tukang asong mebel ... mkmkmkmk https://t.co/74xE3vmT5i,2,6,6,32,in,43824765,1739144552567738857,plethog,https://twitter.com/plethog/status/1739184041314996259,https://pbs.twimg.com/ext_tw_video_thumb/1739183450840793088/pu/img/lrvMbm0dwK4kyYCO.jpg,Jakarta,Pres
2023-12-25 14:22:07+07:00,1739184731265384604,Gas itu dibawah...gk usah ngegas dimedsos. Kayaknya banyak pendukungnya dimesdsos  nyatanya satu admin bs pegang puluhan akun.  Beda dengan Ganjar-Mahfud  Dukungan akar rumput trs mengalir.  #GasssGanjarMahfud  #GanjarMahfudM3nang https://t.co/Svx0hWdZxf,0,36,16,32,in,1354072148030091264,1739184731265384604,CahAngo45022699,https://twitter.com/CahAngo45022699/status/1739184731265384604,https://pbs.twimg.com/ext_tw_video_thumb/1739182517083947008/pu/img/zoDSVOYTHOMt0L0R.jpg,,Pres
2023-12-25 14:23:08+07:00,1739184988162322879,Ini Solo  yg wali kotanya ikut kontestasi pilpres  walau baru 2 tahun jadi walkot.   Solo bukan Gibran  Solo buat Ganjar. Gaspolll 🤟 https://t.co/k6Vx5ii4f5,4,64,142,705,in,84221579,1739184988162322879,narkosun,https://twitter.com/narkosun/status/1739184988162322879,https://pbs.twimg.com/media/GCLS8VzbYAAuLUT.jpg,Indonesia,Pres
