created_at,id_str,full_text,quote_count,reply_count,retweet_count,favorite_count,lang,user_id_str,conversation_id_str,username,tweet_url,image_url,location
2023-12-29 19:34:50+07:00,1740712981040902469,Ganjar Pranowo sowan ke Surakarta  Jumat (29/12/2023)  dan sholat berjamaah dengan Habib Syech di Masjid Pasar Kliwon.   Pertemuan dua sahabat  Ganjar dan Habib ini sangat hangat akan rasa kekeluargaan .  #GanjarMahfud2024 https://t.co/7WXRynG9hR,0,0,14,19,in,2658648566,1740712981040902469,Bams_4th,https://twitter.com/Bams_4th/status/1740712981040902469,https://pbs.twimg.com/ext_tw_video_thumb/1740712900216668160/pu/img/PmEEaf9pe3ZtHRAi.jpg,404php not found
2023-12-29 19:35:25+07:00,1740713128793690150,Capres Ganjar Bingung Kenapa Hasil Survei Saya Turun Terus  Sambutan Masyarakat Ramai  tp. kita punya survei sendiri. Survei Litbang Kompas Ganjar-Mahfud MD posisi 3 suara 15 3 %. @Daglek88776074 @PakJenggot___ @cocolatetwo @zainalmusyaffak @JudoRoro https://t.co/Mc2lOiUP6j,0,4,3,6,in,1013331201396912128,1740713128793690150,cagubnyinyir2,https://twitter.com/cagubnyinyir2/status/1740713128793690150,,"Jakarta Capital Region, Indone"
2023-12-29 19:37:28+07:00,1740713643795517736,Ganjar Pranowo sowan ke Surakarta  Jumat (29/12/2023)  dan sholat berjamaah dengan Habib Syech di Masjid Pasar Kliwon.   Pertemuan Ganjar dan Habib ini memperlihatkan hubungan yang hangat akan rasa kekeluargaan dan erat akan pertemanan. Masyarakat sekitar pun turut memeriahkan… https://t.co/SRRmPRR2F8,0,2,15,34,in,1316243860280889345,1740713643795517736,elsaday__,https://twitter.com/elsaday__/status/1740713643795517736,https://pbs.twimg.com/ext_tw_video_thumb/1740713551541768192/pu/img/PhIZJhoaCQmECBcU.jpg,🇮🇩
2023-12-29 19:39:55+07:00,1740714260748243204,"Dalam pidatonya pada peluncuran Smk Gratis Lulus Langsung Kerja Untuk Keluarga Miskin"" di Wonogiri  Calon Presiden nomor urut tiga  Ganjar Pranowo  menyampaikan kisah sukses lulusan SMK Jateng yang kini hidup berkecukupan.   🇮🇩🇮🇩🇮🇩🤟🤟🤟  #SahabatGanjar https://t.co/c71ciRF7Mj""",0,0,2,3,in,564007612,1740714260748243204,Sentani_REBORN,https://twitter.com/Sentani_REBORN/status/1740714260748243204,https://pbs.twimg.com/media/GChCYvObYAAyHq_.jpg,"DKI Jakarta, Indonesia"
2023-12-29 19:46:37+07:00,1740715949513466363,Integritas  anti-korupsi  dan pelayanan yang mudah  murah  cepat  dan adil adalah prinsip yang harus dipegang teguh seorang pemimpin yang tulus.  Jangan Gentar ada Ganjar Jangan Takut ada Mahfud.  #GanjarMahfud2024  #GasssGanjarMahfud https://t.co/BH4bkVhJ9z,1,4,60,118,in,3270403033,1740715949513466363,kenhans03,https://twitter.com/kenhans03/status/1740715949513466363,https://pbs.twimg.com/ext_tw_video_thumb/1740715796249382912/pu/img/odA7SpAIaSBjYTIM.jpg,
2023-12-29 19:50:17+07:00,1740716869546545244,Yukkk... Ayukkkk... Dulur Kabeh.... Ajak konco2.... Pilih Nomor 03  Ganjar-Mahfud...  #GaspolGanjarMahfud 🤟🤟🤟🔥🔥🔥 https://t.co/jDki6Smzdz,7,12,114,356,in,2939656405,1740716869546545244,panjianom102,https://twitter.com/panjianom102/status/1740716869546545244,https://pbs.twimg.com/ext_tw_video_thumb/1740714717512151040/pu/img/9q6FVZTmcBo6Wg__.jpg,Ngayogjokarto...
2023-12-29 19:51:58+07:00,1740717293578146266,Kesetian @ganjarpranowo  sudah teruji  Ganjar ogah lompat ke partai lain karena menganggap partai layaknya seorang istri  yang butuh pertimbangan matang dan kehati-hatian sebelum melabuhkan hati. Beda dengan yang disebelah bukan ? https://t.co/Ib7eoRkA0W,9,31,207,859,in,1576577082909691904,1740717293578146266,devy_casanofa,https://twitter.com/devy_casanofa/status/1740717293578146266,https://pbs.twimg.com/ext_tw_video_thumb/1740717242374144000/pu/img/NBtg8mAsUuVMfoEW.jpg,"Bandung, Jawa Barat"
2023-12-29 19:52:04+07:00,1740717317796118552,"Resolusi Tahun Baru 2024   Selamat Tinggal Jokowi dan Selamat Datang Ganjar Pranowo""""",1,7,11,51,in,1420219650231574533,1740717317796118552,arifin34533,https://twitter.com/arifin34533/status/1740717317796118552,,Indonesia
2023-12-29 19:54:13+07:00,1740717860148990433,kompascom Ganjar Pranowo 🤟    #GanjarLebihBaik3 #GanjarMahfud2024 Hebat Mahfud Debat Petani Bangga bertani,0,0,0,0,in,1076518699232681984,1740717860148990433,Rahulve54484164,https://twitter.com/Rahulve54484164/status/1740717860148990433,,"Surakarta, Jawa Tengah"
2023-12-29 19:56:56+07:00,1740718545674330214,Pertemuan Mas Ganjar dengan  Habib Syekh cerminan hubungan yang hangat akan rasa kekeluargaan dan erat akan pertemanan.  #GanjarMahfud2024 https://t.co/i7ZtNwHgyo,1,5,76,245,in,1100305795,1740718545674330214,BakarSmith,https://twitter.com/BakarSmith/status/1740718545674330214,https://pbs.twimg.com/ext_tw_video_thumb/1740718155931287552/pu/img/SUjfkOeE-udAqHJO.jpg,pinggir kampung Indonesia
2023-12-29 19:58:13+07:00,1740718866060415000,Banyak yang sudah dilakukan Ganjar Pranowo selama 10 tahun pimpin Jawa Tengah. Selain sukses kurangi angka kemiskinan  ganjar sukses mengurangi angka pengangguran  sukses mendatangkan investor  sukses tumpas pungli dan korupsi  dan sukses membangun infrastruktur Jawa Tengah.… https://t.co/jlZPCs9s7S,2,9,24,93,in,1101696077147729920,1740718866060415000,03__nakula,https://twitter.com/03__nakula/status/1740718866060415000,https://pbs.twimg.com/ext_tw_video_thumb/1740718807335968768/pu/img/T3JtOK95yCwbgAaI.jpg,
2023-12-29 20:04:34+07:00,1740720464157368788,Capres Ganjar Saksikan Konser Ultah Ke-40 SLANK(360p). #GanjarUntukSemua #GanjarMahfud2024 #SLANK https://t.co/wVq9JxELgF https://t.co/xqwIq8DRbs,0,1,3,8,in,2495508415,1740720464157368788,Darmawan_bs,https://twitter.com/Darmawan_bs/status/1740720464157368788,https://pbs.twimg.com/ext_tw_video_thumb/1740719971255431168/pu/img/pgNs6dOVq--aHVeh.jpg,
2023-12-29 20:09:03+07:00,1740721592785944863,Ganjar Mahfud M3nang  SMK Gratis ada di seluruh Indonesia.  Sekolah Gratis Ganjar Lulus Langsung K3rja #GanjarMahfud2024 https://t.co/CqrCiJZLx2,0,0,25,38,in,1356517931887120384,1740721592785944863,Anak__Ogi,https://twitter.com/Anak__Ogi/status/1740721592785944863,https://pbs.twimg.com/media/GChJDmSacAANpf4.jpg,Indonesia
2023-12-29 20:09:25+07:00,1740721687044432137,@VIVAcoid Ini adalah isyarat   bahwa elektabilitas Anies Imin mengalahkan semua Prabowo Ganjar..,0,4,0,45,in,1707243631869140992,1740668371006623889,Mayormpl44807,https://twitter.com/Mayormpl44807/status/1740721687044432137,,
2023-12-29 20:10:01+07:00,1740721834516193644,https://t.co/z3ksAxPGpX  Ada apakaaahh ? Babeh @snjayajonggrang  @Mey_MeynieJT  @RonnyYulianto13  Abang @Horang_Utan  Mbah @super_bedjo20,2,2,3,8,in,1506127745507504133,1740721834516193644,neneng_kafir,https://twitter.com/neneng_kafir/status/1740721834516193644,,
2023-12-29 20:10:02+07:00,1740721840186871836,Ayo konco dulur dulur kabeh  Dari Sabang sampai Merauke  Mlaku bareng bareng pilih nomer TELU sing gawe ayem  Maju bersama rapatkan barisan    serempak menuju kemenangan  GANJAR MAHFUD Gaspol Gaspol  Indonesia Gaspol Gaspol  #GanjarMahfud2024 https://t.co/b3eoJVk24z,0,0,8,17,in,1303593561363894272,1740721840186871836,GustiMberkahi,https://twitter.com/GustiMberkahi/status/1740721840186871836,https://pbs.twimg.com/amplify_video_thumb/1740721772755136512/img/GRWhysG1bwitcv5C.jpg,Yogya 9/9/2020
2023-12-29 20:10:44+07:00,1740722015143964725,"Jd inget gibran vs butet + ongol2 ganjar... Jgn pernah bully"" kucing (gibran) kl gak pengen jd cengok.... 🤣🤣🤭🤭 https://t.co/1KAiN8qNsL""",0,1,6,9,in,1014162160740528129,1740722015143964725,EricRicaldo,https://twitter.com/EricRicaldo/status/1740722015143964725,https://pbs.twimg.com/ext_tw_video_thumb/1740721983300804608/pu/img/oRaiJWzgal139s54.jpg,Jakarta Selatan
2023-12-29 20:11:03+07:00,1740722097260032294,Direktur LSI Denny JA Adjie Alfaraby menyebut pasangan nomor 1 Anies Baswedan-Muhaimin Iskandar menempati posisi dua dengan 25 3% dan Ganjar Pranowo-Mahfud MD di posisi ketiga dengan 22 9%.  #Projo #Jokowi #Gibran #Prabowo #PrabowoGibran https://t.co/K5jCaqlt2c,2,20,18,53,in,872175115793858561,1740722097260032294,RcyberProj0,https://twitter.com/RcyberProj0/status/1740722097260032294,https://pbs.twimg.com/media/GChJhYnaIAAu51H.jpg,"Jakarta Capital Region, Indone"
2023-12-29 20:12:45+07:00,1740722524198162833,"Capres Aye Bapak @ganjarpranowo ajak influencer nasional bakar motivasi anak muda Wonogiri. Berlokasi kafe Omah Rayap Wonogiri  Jumat (29/12/2023)  berbagai wejangan dan motivasi diberikan Ganjar dalam acara sharing tersebut  Terpancar Wajah Kaum Muda Tercerahkan..👍🏻😎♥️🇲🇨🤟 https://t.co/ED0WVsIZud""",0,0,8,22,in,1140084771453714432,1740722524198162833,RizkiR4madani,https://twitter.com/RizkiR4madani/status/1740722524198162833,https://pbs.twimg.com/ext_tw_video_thumb/1740722450353291264/pu/img/PpG02kEEqPIjV5hN.jpg,"Depok, Jawa Barat"
2023-12-29 20:24:44+07:00,1740725537881108647,××× SMK Gratis inovatif dari Ganjar Pranowo membuka peluang kerja langsung bagi keluarga miskin  mengubah hidup lulusan SMKN di Jawa Tengah  #SahabatGanjar #GanjarMahfud2024 #GanjarPresiden #PastiLebihBaik https://t.co/ovTNnbiNKp,0,0,22,29,in,880019254027866113,1740725537881108647,007koteka,https://twitter.com/007koteka/status/1740725537881108647,https://pbs.twimg.com/ext_tw_video_thumb/1740725203804864512/pu/img/AVRUTxH-qotkg9EQ.jpg,
2023-12-29 20:26:00+07:00,1740725859336757649,Ganjar Pranowo Sowan ke Surakarta  Jumat (29/12/2023)  dan sholat Berjamaah dengan Habib Syech di Masjid Pasar Kliwon.   Pertemuan Ganjar dan Habib ini Memperlihatkan Hubungan yg Hangat akan Rasa Kekeluargaan dan Erat akan Pertemanan.  Masyarakat sekitar pun turut Memeriahkannya. https://t.co/2lSyT3KI6J,0,0,4,17,in,1322361095407902721,1740725859336757649,SETYAKI22965702,https://twitter.com/SETYAKI22965702/status/1740725859336757649,https://pbs.twimg.com/ext_tw_video_thumb/1740725780953591808/pu/img/Y_HbD4W0ZrVHpk35.jpg,SOLO -  INDONESIA
2023-12-29 20:30:35+07:00,1740727012900352429,WN. Ganjar dan Uya Kuya. https://t.co/5gUO13ZfFy,3,0,20,0,in,1511363915380584454,1740727012900352429,NanamiOfJoy,https://twitter.com/NanamiOfJoy/status/1740727012900352429,https://pbs.twimg.com/media/GChN_TCbYAAjtCx.jpg,ic: @nthndn
2023-12-29 20:32:21+07:00,1740727456766849387,Bareng Ganjar-Mahfud  sekolah dapat GRATIS  lulus langsung KERJA.  Cc. @ganjarpranowo @mohmahfudmd @ArsjadRasjid  #GanjarMahfud2024 https://t.co/cPWk6YWMyd,0,1,18,31,in,1174287141909590017,1740727456766849387,seruanhl,https://twitter.com/seruanhl/status/1740727456766849387,https://pbs.twimg.com/media/GChOZGwaAAAd4is.jpg,Indonesia
2023-12-29 20:34:29+07:00,1740727995252527201,Calon presiden nomor urut 3 Ganjar Pranowo yakin popularitas dan relasi Mahfud MD bakal membantu pemenangan di wilayah Jawa Timur pada Pilpres 2024. Ganjar mengakui pertarungan di wilayah Jatim tidak akan semudah seperti di Jawa Tengah yang merupakan kandang PDI Perjuangan.… https://t.co/oMu5PFWgd7,0,3,27,97,in,153407983,1740727995252527201,PDI_Perjuangan,https://twitter.com/PDI_Perjuangan/status/1740727995252527201,https://pbs.twimg.com/media/GChOzNsaIAAm1QK.jpg,Indonesia
2023-12-29 20:35:14+07:00,1740728182029049969,Istri capres nomor urut tiga Ganjar Pranowo  Siti Atikoh Supriyanti mengikuti senam pagi bersama warga Purwokerto di depan Sasana Krida Raga Satria  Jalan Prof Dr Suharso  Kabupaten Banyumas  Jumat (29/12).  #SahabatGanjar https://t.co/zPEjsjHhp6,0,3,16,29,in,940486643546386432,1740728182029049969,__RismaWidiono_,https://twitter.com/__RismaWidiono_/status/1740728182029049969,https://pbs.twimg.com/media/GChPDONacAAbzKw.jpg,"DKI Jakarta, Indonesia"
2023-12-29 20:35:18+07:00,1740728197732356556,"Ganjar Lebih Baik  O7gg1W1jK0   # #MahfudLebihBaik3 #GanjarMahfud2024 Hebat Mahfud Debat Guru Ngaji satu juta""",0,0,0,0,in,275200080,1740728197732356556,sjgkds,https://twitter.com/sjgkds/status/1740728197732356556,,
2023-12-29 20:37:08+07:00,1740728660469182905,"Waduuhh nie beneran anaknya Pak Lurah gaulnya ma promotor judi online?"" Ngeriii kali 😱 @PPATK  Asudahlah mending Gaspol Ganjar Mahfud 🤟 yg nyata-nyata bersih  teruji kapabilitas dan integritasnya tuk negeri ini. #GanjarMahfud2024 https://t.co/cnGfk8laxU""",0,1,11,21,in,1249352392954368001,1740728660469182905,denni_sauya,https://twitter.com/denni_sauya/status/1740728660469182905,https://pbs.twimg.com/media/GChPfdKaoAAmM0K.jpg,Selo Kartiko
2023-12-29 20:37:37+07:00,1740728781705462179,Malam ini Pak @ganjarpranowo bersilaturahmi di kediaman Habib Syech bin Abdul Qodir Assegaf di Kecamatan Pasar Kliwon  Kota Solo. Pak Ganjar sowan ke Habib Syech usai melakukan kegiatan di Wonogiri  keduanya langsung sholat maghrib berjamaah 💚 #GanjarMahfud2024 https://t.co/NT4zmqa7B0,0,2,44,215,in,714681332710957058,1740728781705462179,nety_rusi,https://twitter.com/nety_rusi/status/1740728781705462179,https://pbs.twimg.com/ext_tw_video_thumb/1740728736386105344/pu/img/InrDutQ8iUkgwSOc.jpg,
2023-12-29 20:38:06+07:00,1740728905022242974,Di sela-sela kampanye keliling Jawa Tengah Ganjar Pranowo  menyempatkan waktu menemui Habib Syech bin Abdul Qodir Assegaf  di Masjid Habib Syech di Joyosuran  Pasar Kliwon  Surakarta. Jumat ( 29/12/2023 ) 🤟😍 #GanjarHarapanNKRI  #GanjarMahfud2024 https://t.co/4ZqghYUuDb,0,1,20,67,in,731376028585594880,1740728905022242974,SimanjuntakElly,https://twitter.com/SimanjuntakElly/status/1740728905022242974,https://pbs.twimg.com/ext_tw_video_thumb/1740728257757212672/pu/img/iucsBzlzI5PNu-ON.jpg,"Jakarta Pusat, DKI Jakarta"
2023-12-29 20:40:22+07:00,1740729474419925199,Keren kan program @ganjarpranowo &amp; @mohmahfudmd dari Jawa Tengah akan dikembangkan ke seluruh Indonesia  sekolah digaji  lulus langsung kerja  maka yuk kita coblos Ganjar-Mahfud untuk Indonesia lebih baik 👌👍🤟 #GanjarMahfud2024 https://t.co/YhW2ks0XEc,4,17,45,132,in,849562015882465280,1740729474419925199,FirzaHusainID,https://twitter.com/FirzaHusainID/status/1740729474419925199,https://pbs.twimg.com/media/GChQO1tbAAA2FLx.jpg,Jakarta Raya
2023-12-29 20:42:57+07:00,1740730125183021062,Aduh bajer 03 @ch_chotimah2  @narkosun mati langkah krn ogah cari ide utk up ganjar bisanya sruduk sana sruduk sini😭😱,0,0,2,8,in,1620712595572547586,1740730125183021062,hartonometroadv,https://twitter.com/hartonometroadv/status/1740730125183021062,,"Jepara, Indonesia"
2023-12-29 20:47:07+07:00,1740731171410211032,Maju terus pak @ganjarpranowo siap m3nang #Ganjar,0,0,0,0,in,1722898111797088256,1740731171410211032,AmaeliaHasanah,https://twitter.com/AmaeliaHasanah/status/1740731171410211032,,
2023-12-29 20:49:36+07:00,1740731798655742031,Tak gentar terhadap hasil survey  Ganjar pilih fokus temui masyarakat   Jangan gentar ada Ganjar Jangan takut ada Mahfud  Banteng siap menyeruduk 🤟 https://t.co/2XAVsVPj9I,0,3,7,45,in,1247512756925763589,1740731798655742031,akupadi5,https://twitter.com/akupadi5/status/1740731798655742031,https://pbs.twimg.com/ext_tw_video_thumb/1740731620351791104/pu/img/So9HG8eLUDNhYZXH.jpg,Ahokers 🤟🤟🤟
2023-12-29 20:51:45+07:00,1740732340438241491,"Di Wonogiri Pak @ganjarpranowo secara resmi memperkenalkan program SMK Gratis Lulus Langsung Kerja untuk Keluarga Miskin.suksesny lulusan SMK di Jateng yg kini hidup sejahtera setelah menyelesaikan pendidikan jd Acuannya Lulus Langsung K3rja Sekolah Gratis Ganjar #SahabatGanjar https://t.co/u4EUv1Dqt5""",0,0,7,8,in,1166305200082042881,1740732340438241491,_Umamlik,https://twitter.com/_Umamlik/status/1740732340438241491,https://pbs.twimg.com/ext_tw_video_thumb/1740732281587953664/pu/img/AFyKzwPIYaaBil_N.jpg,"Moscow, Russia"
2023-12-29 20:53:02+07:00,1740732661411532800,Capresku sowan Habib Syech dan sholat berjamaah di Masjid Pasar Kliwon  Surakarta  (29/12/2023)  Pertemuan @ganjarpranowo dan Habib memperlihatkan akrabnya hubungan yang hangat nan penuh kekeluargaan. Gaspol Ganjar Mahfud 🤟 #GanjarMahfud2024 https://t.co/mxFVdYSszl,0,3,22,48,in,1249352392954368001,1740732661411532800,denni_sauya,https://twitter.com/denni_sauya/status/1740732661411532800,https://pbs.twimg.com/ext_tw_video_thumb/1740732544411385856/pu/img/LVjVPI1CZXezU1lg.jpg,Selo Kartiko
2023-12-29 20:54:36+07:00,1740733055260885302,Siti Atikoh Supriyanti mengikuti senam pagi bersama warga Purwokerto di depan Sasana Krida Raga Satria jln Prof Dr Suharso  Kab Banyumas Istri Pak @ganjarpranowo menarik Perhatian Warga Walhasil Pada pingin Selfi bareng😍 Lulus Langsung K3rja Sekolah Gratis Ganjar #SahabatGanjar https://t.co/tE1gHVnvtP,0,0,3,8,in,1166305200082042881,1740733055260885302,_Umamlik,https://twitter.com/_Umamlik/status/1740733055260885302,https://pbs.twimg.com/ext_tw_video_thumb/1740733011392708608/pu/img/JGIFCXOutrDMlQ4W.jpg,"Moscow, Russia"
2023-12-29 20:54:36+07:00,1740733055961334231,@ainunnajib -Desak anies -Nginep ganjar -Hipertensi prabowo 3 acara yg hebat.. -Merangkul.. -Membaur.. -Meniadakan..,23,45,67,736,in,1464497688,1740704103976874362,ramaarsk,https://twitter.com/ramaarsk/status/1740733055961334231,,Indonesia
2023-12-29 20:55:05+07:00,1740733177440915963,Janji Mahfud MD hapus utang petani dan nelayan saat kampanye di Banyuwangi Jawa timur   Mantap !!! Ganjar-Mahfud pro rakyat 🤟 https://t.co/6DOaT9Pr7X,0,7,70,320,in,1247512756925763589,1740733177440915963,akupadi5,https://twitter.com/akupadi5/status/1740733177440915963,https://pbs.twimg.com/ext_tw_video_thumb/1740733019827367936/pu/img/Z3CDjVYx0565tYXz.jpg,Ahokers 🤟🤟🤟
2023-12-29 20:55:21+07:00,1740733243161489481,@nenggsyifa @Reiza_Patters Seandainya Anies Ganjar,1,13,4,96,in,1606473952146362375,1740721932465824219,sfmgunners,https://twitter.com/sfmgunners/status/1740733243161489481,,"Riau, Indonesia"
2023-12-29 20:57:49+07:00,1740733866384744813,Curhat Bareng @ganjarpranowo hadir di tengah-tengah anak muda milenial dan gen Z di Kota Mataram NTB Dalam kesempatan tersebut ia bercengkrama untuk mendengar curhatan dan aspirasi anak2 Muda Disana seraya bersantai Ria Lulus Langsung K3rja Sekolah Gratis Ganjar #SahabatGanjar https://t.co/E7tWCPQg6m,0,0,5,8,in,1166305200082042881,1740733866384744813,_Umamlik,https://twitter.com/_Umamlik/status/1740733866384744813,https://pbs.twimg.com/ext_tw_video_thumb/1740733818158669824/pu/img/20cU-oHYI-NCBuDW.jpg,"Moscow, Russia"
2023-12-29 20:59:32+07:00,1740734298951745880,Ganjar Pranowo sowan ke Surakarta  Jumat (29/12/2023)  dan sholat berjamaah dengan Habib Syech di Masjid Pasar Kliwon Pertemuan Ganjar dan Habib ini memperlihatkan hubungan yg hangat akan rasa kekeluargaan dan erat akan pertemanan https://t.co/pXztUgFmrV,0,2,23,125,in,1248538148990152704,1740734298951745880,Ghurem2,https://twitter.com/Ghurem2/status/1740734298951745880,https://pbs.twimg.com/ext_tw_video_thumb/1740732507962929152/pu/img/ix57YnU92mYDtVIx.jpg,Jateng  Indonesia
2023-12-29 20:59:39+07:00,1740734327200309459,Ganjar setuju Ma'ruf Amin : Jangan anggap wapres ban serep  nganggur-nganggur saja https://t.co/8khT1pcjbw,0,1,11,49,in,1247512756925763589,1740734327200309459,akupadi5,https://twitter.com/akupadi5/status/1740734327200309459,https://pbs.twimg.com/ext_tw_video_thumb/1740734182429790208/pu/img/8CZm_r_ZNZQZNXNy.jpg,Ahokers 🤟🤟🤟
2023-12-29 21:00:40+07:00,1740734582058893457,"Pak @ganjarpranowo Hadir melihat Langsung Konser HUT 40 Band SLANK Lagu-lagu dari band Legendaris Indonesia Slank"" membawa penikmat Musik kembali ke masa lalu Beliau Capres yang satu2nya hadir dalam Hut 40 Tsb Luarbiasa  Lulus Langsung K3rja Sekolah Gratis Ganjar #SahabatGanjar https://t.co/hWA26MLjGU""",0,0,7,10,in,1166305200082042881,1740734582058893457,_Umamlik,https://twitter.com/_Umamlik/status/1740734582058893457,https://pbs.twimg.com/ext_tw_video_thumb/1740734543743832064/pu/img/NGz9-U8jT9jtiOx5.jpg,"Moscow, Russia"
2023-12-29 21:00:46+07:00,1740734608474624428,××× Istri capres nomor urut tiga Ganjar Pranowo  Siti Atikoh Supriyanti mengikuti senam pagi bersama warga Purwokerto di depan Sasana Krida Raga Satria  Jalan Prof Dr Suharso  Kabupaten Banyumas  Jumat (29/12).  #SahabatGanjar #GanjarPresiden #GanjarMahfud2024 #PastiLebihBaik https://t.co/ddLIwtZo7f,0,0,10,12,in,880019254027866113,1740734608474624428,007koteka,https://twitter.com/007koteka/status/1740734608474624428,https://pbs.twimg.com/ext_tw_video_thumb/1740734238658568192/pu/img/axeoGeV-p9EGgsly.jpg,
2023-12-29 21:02:13+07:00,1740734972879876487,LSI Denny JA: Baru Pertama Elektabilitas Anies-Muhaimin Salip Ganjar-Mahfud https://t.co/BOi7DxP4WY,1,2,14,23,in,887743587579944960,1740734972879876487,OposisiCerdas,https://twitter.com/OposisiCerdas/status/1740734972879876487,,
2023-12-29 21:03:49+07:00,1740735374673195048,@kumparan dukung ganjar sampai m3nang!! #GanjarSikatKorupsi,0,4,0,0,in,1680673104924909569,1740589736039964855,charlot3__,https://twitter.com/charlot3__/status/1740735374673195048,,
2023-12-29 21:12:03+07:00,1740737448525910045,Momen Pak Ganjar Pranowo sowan ke Surakarta  dan sholat berjamaah dengan Habib Syech di Masjid Pasar Kliwon.  Pertemuan Pak Ganjar dengan Habib ini memperlihatkan hubungan yang begitu hangat dan penuh kekeluargaan.  Jumat  29/12/23.  Cc. @ganjarpranowo   #GanjarMahfud2024 https://t.co/LQm7WPkujo,0,0,16,24,in,1174287141909590017,1740737448525910045,seruanhl,https://twitter.com/seruanhl/status/1740737448525910045,https://pbs.twimg.com/ext_tw_video_thumb/1740735446240595968/pu/img/HwXKV6BEwp30up0l.jpg,Indonesia
2023-12-29 21:12:22+07:00,1740737527127167445,Jokowi aja tau  BERAT nya melawan GANJAR. Kemana GANJAR pergi  selalu dibuntuti... https://t.co/ZALdScPgh6,4,8,20,45,in,797761417894051840,1740737527127167445,MarahIchsan,https://twitter.com/MarahIchsan/status/1740737527127167445,https://pbs.twimg.com/media/GChXa2_bsAADPcj.png,
2023-12-29 21:15:05+07:00,1740738211104919591,TPN Ganjar Pranowo-Mahfud MD menilai dikirimnya puluhan ribu surat suara di Taiwan di luar jadwal menimbulkan kecurigaan. https://t.co/nZe10PGZi3,1,1,0,3,in,23343960,1740738211104919591,kompascom,https://twitter.com/kompascom/status/1740738211104919591,,Jakarta
2023-12-29 21:15:28+07:00,1740738307351511146,Ganjar Dukung Pengembangan Wisata Desa https://t.co/qWclwtm3Yh,0,0,2,2,in,992673313141899264,1740738307351511146,iina_surbakti,https://twitter.com/iina_surbakti/status/1740738307351511146,,Indonesia
2023-12-29 21:15:29+07:00,1740738309545177188,Ganjar - Mahfud ttp Yang TERBAIK  bagi yg peduli dg negara ini.... 🤟🤟🤟 harapan rakyat. PERJUANGAN masih berlanjut...💪💪💪🔥🔥🔥 No :03 PilihanKU....🤟❤🇮🇩✅ https://t.co/78VMZ62pWn,11,21,255,920,in,1605181161499947009,1740738309545177188,AlfatihDhany,https://twitter.com/AlfatihDhany/status/1740738309545177188,https://pbs.twimg.com/ext_tw_video_thumb/1740738281837559808/pu/img/bOwegfd7qd0O5O4-.jpg,
2023-12-29 21:19:34+07:00,1740739337493615000,Alhamdulillah  dukungan terus mengalir  semoga menjadi Barokah 🤲🙏🏼 Ulama dan Kiai di Tangerang dan Depok Dukung Ganjar-Mahfud(360p).  #GanjarMahfud2024 https://t.co/3zAlu4HoQP https://t.co/w7degurTMu,0,0,3,13,in,2495508415,1740739337493615000,Darmawan_bs,https://twitter.com/Darmawan_bs/status/1740739337493615000,https://pbs.twimg.com/ext_tw_video_thumb/1740738741759774721/pu/img/g3gCKafsPzmXua33.jpg,
2023-12-29 21:22:06+07:00,1740739976399299060,@Dennysiregar7 ini mural kami di semarang timur bang...gass ganjar presiden... https://t.co/2vYT5Y8QSI,1,8,3,77,in,1580057404284493824,1740731689155047904,edysasmito16,https://twitter.com/edysasmito16/status/1740739976399299060,https://pbs.twimg.com/media/GChZxxUa4AAytTp.jpg,
2023-12-29 21:23:14+07:00,1740740261846909119,Bersama Ganjar Mahfud 514 kabupaten/kota di Indonesia akan punya sekolah gratis utk anak kurang mampu seperti di Jateng dg 70% lulusannya langsung bekerja  #GanjarMahfud2024 Pasti bisa https://t.co/pM9M1jRkVh,1,8,34,85,in,4184979312,1740740261846909119,AntoniusCDN,https://twitter.com/AntoniusCDN/status/1740740261846909119,https://pbs.twimg.com/media/GChaChqaEAAoGcZ.jpg,"Semarang, Jawa Tengah"
2023-12-29 21:24:15+07:00,1740740519201046595,Pilihan untuk rakyat Indonesia dari Ganjar Mahfud  Sekolah Gratis Ganjar Lulus Langsung K3rja atau lanjut Satu Keluarga Satu Sarjana. Rakyat betul2 dimuliakan ya.😊  Waktu sy Kampanyekan Satu keluarga satu sarjana  byk buzzeRP 02 nyinyir  percuma sarjana kalo ujungnya nganggur … https://t.co/Fjsvnzy11j,1,16,62,194,in,154435354,1740740519201046595,ch_chotimah2,https://twitter.com/ch_chotimah2/status/1740740519201046595,https://pbs.twimg.com/media/GChaRYBakAA2u05.jpg,"Kalimantan Timur, Indonesia"
2023-12-29 21:24:53+07:00,1740740676105765301,Hangatnya suasana kekeluargaan antara Habib Syech dg Ganjar Pranowo saat keduanya bertemu di Masjid Pasar Kliwon  Surakarta.  Ganjar sowan kepada Habib Syech di Masjid tsb menjelang waktu sholat Maghrib. https://t.co/e6WyFAIjFs,2,2,26,109,in,4200694752,1740740676105765301,Ari3Pras,https://twitter.com/Ari3Pras/status/1740740676105765301,https://pbs.twimg.com/amplify_video_thumb/1740740517430992896/img/OqCwAgSXMzbvtt0G.jpg,Indonesia
2023-12-29 21:29:06+07:00,1740741737923113282,Siap ...🙋‍♂️ Generasi Muda NU deklarasi dn siap menangkan GANJAR - MAHFUD.... Tetep nderek Pak Kiai...✅ 🤟🤟🤟 https://t.co/G1cYaf30d9,0,0,3,10,in,1605181161499947009,1740741737923113282,AlfatihDhany,https://twitter.com/AlfatihDhany/status/1740741737923113282,https://pbs.twimg.com/ext_tw_video_thumb/1740741676426235904/pu/img/YMduRWI_wys5PRhx.jpg,
2023-12-29 21:34:26+07:00,1740743082373722465,SRIKANDI SOLO si BANTENG BETINA.... GasssPolll Ganjar Mahfud...🤟🤟🤟 #GanjarMahfudRebound  #GanjarMahfudRebound  #GanjarMahfudRebound  #GanjarHarapanNKRI https://t.co/akkjZEpaWt,2,0,24,86,in,1605181161499947009,1740743082373722465,AlfatihDhany,https://twitter.com/AlfatihDhany/status/1740743082373722465,https://pbs.twimg.com/ext_tw_video_thumb/1740743039730249729/pu/img/IoR2hfOWd77efDJc.jpg,
