created_at,id_str,full_text,quote_count,reply_count,retweet_count,favorite_count,lang,user_id_str,conversation_id_str,username,tweet_url,image_url,location
2023-12-27 15:56:36+07:00,1739933284992454906,𝐓𝐄𝐓𝐄𝐏 𝐏𝐔𝐓𝐈𝐇 𝐌𝐁𝐎𝐓𝐄𝐍 𝐍𝐆𝐀𝐋𝐈𝐇  Kehadiran Ganjar ditengah warga Blimbing  Sukoharjo (27/12/2023)  Ganjar yang merakyat dan sederhana membuat barisan rakyat tidak canggung saat berada di dekatnya.  #ganjarmahfudpilihanrakyat #gantari https://t.co/vinHedz5cJ,0,0,18,33,in,1360277904001650693,1739933284992454906,WongKEDU_,https://twitter.com/WongKEDU_/status/1739933284992454906,https://pbs.twimg.com/ext_tw_video_thumb/1739933212074541056/pu/img/3gihUU1cJkHKYPOL.jpg,"Jawa Tengah, Indonesia"
2023-12-27 15:58:02+07:00,1739933647610777737,Saya pilih Ganjar Mahfud karena memilih pendidikan untuk melawan kemiskinan  bukan dengan makan siang dan susu gratis..   Hanya inilah solusi nyata mengangkat angka kemiskinan bangsa ini..   Gaspol💪 https://t.co/3MxXSDGI2F,9,16,127,471,in,214159664,1739933647610777737,Paltiwest,https://twitter.com/Paltiwest/status/1739933647610777737,https://pbs.twimg.com/ext_tw_video_thumb/1739933620167659520/pu/img/7cg38OjijrepP7ww.jpg,"Medan dan Jakarta, Indonesia"
2023-12-27 15:58:51+07:00,1739933850799669452,@Kanjeng2022 Ga mas tetap no 3 bagi saya ganjar mahfud yang terbaik di antara 3 capres.,0,1,1,3,in,1694137351788974080,1739846233408295112,HPemalang69811,https://twitter.com/HPemalang69811/status/1739933850799669452,,
2023-12-27 15:59:33+07:00,1739934026767737146,Ganjar Mahfud https://t.co/mGQ3EdzEyO,0,0,0,0,in,1485122542151282688,1739934026767737146,PurbaSafaruddin,https://twitter.com/PurbaSafaruddin/status/1739934026767737146,https://pbs.twimg.com/media/GCV8sFfacAA8g5p.jpg,
2023-12-27 16:02:59+07:00,1739934891557695719,WRR...GAWAT WIRR‼️  Pak Ndul cabut dukungan ke Ganjar 🤧 Pendukung paslon tetangga pasti seneng nih. 😏 https://t.co/jtdwC2yZMr,3,6,36,112,in,1226725839099707392,1739934891557695719,aan_muba,https://twitter.com/aan_muba/status/1739934891557695719,https://pbs.twimg.com/ext_tw_video_thumb/1739934757922992128/pu/img/nEbwKgqYPjUxaHJ0.jpg,
2023-12-27 16:04:43+07:00,1739935328935334292,mau disamaain dari mana juga beda woi ini prestasinya pakde gabisa diklaim #UbanBukanPakde https://t.co/VuLTLz1lPO,0,0,4,1,in,1719642017989349376,1739935328935334292,JaydeeTebo,https://twitter.com/JaydeeTebo/status/1739935328935334292,,
2023-12-27 16:05:42+07:00,1739935578303742330,SANTUN SOREER  NDEEERR SALAM M3TAAALL 🤟  Ganjar Pranowo kunjungi wisata mata air Cokro  Tulung  Klaten (27/12/2023). Masyarakat yang berada dilokasi langsung menyambut Ganjar dengan penuh antusias. Menyapa dan bercanda ria bareng pengunjung  termasuk anak-anak memecah… https://t.co/LnfPxYSugy,0,1,21,39,in,4200088157,1739935578303742330,KutaReal_X,https://twitter.com/KutaReal_X/status/1739935578303742330,https://pbs.twimg.com/ext_tw_video_thumb/1739935482082111489/pu/img/fYAESHb2AcGeGrdH.jpg,Jakarta Capital Region
2023-12-27 16:06:19+07:00,1739935730523152526,Ahok itu lempeng  logis dan jelas nasionalis yang gak akan kompromi sama yang namanya korupsi. Karena sikapnya itu maka pilihannya jatuh ke pasangan Ganjar Mahfud!!  . . https://t.co/3JlG4ZbTzN,4,29,123,755,in,2542665199,1739935730523152526,YRadianto,https://twitter.com/YRadianto/status/1739935730523152526,https://pbs.twimg.com/media/GCV-UiLaQAAuG8M.png,"Jawa Barat, Indonesia"
2023-12-27 16:08:39+07:00,1739936320456442030,Solusi: - Pilih AMIN tapi tidak pilih PKS di legislatif - Pilih Ganjar Mahfud tapi tidak pilih PDIP di legislatif  Yang pasti tidak pilih Prabowo-Gibran dan partai pendukungnya 😊,133,186,2316,7284,in,871103989,1739936320456442030,mawakresna,https://twitter.com/mawakresna/status/1739936320456442030,,Indonesia
2023-12-27 16:13:07+07:00,1739937441392570624,Terawangan gue pilpres 2029 adalah:  A. Gibran-AHY vs B. Anies-Ganjar or Ganjar-Anies,18,32,34,289,in,324439645,1739937441392570624,xathrya,https://twitter.com/xathrya/status/1739937441392570624,,"Kilimanjaro, Tanzania"
2023-12-27 16:16:05+07:00,1739938187777315055,Bareng ratusan anak muda milenial dan Gen Z  Ganjar Pranowo berdiskusi dan saling bertukar pikiran di Kopi Story Klaten  Rabu (27/12/2023). Mengulik seputar dunia pekerjaan  kekerasan seksual dan lain sebagainya menjadi topik perbincangan hangat mereka. #GanjarM3layaniRakyat https://t.co/ZLBCdV9Huy,0,0,8,11,in,1226725839099707392,1739938187777315055,aan_muba,https://twitter.com/aan_muba/status/1739938187777315055,https://pbs.twimg.com/ext_tw_video_thumb/1739937957019308032/pu/img/bf_GZ2EENzPYz4nl.jpg,
2023-12-27 16:19:53+07:00,1739939147178295645,Ketika Pak Ganjar Pranowo Kunjungi Dan Bertemu Langsung Dgn Petani Tembakau Di Desa Mireng Trucuk Klaten (27/12/23). Wajah Bungah/Ceria Jelas Terpancar Dari Para Petani Tembakau Tersebut. https://t.co/qkafQDx2n7,0,0,21,44,in,1389082210452443138,1739939147178295645,sami86pilang,https://twitter.com/sami86pilang/status/1739939147178295645,https://pbs.twimg.com/ext_tw_video_thumb/1739939039179141120/pu/img/zb0xXpgkF3Z-__fy.jpg,PLANET TERINDAH
2023-12-27 16:21:10+07:00,1739939468080259342,Survei Polling Institute: Prabowo-Gibran 46 1%  Anies-Cak Imin 22 6%  Ganjar-Mahfud 20 5% https://t.co/FO9WcQJz73 #Pemilu,5,27,10,22,in,47596019,1739939468080259342,liputan6dotcom,https://twitter.com/liputan6dotcom/status/1739939468080259342,,Jakarta
2023-12-27 16:26:07+07:00,1739940715608850846,Momen Ketika Pak Ganjar Pranowo  Diskusi Dan Bertukar Pikiran Dgn Ratusan Anak Muda Gen Z Di Kopi Story Klaten (27/12/23). https://t.co/ylinoCVwc2,0,4,14,43,in,1389082210452443138,1739940715608850846,sami86pilang,https://twitter.com/sami86pilang/status/1739940715608850846,https://pbs.twimg.com/ext_tw_video_thumb/1739940620213637120/pu/img/giPC8l14VxGyN3eq.jpg,PLANET TERINDAH
2023-12-27 16:34:31+07:00,1739942829168980425,CSIS: Elektabilitas Paslon   1. Anies-Cak Imin 26 1%   2. Prabowo-Gibran 43 7%   3. Ganjar-Mahfud 19 4%.   Belum menentukan pilihan 6 4%,7,21,16,100,in,235931838,1739942829168980425,kangdede78,https://twitter.com/kangdede78/status/1739942829168980425,,"Jakarta Pusat, DKI Jakarta"
2023-12-27 16:34:41+07:00,1739942868926840876,@Anak__Ogi @jokowi @gibran_tweet Tidak perlu memutar balikkan fakta  kita semua tau jokowi sebelumnya merangkul untuk menyatukan semuanya. Sdh kerap kali jokowi terlihat mempertemukan Prabowo-Ganjar. Namun apa? Ganjar selalu didikte untuk patuh mengikuti arahan. Kami tdk ingin lagi punya pemimpin seperti kemudi https://t.co/kVFaNHRXYl,3,22,4,44,in,1135014782300372997,1739910467181834352,arifin_writer,https://twitter.com/arifin_writer/status/1739942868926840876,https://pbs.twimg.com/ext_tw_video_thumb/1739942744523714560/pu/img/IZuktxoFvl6eyh19.jpg,Indonesia
2023-12-27 16:39:49+07:00,1739944162408149144,Prof Mahfud kriteria pemimpin yang diinginkan rakyat  tapi tidak diinginkan pejabat nakal dan pengusaha nakal.  Sikapnya yang tidak kenal kompromi  tegak lurus terhadap UU 1945  Pancasila dan konstitusi membuat para penjahat ketar ketir.  Ingin Indonesia lebih baik  pilih Ganjar… https://t.co/exF7WV9nVt,3,3,29,200,in,1101696077147729920,1739944162408149144,03__nakula,https://twitter.com/03__nakula/status/1739944162408149144,https://pbs.twimg.com/ext_tw_video_thumb/1739944118342848512/pu/img/3PWsgYskIHIc25qP.jpg,
2023-12-27 16:41:11+07:00,1739944507129671958,posisi buncit...... kok bisa pertaruhkan partai di jempol buzzer2RP.  Ganjar-Mahfud Kalah Lagi di Hasil Survei Elektabilitas  Kali Ini di Posisi Buncit Riset CSIS https://t.co/5RXRbR2aP1,4,35,27,81,in,119691957,1739944507129671958,aewin86,https://twitter.com/aewin86/status/1739944507129671958,,Jakarta Capital Region
2023-12-27 16:43:05+07:00,1739944984038805663,Alam Ganjar Kunjungi Keraton Surakarta untuk Belajar Sejarah https://t.co/cOLnAD8hWo,0,100,84,81,in,388190238,1739944984038805663,IDNTimes,https://twitter.com/IDNTimes/status/1739944984038805663,,
2023-12-27 17:05:28+07:00,1739950617366593966,Calon presiden (Capres) nomor urut 03  Ganjar Pranowo meluncurkan program 1 Keluarga Miskin 1 Sarjana di Lapangan Desa Cangkol  Kecamatan Mojolaban  Kabupaten Sukoharjo  Selasa (26/12/2023).  #SahabatGanjar #GanjarPranowo https://t.co/EwPJBhssu1,0,0,4,5,in,2497018502,1739950617366593966,125Japstyle,https://twitter.com/125Japstyle/status/1739950617366593966,https://pbs.twimg.com/ext_tw_video_thumb/1739950593907765248/pu/img/gWALQvoqCrdJCMsz.jpg,Indonesia🇮🇩
2023-12-27 17:05:47+07:00,1739950698853523645,Dukungan untuk Ganjar-Mahfud datang dari barisan Tuan Guru Muda Nusantara di NTB https://t.co/bYKc7t9RV9,1,2,53,326,in,1247512756925763589,1739950698853523645,akupadi5,https://twitter.com/akupadi5/status/1739950698853523645,https://pbs.twimg.com/ext_tw_video_thumb/1739950582356725760/pu/img/KH60XVuKAFDLzuMg.jpg,Ahokers 🤟🤟🤟
2023-12-27 17:11:43+07:00,1739952189890773483,@arslechanneling Kenapa dengan Wadas ini? Digorengin mulu padahal itu proyeknya Bpk. @jokowi yang sudah diselesaikan dengan baik sama Bpk. @ganjarpranowo . Heran sama orang-orang masih bawa issue beginian buat ngejatuhin Bpk. Ganjar . Apa juga yang salah dari PDI-P? Memang ada parpol lebih baik?,2,11,2,18,in,1731115890815664128,1739888170739941872,DindaLaw88,https://twitter.com/DindaLaw88/status/1739952189890773483,,
2023-12-27 17:16:22+07:00,1739953358218334255,"Calon Presiden (Capres) Nomor Urut 3 @ganjarpranowo  mengajak untuk melawan bersama-sama kemiskinan lewat pendidikan. Hal itu diungkapkan Ganjar saat bertemu dengan masyarakat di Sukoharjo  Jawa Tengah  Selasa (26/12/2023).  #GasssGanjarMahfud https://t.co/UthbDQNUsW""",0,3,15,7,in,1651918918112641024,1739953358218334255,Bakoto45,https://twitter.com/Bakoto45/status/1739953358218334255,https://pbs.twimg.com/ext_tw_video_thumb/1739953323548221440/pu/img/x3_ljeoZnw6RbzcG.jpg,
2023-12-27 17:17:11+07:00,1739953566381687270,Calon Presiden (Capres) Nomor Urut 3  Ganjar Pranowo berkomitmen untuk memprioritaskan pengembangan Usaha Mikro Kecil Menengah (UMKM) dan Koperasi.   #SahabatGanjar https://t.co/RqjMcvMRVS,0,1,16,24,in,940486643546386432,1739953566381687270,__RismaWidiono_,https://twitter.com/__RismaWidiono_/status/1739953566381687270,https://pbs.twimg.com/media/GCWOiLabAAABShJ.jpg,"DKI Jakarta, Indonesia"
2023-12-27 17:17:46+07:00,1739953713027133951,Relawan Cirebon Deklarasi Jihad Politik untuk Kemenangan Ganjar-Mahfud MD Dukungan terhadap GAMA di Pilpres 2024 mendatang terus mengalir dari masyarakat Cirebon raya.  Mereka  bergabung ke tim relawan Ganjar Pranowo.  Ayo gas trus!  ||Indikator CSIS Bali Nepo Baby Papua Psikolog https://t.co/SlCaSXHcBf,1,22,65,211,in,1661942763628404742,1739953713027133951,ENJEULL,https://twitter.com/ENJEULL/status/1739953713027133951,https://pbs.twimg.com/ext_tw_video_thumb/1739953578494787584/pu/img/c_pwfdRshUCIERpa.jpg,
2023-12-27 17:23:42+07:00,1739955205956067335,Bg ini Survey yg lbh lengkap. Ada 10% lbh yg tdk tau dan rahasia.  Itu yg ditambahkan k survey abal2.   Sy sudah sebut 02 nilai tertingginya di 45% ini seperti pilkada dki. Ahok stag di 44%  Trend AMIN Naik signifikan d 26 dr survey awal yg 15% swing 0   https://t.co/AnzgzDcy9r,1,1,11,13,in,967301965075030016,1739955205956067335,partaiketoprak,https://twitter.com/partaiketoprak/status/1739955205956067335,,
2023-12-27 17:27:28+07:00,1739956151771594813,Kasihan si Alam Ganjar dieksploitasi untuk kepentingan @ganjarpranowo. @prabowo @aniesbaswedan @Gerindra @golkar_id @psi_id   @KEBUMENinLOVE @andre_rosiade @AdjaCapoek https://t.co/TAI65ww9f2 https://t.co/hTumxyI4YX,0,7,24,24,in,1709893374,1739956151771594813,harasjoman,https://twitter.com/harasjoman/status/1739956151771594813,https://pbs.twimg.com/media/GCWQ422aAAAF-fo.jpg,
2023-12-27 17:30:04+07:00,1739956807286796486,Kader dan relawan PDIP tak tertandingi  Ganjar yakin menang di Solo https://t.co/wPjA5moPQR,0,8,104,519,in,1247512756925763589,1739956807286796486,akupadi5,https://twitter.com/akupadi5/status/1739956807286796486,https://pbs.twimg.com/ext_tw_video_thumb/1739956730476589056/pu/img/AT9TmoTfNqrRFbE6.jpg,Ahokers 🤟🤟🤟
2023-12-27 17:32:27+07:00,1739957407911154073,Ganjar Pranowo berkunjung dan bertemu dengan Sri Sultan Hamengkubuwono X di Gedung Wilis  Kepatihan  Yogyakarta (27/12/2023).   Selaku tuan rumah pun menyambut hangat kedatangan Ganjar. Kelekatan hubungan keduanya tak lepas dari peran Ganjar atas lahirnya UUK (Undang-Undang… https://t.co/exSUAWCg0s,0,0,10,17,in,1316243860280889345,1739957407911154073,elsaday__,https://twitter.com/elsaday__/status/1739957407911154073,https://pbs.twimg.com/ext_tw_video_thumb/1739957151219728385/pu/img/xueTqr064kK_uPzx.jpg,🇮🇩
2023-12-27 17:33:38+07:00,1739957705622815084,Pak Ganjar Pranowo berkunjung dan bertemu dengan Sri Sultan Hamengkubuwono X di Gedung Wilis  Kepatihan  Yogyakarta (27/12/2023).  Kelekatan hubungan Beliau Berdua tak lepas dari peran Pak Ganjar atas lahirnya UUK (Undang-Undang Keistimewaan) DIY.  Wow mantap. 🥰🤟 https://t.co/vDKG2aovbw,3,14,76,173,in,1307892095240212480,1739957705622815084,Nduklala2,https://twitter.com/Nduklala2/status/1739957705622815084,https://pbs.twimg.com/ext_tw_video_thumb/1739957621522886657/pu/img/JptzsHWu1Zvc6XOM.jpg,DIHATIMU
2023-12-27 17:36:33+07:00,1739958440754340010,Ganjar Pranowo Berkunjung dan Bertemu dengan Sri Sultan Hamengkubuwono X   di Gedung Wilis  Kepatihan  Yogyakarta (27/12/2023).  Selaku Tuan Rumah pun Menyambut Hangat Kedatangan Ganjar. Kelekatan Hubungan Keduanya tak Lepas dari Peran Ganjar atas Lahirnya UUK  Yogyakarta. https://t.co/XdieCoNtYA,0,0,3,19,in,1322361095407902721,1739958440754340010,SETYAKI22965702,https://twitter.com/SETYAKI22965702/status/1739958440754340010,https://pbs.twimg.com/ext_tw_video_thumb/1739958409955565568/pu/img/5YKvteKwrgyoYacw.jpg,SOLO -  INDONESIA
2023-12-27 17:36:52+07:00,1739958519653449828,Yogyakarta  27/12/2023  Sri Sultan Hamengkubuwono X menyambut dengan hangat kedatangan Ganjar Pranowo.  . Sebagai info Ganjar turut berperan serta atas lahirnya  Undang-Undang Keistimewaan Daerah Istimewa Yogyakarta. https://t.co/4yESPUe1n0,10,24,122,550,in,219548433,1739958519653449828,hansssolo,https://twitter.com/hansssolo/status/1739958519653449828,https://pbs.twimg.com/ext_tw_video_thumb/1739958477307695104/pu/img/vqpY7_jLAPfxPtw8.jpg,Indonesia
2023-12-27 17:39:23+07:00,1739959151676330410,@Melihat_Indo Ga sekalian @ganjarpranowo ajak kakek dan neneknya untuk kampanye? Nanggung amat cuma anaknya doang si Alam Ganjar yg dibawa2.. @prabowo @aniesbaswedan @Gerindra @golkar_id @psi_id   @STresnowati1 @ekowboy2 @pedagang_kritik https://t.co/WT87925X0f https://t.co/x7Vd2a7ntd,0,2,10,10,in,1709893374,1738886363960000557,harasjoman,https://twitter.com/harasjoman/status/1739959151676330410,https://pbs.twimg.com/media/GCWTn8TaYAAzNOC.jpg,
2023-12-27 17:43:21+07:00,1739960150839161152,Selalu Ada Cinta Dan Tempat Tersendiri Buat Pak Ganjar Di Jogja.  UUK (Undang Undang Keistimewaan)Adalah Bukti Cinta Beliau Pada DIY Yogyakarta. https://t.co/CXAtpYBZVx,0,2,13,48,in,1389082210452443138,1739960150839161152,sami86pilang,https://twitter.com/sami86pilang/status/1739960150839161152,https://pbs.twimg.com/ext_tw_video_thumb/1739960118358458368/pu/img/HylBtLC9N9gVE0uK.jpg,PLANET TERINDAH
2023-12-27 17:47:33+07:00,1739961208256479722,Kyai Ponpes Cipasung mantap pilih GANJAR jadi Presiden 2024 mendatang... https://t.co/Kp7Z6UKv9O,10,14,173,789,in,797761417894051840,1739961208256479722,MarahIchsan,https://twitter.com/MarahIchsan/status/1739961208256479722,https://pbs.twimg.com/ext_tw_video_thumb/1739961157010780160/pu/img/R7-0sSKdBaIyeC6p.jpg,
2023-12-27 17:54:26+07:00,1739962940315578702,@xquitavee @jokowi Dengan fenomena masa lalu akan terjadi di pilpres 2024…  pilih presiden itu yg jangan hoby kalah hoby emosian  2024 GANJAR MAHFUD PDI P 🤟🏻🤟🏻🤟🏻🤟🏻🤟🏻 https://t.co/rMMMQ714gl,0,0,2,24,in,1722938502286065664,1739941032593342537,Arief1574257,https://twitter.com/Arief1574257/status/1739962940315578702,https://pbs.twimg.com/media/GCWXEWxakAATsen.jpg,
2023-12-27 17:56:10+07:00,1739963377428860994,Pendukung ANIES dan GANJAR kudu baek2an dari skrg. Siapapun yg lolos musti saling dukung.,55,69,410,2369,in,154549806,1739963377428860994,rihandaulah,https://twitter.com/rihandaulah/status/1739963377428860994,,"Utrecht, The Netherlands"
2023-12-27 17:59:29+07:00,1739964211827282232,Pak Ganjar hari ini. Pagi olahraga  lanjut sarapan bersama warga  bertemu dgn petani  dialog dgn millenial  dan yg terbaru bertemu dgn Sri Sultan Hamengkubuwono X di Gedung Wilis  Kepatihan  Yogyakarta (27/12/2023).   Capres 02 tidak akan sanggup seperti ini sappo. https://t.co/tpjzt7ukiC,0,4,18,52,in,1356517931887120384,1739964211827282232,Anak__Ogi,https://twitter.com/Anak__Ogi/status/1739964211827282232,https://pbs.twimg.com/ext_tw_video_thumb/1739963887557246976/pu/img/f47SNCjZa1vdATTk.jpg,Indonesia
2023-12-27 18:02:30+07:00,1739964971453473235,Tulusmu tanpa kepalsuan.  Atikoh Ganjar  Ibu negara RI 2024-2029  InsyaAllah.🙏 https://t.co/AbeSR7ZVWA,4,42,166,751,in,154435354,1739964971453473235,ch_chotimah2,https://twitter.com/ch_chotimah2/status/1739964971453473235,https://pbs.twimg.com/ext_tw_video_thumb/1739964926863835136/pu/img/_P5RKnrmjncEjLXe.jpg,"Kalimantan Timur, Indonesia"
2023-12-27 18:07:00+07:00,1739966100824363502,Pasangan Capres-Cawapres nomor urut 3  Ganjar Pranowo-Mahfud MD menaruh perhatian khusus kepada kaum disabilitas agar dapat berkontribusi di berbagai aspek pembangunan nasional.  Hal ini ditandai dengan digagasnya program Sat Set Pendidikan Inklusif dan Kesetaraan untuk… https://t.co/X511DMXgG2,0,0,7,20,in,1316243860280889345,1739966100824363502,elsaday__,https://twitter.com/elsaday__/status/1739966100824363502,https://pbs.twimg.com/ext_tw_video_thumb/1739966018297163776/pu/img/01fhtTOII_icdqcg.jpg,🇮🇩
2023-12-27 18:07:31+07:00,1739966234152820792,"Ganjar Pranowo berkunjung dan bertemu dengan Sri Sultan Hamengkubuwono X di Gedung Wilis  Kepatihan   Yogyakarta (27/12/2023).   Eratnya tangan Sultan menggenggam tangan Calon Presiden RI @ganjarpranowo  😍  Seakan ngasi kode"" pada rakyat Yogya dan Indonesia ...  ""Tegas saya… https://t.co/ZZ1wNT7fAY""",0,3,27,93,in,972357839279673344,1739966234152820792,FaGtng,https://twitter.com/FaGtng/status/1739966234152820792,https://pbs.twimg.com/ext_tw_video_thumb/1739966186983735296/pu/img/jYxLH_op2Nh5zuT7.jpg,
2023-12-27 18:09:53+07:00,1739966827101610038,Calon presiden (Capres) nomor urut 03  Ganjar Pranowo meluncurkan program 1 Keluarga Miskin 1 Sarjana di Lapangan Desa Cangkol  Kecamatan Mojolaban  Kabupaten Sukoharjo  Selasa (26/12/2023).  Menurutnya  program tersebut diproyeksikan untuk memutus mata rantai kemiskinan… https://t.co/PFCoC1KZM4,0,0,6,14,in,1316243860280889345,1739966827101610038,elsaday__,https://twitter.com/elsaday__/status/1739966827101610038,https://pbs.twimg.com/ext_tw_video_thumb/1739966508594507776/pu/img/mRin7V0IszHpqYSz.jpg,🇮🇩
2023-12-27 18:15:00+07:00,1739968114589380616,Ganjar Minta Anak Muda Waspadai TPPO Berkedok Lowongan Kerja  #LanjutGAN #LanjutGANsemuakerja #LanjutGANsemuamurah #GanjarSikatKorupsi #GanjarMahfud #GanjarPranowo #GerakCepat #MahfudMD #IndonesiaUnggul #IndonesiaLebihBaik  https://t.co/JZc025d1vV,0,65,13,50,in,132078023,1739968114589380616,officialinews_,https://twitter.com/officialinews_/status/1739968114589380616,,iNews Tower
2023-12-27 18:15:07+07:00,1739968144889008400,kalo Ganjar menang  Mahfud MD jadi wapres pertama yg pernah ngetwit kontol,211,172,2575,10873,in,1247811186957012992,1739968144889008400,howtodresvvell,https://twitter.com/howtodresvvell/status/1739968144889008400,,
2023-12-27 18:19:06+07:00,1739969145503121559,Membakar semangat kader-kader PDI Perjuangan di Blimbingsari  Banyuwangi. Memenangkan partai dalam Pileg &amp; Capres-Cawapres dlm Pilpres adalah satu tarikan nafas.   Jangan Gentar  Ada Ganjar Jangan Takut  Ada Mahfud   #PDIPerjuangan #GanjarMahfud https://t.co/z0tMVUOTkI,4,21,58,355,in,45602536,1739969145503121559,GunRomli,https://twitter.com/GunRomli/status/1739969145503121559,https://pbs.twimg.com/ext_tw_video_thumb/1739969056806219776/pu/img/TYfFbQ6SFDya_18I.jpg,Jakarta
2023-12-27 18:19:28+07:00,1739969239505887606,Momen pengusaha tampan  Ketua TPN Ganjar-Mahfud  bapak @ArsjadRasjid menikmati nasi liwet bareng ibu2 &amp; petani di Karawang  Jawa Barat. Mantap selalu dekat dgn rakyat dan mendengarkan aspirasi rakyat 👌👍🤟 https://t.co/OPLkC2bCRS,3,9,63,307,in,849562015882465280,1739969239505887606,FirzaHusainID,https://twitter.com/FirzaHusainID/status/1739969239505887606,https://pbs.twimg.com/ext_tw_video_thumb/1739969053085855744/pu/img/dyUlL3B-kKOfUGD2.jpg,Jakarta Raya
2023-12-27 18:21:36+07:00,1739969776657830000,Soal Mic kemarin ada yg fitnah Paslon 02 nah sekarang gimana ? Ndoro sudah berstatemen  https://t.co/2mnywlttNs,0,2,3,14,in,1614470115210457090,1739969776657830000,G4b0nGOKU,https://twitter.com/G4b0nGOKU/status/1739969776657830000,,Jakarta Capital Region
2023-12-27 18:22:47+07:00,1739970073279008777,SEPERTINYA GANJAR-MAHFUD  LANGSUNG KALAH DLM COPRAS CAPRES 2024  WONG PEMIMPIN YG VISIONER HARUS GO INTERNASIONAL  PINTAR BAHASA INGGRIS. SPORTIF  JUJUR  TDK PERNAH KORUPSI DAN BERTINDAK NYATA.   BUAT GANJARIS JGN NGEYEL LAGI   DUKUNG PRABOWO-GIBRAN.   https://t.co/UbwAY9SI7Q,13,149,43,126,in,1519324424679608322,1739970073279008777,Maruahalsiahaa2,https://twitter.com/Maruahalsiahaa2/status/1739970073279008777,https://pbs.twimg.com/ext_tw_video_thumb/1739853392086990848/pu/img/1Vn3TGTmM1yrTHfN.jpg,"Setia Budi, Indonesia"
2023-12-27 18:25:00+07:00,1739970631263756501,Ganjar Jelaskan Cara agar Petani Terdaftar jadi Penerima Pupuk Bersubsidi #LanjutGAN #LanjutGANsemuakerja #LanjutGANsemuamurah #GanjarSikatKorupsi #GanjarMahfud #GanjarPranowo #GerakCepat #MahfudMD #IndonesiaUnggul #IndonesiaLebihBaik  https://t.co/N7ZE4rCEMq,0,76,32,65,in,132078023,1739970631263756501,officialinews_,https://twitter.com/officialinews_/status/1739970631263756501,,iNews Tower
2023-12-27 18:30:00+07:00,1739971889391341691,Bapak Ganjar Pranowo  dimohon putranya disuruh tinggal di rumah saja  karena dapat mempengaruhi survey elektabilitas di kalangan milenial. Jika himbauan ini tidak ditanggapi dalam waktu 1 x 24 jam  kami akan mengadukannya ke CGIE.   Ttd    Gemoy-SamSul .  . https://t.co/9EllnVBckF,6,38,142,641,in,2542665199,1739971889391341691,YRadianto,https://twitter.com/YRadianto/status/1739971889391341691,https://pbs.twimg.com/ext_tw_video_thumb/1739964247994765312/pu/img/tMHjgC_DCretxDxo.jpg,"Jawa Barat, Indonesia"
2023-12-27 18:33:42+07:00,1739972823844860046,Capresku kunjungi wisata mata air Cokro  Tulung  Klaten (27/12/23). Masyarakat yang berada dilokasi langsung menyambut Pak Ganjar dgn penuh antusias  anak² juga semuanya bersuka cita menikmati waktu kebersamaan bareng calon pemimpin negeri ini. @ganjarpranowo https://t.co/hzeNT1pqV1,0,1,31,34,in,1249352392954368001,1739972823844860046,denni_sauya,https://twitter.com/denni_sauya/status/1739972823844860046,https://pbs.twimg.com/ext_tw_video_thumb/1739972745549709312/pu/img/FEV2vzLPoePeu9J-.jpg,Selo Kartiko
2023-12-27 18:33:56+07:00,1739972881218748785,Ganjar Pranowo berkunjung dan bertemu dengan Sri Sultan Hamengkubuwono X di Gedung Wilis  Kepatihan  Yogyakarta (27/12/2023). Selaku tuan rumah pun menyambut hangat kedatangan Ganjar. https://t.co/THml28YqB4,0,0,2,9,in,1320760933946331136,1739972881218748785,LArismi11,https://twitter.com/LArismi11/status/1739972881218748785,https://pbs.twimg.com/ext_tw_video_thumb/1739972842232688640/pu/img/QTGnLec0rqGj8IIJ.jpg,
2023-12-27 18:42:40+07:00,1739975080149671961,Jika anda heran mungkin krn fokus ke capresnya saja. Lihat lebih luas. Ada yg hrs juga dijaga prestisenya. PS benar 43 7% aja  msh beban buat JKW. Krn koalisi akan tanya; efek JKW brp? 2019 aja PS 45%. Klu sebenarnya &lt;40% ;Ngefek ga sih dia? Ngertiin lah😁 https://t.co/noLcwj3sDD,0,4,2,12,in,1301052979852619777,1739975080149671961,MartinusButarb1,https://twitter.com/MartinusButarb1/status/1739975080149671961,,"DKI Jakarta, Indonesia"
2023-12-27 18:44:41+07:00,1739975584443466132,Breaking News:  Kehadiran Ganjar ditengah geliat hidup warga Blimbing  Sukoharjo (27/12/2023)  . Satu Keluarga Satu Sarjana  PDIP  17 T  Ahok  Papua  SENANGNYA PULANG KE RUMAH  CSIS  Indikator  Bali  Mantap  Fore  Psikolog  Nepo Baby  Menhan  Buang  Kece Pilpres  Ketua KPK https://t.co/RPlIci7RXx,0,2,7,17,in,1244292531090624512,1739975584443466132,YudhaShanny2,https://twitter.com/YudhaShanny2/status/1739975584443466132,https://pbs.twimg.com/ext_tw_video_thumb/1739975473441247232/pu/img/WIFV9-v7QxpiOpiu.jpg,Indonesia
2023-12-27 18:44:47+07:00,1739975609722532262,Dukungan untuk Ganjar-Mahfud terus mengalir dari berbagai kalangan kali ini datang dari Barisan Tuan Guru Muda Nusantara di NTB https://t.co/dcqzvO0BWy,7,12,65,291,in,1576577082909691904,1739975609722532262,devy_casanofa,https://twitter.com/devy_casanofa/status/1739975609722532262,https://pbs.twimg.com/ext_tw_video_thumb/1739975419657629696/pu/img/YqjW14QD03Uu4z3S.jpg,"Bandung, Jawa Barat"
2023-12-27 18:48:00+07:00,1739976421446164924,Ahok tegaskan Ganjar-Mahfud yg paling mampu sikat habis koruptor. Ahok tuh paham siapa paslon yg serius berantas korupsi dan yg enggak.  Yg tegas dan tanpa ampun kepada para koruptor hanya paslon nomor 03.  Gaskeun 🤟🤟🔥  #GanjarMahfud2024 https://t.co/Mn6VzguMMD,4,35,96,516,in,84221579,1739976421446164924,narkosun,https://twitter.com/narkosun/status/1739976421446164924,https://pbs.twimg.com/media/GCWjGAibQAA1E8J.jpg,Indonesia
